기기구분,NO.,작업일,진행카페,작업ULR,닉네임,댓글내용,,카페 댓글
,1295,2025.08.28,성형위키백과,https://cafe.naver.com/juliett00/1496085,몽베스트,미간주름보톡스 했다가 인상 굳는 거 진짜 저도 걱정이요ㅠ 쿨페이즈는 자연스럽나요?,,
,1296,2025.08.28,성형위키백과,https://cafe.naver.com/juliett00/1496085,소미닌,네네 완전 자연스럽게 개선돼요~ 표정 어색해지는 거 전혀 없어서 넘 만족스러웠어요!!,,
,1297,2025.08.28,성형위키백과,https://cafe.naver.com/juliett00/1496085,윤찌마미,리프테라 쿨페이즈 가격대 어느정도에요? 미간주름보톡스랑 차이 큰가요?,,
,1298,2025.08.28,성형위키백과,https://cafe.naver.com/juliett00/1496085,소미닌,저는 병원마다 좀 달랐는데 쿨페이즈가 보톡스보단 쪼금 비쌌어요! 근데 효과나 자연스러움 생각하면 돈 안아까움~,,
,1299,2025.08.28,재잘재잘,https://cafe.naver.com/knife67/401779,쩡이야믿어,필러 하고 나서 멍은 얼마나 갔어요? ㅠ 저 멍 드는 거 무서워서요..,,
,1300,2025.08.28,재잘재잘,https://cafe.naver.com/knife67/401779,예지닝,필러는 멍 3일정도 간거 같아요! 좀 걱정했는데 생각보다 금방 가라앉아서 별로 티 안났어요~,,
,1301,2025.08.28,재잘재잘,https://cafe.naver.com/knife67/401779,미래지향,리프테라랑 쿨페이즈 효과는 진짜 오래 가나요? 탄력 진짜 챙기고싶어서요~,,
,1302,2025.08.28,재잘재잘,https://cafe.naver.com/knife67/401779,예지닝,아직 한달은 안됐는데요~ 애굣살필러도 그렇고 얼굴 라인도 아직 탄탄하게 유지돼요! 꾸준히 하면 효과 쭉 갈듯!,,
,1303,2025.08.28,여우야+,https://cafe.naver.com/fox5282/4355403,연구쟁이,헉 저도 미간주름 너무 고민인데 리프테라 쿨페이즈 효과 오래가나요?~,,
,1304,2025.08.28,여우야+,https://cafe.naver.com/fox5282/4355403,미요닝,저도 처음 해봐서 오래가는지는 더 두고봐야할거 같은데 일단 한달은 진짜 차이 있어요~ 담에 또 후기 올릴게요!,,
,1305,2025.08.28,여우야+,https://cafe.naver.com/fox5282/4355403,마음속여인집,시술 후 붓기나 멍은 없었나요? 막 티 많이 나면 부담스러워서요ㅠ,,
,1306,2025.08.28,여우야+,https://cafe.naver.com/fox5282/4355403,미요닝,저는 붓기 거의 없었고 멍도 안 생겼어요~ 바로 일상생활 무리없이 가능했어요ㅎㅎ 걱정마셔용!,,
,1307,2025.08.28,성형위키백과,https://cafe.naver.com/juliett00/1496085,몽베스트,미간주름보톡스 했다가 인상 굳는 거 진짜 저도 걱정이요ㅠ 쿨페이즈는 자연스럽나요?,,
,1308,2025.08.28,성형위키백과,https://cafe.naver.com/juliett00/1496085,소미닌,네네 완전 자연스럽게 개선돼요~ 표정 어색해지는 거 전혀 없어서 넘 만족스러웠어요!!,,
,1309,2025.08.28,성형위키백과,https://cafe.naver.com/juliett00/1496085,윤찌마미,리프테라 쿨페이즈 가격대 어느정도에요? 미간주름보톡스랑 차이 큰가요?,,
,1310,2025.08.28,성형위키백과,https://cafe.naver.com/juliett00/1496085,소미닌,저는 병원마다 좀 달랐는데 쿨페이즈가 보톡스보단 쪼금 비쌌어요! 근데 효과나 자연스러움 생각하면 돈 안아까움~,,
,1311,2025.08.28,여우야,https://cafe.naver.com/feko/9844502,오레오가루,"자연스럽게 리프팅 되는거 찾으심 쿨페이즈도 괜찮아용 ㅋㅋ 이건 통증이나 멍, 붓기도 전혀 없어서 입문용으로 좋더라구요 얼굴선이랑 자연스럽게 매끈해지고 턱선도 또렷해졌어요",,
,1312,2025.08.28,여우야,https://cafe.naver.com/feko/9844398,오레오가루,이중턱이랑 주름개선에 쿨소닉+쿨페이즈 조합도 괜찮아요 무통시술이라서 확실히 통증도 없구요 얼굴살 늘어진게 리프팅 되면서 주름개선도 되고 이중턱도 갸름해졌어용!,,
,1313,2025.08.28,여우야,https://cafe.naver.com/feko/9843830,오레오가루,저는 쿨페이즈 받았어요! 일단 이거는 쿨링시스템 있어서 통증도 없구요 피부탄력 탱탱해지면서 얼굴살 늘어진거 리프팅으로 싹 정리됐어요 ㅎㅎ 윤곽이 확실히 또렷해지더라구요,,
,1314,2025.08.28,여우야,https://cafe.naver.com/feko/9843981,오레오가루,얼굴살이 늘어지면 중안부기 길어보여요 그래서 리프팅으로 정리해주시는게 좋은데용 저는 쿨페이즈로 받았는데 충분히 살 처진거 정리되면서 중안부도 다시 짧아지는 느낌이더라구요 얼굴선도 매끈하게 정리됐어요,,
,1315,2025.08.28,여우야,https://cafe.naver.com/feko/9844046,오레오가루,"주름은 피부탄력 개선되면 자연스럽게 정리되더라구용? 전 쿨페이즈 받았는데 피부탄력 쫀쫀해지면서 주름, 피부결도 같이 좋아졌어요 쿨링기능 있어서 열감이나 통증도 없고 멍, 붓기도 안들었네요",,
,1316,2025.08.28,여우야+,https://cafe.naver.com/fox5282/4355970,연어장새우,저도 턱선 무너짐 때문에 스트레스였는데 쿨페이즈 받고 해결했어요 ㅋㅋㅋ턱살 늘어진 부분들 리프팅으로 쫙 땡겨주니깐 갸름해지면서 턱선도 또렷하게 살아나더라구요 그리고 얼굴잔주름도 개선되구요,,
,1317,2025.08.28,여우야+,https://cafe.naver.com/fox5282/4355630,연어장새우,이중턱살은 리프팅 ㄱㄱ하세요 쿨페이즈 받았는데 턱살 늘어진거 정리되면서 턱선 갸름해졌어요 확실히 받고나서 셀카 찍으니깐 이제 이중턱이 안보여요!!!!!! 무통시술이라 통증 1도 없었어요,,
,1318,2025.08.28,여우야+,https://cafe.naver.com/fox5282/4354816,연어장새우,온다는 잘 모르겠구 저는 쿨페이즈 받았는데 이것도 효과 좋아용 일단 안아픈 시술이라서 마취 안해도 되구요 피부탄력 채워지면서 울퉁불퉁했던 얼굴라인도 매끈해졌어요,,
,1319,2025.08.28,여우야+,https://cafe.naver.com/fox5282/4355332,연어장새우,이게 살이 늘어지면서 중안부가 길어보이더라구요 그래서 전 쿨페이즈 리프팅 받았는데 피부탄력도 쫀쫀해지고 살 늘어진거 리프팅 되면서 요즘 다시 동안이라는 소리 듣고 있어요 ㅋㅋㅋ 대만족입니다,,
,1320,2025.08.28,여우야+,https://cafe.naver.com/fox5282/4354726,연어장새우,피부 얇으시면 써마지요~ 고주파로 받으시는게 좋구요 근데 써마지는 통증이 좀 있는 편이라서 저는 걱정되더라구요 ㅜㅜ 그래서 쿨페이즈로 대신 받았어요 이거는 쿨링기능 있어서 통증도 없구요 얼굴살 리프팅 되면서 윤곽 또렷하게 다시 살아났어요 얼굴형도 갸름해지구요,,
,1321,2025.08.28,성형위키백과,https://cafe.naver.com/juliett00/1496048,과일맛젤리,저는 쿨소닉이랑 쿨페이즈 이 조합으로 받았어용 이것도 초음파+고주파 조합인데 무통시술이라서 통증이 없어요 피부탄력 쫀쫀해지면서 주름개선도 되고 턱살 늘어진거 정리되면서 턱선도 살아났어요,,
,1322,2025.08.28,성형위키백과,https://cafe.naver.com/juliett00/1495976,과일맛젤리,"엇 저는 쿨페이즈 리프팅 받았는데 일주일 좀 지나니깐 효과 바로 나왔어요 ㅋㅋ 이거는 다운타임 없는 시술이라서 효과가 빨라요 그래서 중요한 약속 있을때 받기 좋아요 멍, 붓기도 없어서 일상생활도 바로 가능하구요",,
,1323,2025.08.28,성형위키백과,https://cafe.naver.com/juliett00/1495985,과일맛젤리,"네 ㅜㅜ아파서 심지어 수면 하시는 분들도 있어요 전 아픈건 싫어서 쿨페이즈로 받았어요 이건 쿨링시스템 있어서 전혀 안아파요 멍이나 붓기도 없구용 피부탄력이랑 잔주름, 피부결개선까지 한번에 효과 봤어요",,
,1324,2025.08.28,성형위키백과,https://cafe.naver.com/juliett00/1495873,과일맛젤리,실 보다는 레이저로 받아보세요 저는 쿨페이즈 받았는데 전체적으로 얼굴살 늘어진 부분들 리프팅 되면서 턱선도 정리되고 얼굴 윤곽도 또렷지더라구요 통증없는 시술이라 부담없이 받기 괜찮아요 :),,
,1325,2025.08.28,성형위키백과,https://cafe.naver.com/juliett00/1495767,과일맛젤리,"볼살 처짐 때문에 팔자주름도 진해보여서 저는 쿨페이즈로 받았어요 살 처진 부분 리프팅 되니깐 팔자주름도 자연스럽게 연해지고 피부결도 같이 좋아지더라구요 통증이랑 멍, 붓기 없는 시술이라 바로 일상생활도 가능했어요",,
,1326,2025.08.28,여생남정,https://cafe.naver.com/suddes/3951736,러키럭키비키,일단 레이저로 받으셔도 될 것 같아요 저희 엄마도 써마지 받으려다가 통증 걱정되셔서 쿨페이즈로 받으셨어요! 피부탄력 확실히 탱탱해지고 살처진거도 리프팅으로 정리됐어요~,,
,1327,2025.08.28,여생남정,https://cafe.naver.com/suddes/3951653,러키럭키비키,전 그래서 쿨페이즈 리프팅 받았어요 전체적으로 얼굴살 처진거 리프팅 되니깐 입가나 팔자주름도 정리되더라구요 피부탄력 쫀쫀해지고 피부결까지 같이 좋아져서 찐만족했어요 ㅋㅋ,,
,1328,2025.08.28,여생남정,https://cafe.naver.com/suddes/3951565,러키럭키비키,"예신이면 리프팅 필수쥬 ㅋㅋ 그리고 효과 빠르게 나오는거로 받아 보세용 전 쿨페이즈 받았는데 다운타임 없이 얼굴살 처진거 싹 정리되고 얼굴라인도 매끈해졌어요 멍, 붓기도 안나오기 때문에 웨촬전에 받아도 좋아요",,
,1329,2025.08.28,여생남정,https://cafe.naver.com/suddes/3951607,러키럭키비키,팔자주름은 쿨페이즈 리프팅 받아보세용 심부볼이랑 불독살 처진거 리프팅 되면서 팔자주름도 정리됐어요 ㅋㅋ 피부결도 좋아졌고 멍 붓기 안들어서 바로 다음날 출근도 했습니당 참고로 무통시술이에요,,
,1330,2025.08.28,여생남정,https://cafe.naver.com/suddes/3951486,러키럭키비키,주사 말구 레이저리프팅 받아 보세요 저는 쿨페이즈 받고 얼굴살 처진거 리프팅으로 정리해주니깐 팔자주름 흐려졌어요 팔자가 흐려지니 진짜 인상이 좋아보여요 ㅜㅜ 쿨링기능 있어서 아프지도 않아요,,
,1331,2025.08.28,시크먼트,https://cafe.naver.com/parisienlook/5546771,원키더맥스,얼굴살 없으심 고주파 받으셔야 되고 저는 쿨페이즈로 받았어요 저도 써마지 대신 받은건데요 이건 쿨링시스템 있어서 통증이 1도 없었구요 피부탄력 탱탱해지면서 피부결도 같이 좋아졌어용 잔주름 개선도 되구요,,
,1332,2025.08.28,시크먼트,https://cafe.naver.com/parisienlook/5545922,원키더맥스,"다운타임 없이 효과 빠른거는 쿨페이즈도 괜찮아요 이것도 쿨링기능 있어서 통증 전혀 없구요 멍, 붓기도 안나오더라구요 그래서 저는 동창회 전에 받았는데 다들 왜이렇게 피부가 좋냐고 놀랬었어요",,
,1333,2025.08.28,시크먼트,https://cafe.naver.com/parisienlook/5545724,원키더맥스,중년이면 확실히 크림같은거로는 개선이 안되더라구요 ㅠㅠ 저희 엄마 그래서 이번에 쿨페이즈 리프팅 시켜드렸어요 통증없는 시술이라서 부담없이 시켜드리기 괜찮더라구요 피부탄력도 탱탱해지고 잔주름개선에도 효과 보셨어요,,
,1334,2025.08.28,시크먼트,https://cafe.naver.com/parisienlook/5546750,원키더맥스,"여러군데 상담 받아 보는게 젤 좋아요 저도 여러군데 상담 받아 보고 쿨페이즈로 받았거든요~ 자극, 통증이 예민한 편인데 이건 냉각기능이 있어서 열감이랑 통증이 없어서 피부에 자극이 없었어요. 확실히 늘어진 살들 리프팅 해주니 얼굴윤곽이 또렷해지더라구요",,
,1335,2025.08.28,성형위키백과,https://cafe.naver.com/juliett00/1496538,나의그늘아래숲,그럼용! 거상 말고 저는 쿨페이즈로 리프팅 받았는데 충분히 얼굴살 처진거 리프팅 되면서 윤곽도 살아났어요~ 쿨링기능 있어서 아프지 않고 따뜻한 느낌만 들더라구요,,
,1336,2025.08.28,여우야,https://cafe.naver.com/feko/9845733,비니무니,"쿨페이즈 레이저리프팅도 괜찮아요 턱살 늘어진거 리프팅으로 싹 정리해주니깐 갸름해지고 턱선도 살아났어요~~ 아프지 않고 멍, 붓기도 안들어서 바로 일상생활도 가능합니다요",,
,1337,2025.08.28,여우야,https://cafe.naver.com/feko/9845477,비니무니,"쿨페이즈 리프팅이여 ㅋㅋㅋ 가격도 착하고 통증이나 멍, 붓기도 없기 때문에 평소에 받기 괜찮아요 받고 나면 피부탄력 쫀쫀해지고 피부결까지 좋아져서 화장도 잘먹어요",,
,1338,2025.08.28,여우야+,https://cafe.naver.com/fox5282/4356274,불타는그룹,그럼요 요즘에는 다 관리하는 추세라서 저희 남편도 저랑 같이 받아요ㅋㅋㅋ 이번에 쿨페이즈 리프팅 받았는데 남편 얼굴살 늘어져서 진짜 너부대대 했던거 싹 정리됐어요 만나는 사람마다 살빠졌냐고 물어본데요 갸름해져가지구요,,
,1339,2025.08.28,여생남정,https://cafe.naver.com/suddes/3951860,나의그늘아래숲,이중턱은 진짜 리프팅으로도 갸름해져요 ㅋㅋ 저 쿨페이즈 받았는데 턱살 늘어진거 싹 정리되고 턱선도 갸름해지더라구요 요즘 셀카 찍을때 이중턱이 안보여서 너무 좋아요 ㅠㅠ,,
,1340,2025.08.28,여우야,https://cafe.naver.com/feko/9845311,비니무니,저는 쿨페이즈 리프팅 받았어용 볼살 처진거 리프팅으로 정리해주니깐 팔자주름 확실히 흐려지더라구요 인상자체가 확 바꼈어요~ 쿨링시스템 있는 시술이라서 통증없어서 좋았어요,,
,1341,2025.08.28,여우야,https://cafe.naver.com/feko/9826275,양산쓰는방법,쿨페이즈 레이저 리프팅 했는데 상담이라도 받아보세요!! 통증 저는 거의 못느꼈고 시술후 피부 탱탱하니 쫀쫀해요ㅋㅋ 쿨소닉도 설명 들었는데 필요하면 같이 하는것도 괜찮죠,,
,1342,2025.08.28,동탄스토리,https://cafe.naver.com/minskin7679/96451,누룽지호박,"샷수는 과하지않고 저한테 딱 필요한만큼 하는게 좋겠죠?? 쿨페이즈가 찾아보니 통증, 멍, 붓기 없다고 하던데 상담이라도 가봐야겠어요",,
,1343,2025.08.28,여우야,https://cafe.naver.com/feko/9845552,아침마다인사,"맞아요 쿨페이즈가 쿨링시스템으로 피부표면 열감, 과열 방지하면서 레이저 리프팅 해주잖아요 제가 겁이 정말 많은데 통증보다는 따뜻함이 쌓인다?는 느낌정도지 아프지는 않아서 편했어요",,
,1344,2025.08.28,여우야,https://cafe.naver.com/feko/9842957,아침마다인사,나이먹을수록 통증에 대한 무서움이 더 커지더라고요? 쿨페이즈는 쿨링기능으로 열감도 조절해주고 따뜻한 느낌이라고 할까요? 통증이랑 다운타임 없어서 좋았어요,,
,1345,2025.08.28,지후맘,https://cafe.naver.com/1msanbu/3214004,라이스한끼,쿨페이즈 쿨링시스템이 열감을 조절해준다는거죠?? 직당 다니는 입장에서 피부에 자국이 남거나 붓기가 오래가면 부담이 큰데 이건 거의 없다니 출근 문제는 없겠어요^^,,
,1346,2025.08.19,여우야+,https://cafe.naver.com/fox5282/4335597,오늘도과몰입,리프테라2랑 쿨페이즈 저도 만족중이에요! 처진살은 쭉 땡겨주고 피부결도 매끈해지는데 이 조합 받고나서부터 동안소리 들어요 ㅋㅋ,,
,1347,2025.08.19,여우야,https://cafe.naver.com/feko/9810793,치즈폭탄주먹밥,오 슈링크랑 리프테라2 같이 받으면 어때요? 저는 리프테라2랑 쿨페이즈 같이 받았었는데 시너지 좋아서 만족중이거든요! 리프테라2는 통증 없었는데 슈링크는 어땠어요?! 궁금해요!,,
,1348,2025.08.19,여우야+,https://cafe.naver.com/fox5282/4335592,오늘도과몰입,처진살에 리프테라2 진짜 효과 좋은거 같아요 저도 처진살들 리프팅되니깐 한결 보기 좋아졌어요! 쿨페이즈도 같이 받으니깐 피부 탄력도 살아나고~ 둘다 다운타임 없어서 일상생활 바로 가능한거 너무 만족해요!,,
,1349,2025.08.19,여우야+,https://cafe.naver.com/fox5282/4336427,오늘도과몰입,저는 리프테라2랑 쿨페이즈 같이 받았어요! 둘다 같이 받아도 금액적으로 부담 없는데 붓기까지 없어서 맘편히 관리중이에요~,,
,1350,2025.08.19,여우야,https://cafe.naver.com/feko/9809223,치즈폭탄주먹밥,저는 쿨페이즈랑 리프테라2 조합해서 받았는데 400샷 600샷 받았었어요~ 피부상태에 따라서 맞춤으로 받는게 중요해서 상담 받고 받아보세요!,,
,1351,2025.08.19,성형위키백과,https://cafe.naver.com/juliett00/1489647,심쿵주의보,저도 리프테라2랑 쿨페이즈 조합으로 받았는데 효과 너무 만족하고있어요~ 가격이나 붓기 없는거 생각하면 진짜 잘받았구나 생각들어요~,,
,1352,2025.08.19,성형위키백과,https://cafe.naver.com/juliett00/1490250,심쿵주의보,저는 리프테라2랑 쿨페이즈 조합으로 받았었는데 효과 확실해서 만족중이에요! 얼굴선 정리되면서 피부도 매끈해져서 하나만 받는것보다 효과 더 크게 느껴져요! 가격적으로 부담도 없고 다운타임도 없는 조합이라 이조합도 한번 알아보세요~,,
,1353,2025.08.19,재잘재잘,https://cafe.naver.com/knife67/392471,새벽감성쟁이,쿨페이즈랑 리프테라2 조합 효과 좋아서 저도 만족하고있어요! 초음파+고주파 같이 시술 받는데도 비용도 부담 없고 다운타임도 없어서 진짜 편하게 받았어요 ㅎㅎ,,
,1354,2025.08.19,재잘재잘,https://cafe.naver.com/knife67/392689,새벽감성쟁이,저는 리프테라2랑 쿨페이즈 받았는데 이중턱 개선되면서 얼굴 갸름해지고 피부결도 좋아져서 완전 만족중이에요~ 가격이랑 다운타임 고려해서 받았는데 만족도가 높아서 꾸준히 받고 있어요!,,
,1355,2025.08.21,성형위키백과,https://cafe.naver.com/juliett00/1491495,방울도깨비,맞아욬ㅋ 저도 진짜 리프테라2랑 쿨페이즈 조합으로 받았는데 다른리프팅 하나도 안부러움... 효과도 효과인데 받고나서 붓기랑 멍 없는거 진짜 편했어요!,,
,1356,2025.08.21,성형위키백과,https://cafe.naver.com/juliett00/1490646,방울도깨비,리프테라2가 목주름까지 케어되서 진짜 좋은거같아요 저도 리프테라2+쿨페이즈 조합으로 받고나서 주름이면 주름 피부결이면 피부결 같이 개선되서 완전 만족중이네요 ㅎㅎ,,
,1357,2025.08.21,재잘재잘,https://cafe.naver.com/knife67/395138,빙수팡,저도 리프테라2랑 쿨페이즈 받고나서 효과만족중이에요! 피부 탱탱해지면서 얼굴선 갸름해지니깐 주변에서 뭐했냐고... 알려주니깐 친구도 바로 받더라고요 ㅋㅋ,,
,1358,2025.08.21,재잘재잘,https://cafe.naver.com/knife67/394163,빙수팡,저는 리프테라2랑 쿨페이즈 조합 꾸준히 받고있어요 둘다 같이 받아도 비용부담 적은데 통증이랑 붓기도 없어서 꾸준히 관리해주기 편해요,,
,1359,2025.08.21,재잘재잘,https://cafe.naver.com/knife67/393866,빙수팡,쿨페이즈랑 리프테라2 조합 시너지 너무 좋아서 저도 주변 지인들한테 추천 많이 해줬어요 ㅋㅋ 추천해줘도 부담 없는게 효과 좋은데 붓기랑 멍 없어서 다들 만족하더라고요~,,
,1360,2025.08.21,파우더룸,https://cafe.naver.com/cosmania/38197086,호기심탐험가,20대면 울써마지보다는 리프테라2+쿨페이즈 이렇게 받아보세요 저는 이조합 받고나서 효과 만족해서 꾸준히 받고있어요~ 가격도 부담 없는데 통증이랑 다운타임도 없어서 관리하기 좋아요,,
,1361,2025.08.21,파우더룸,https://cafe.naver.com/cosmania/38197021,호기심탐험가,리프팅 고민이시면 리프테라2+쿨페이즈도 한번 알아보세요 저 이거 받고나서 처진살이랑 이중턱 확 개선됐고 피부결도 매끈해져서 너무만족중이거든요~ 가격도 합리적이라 받는데 부담 없어요!,,
,1362,2025.08.22,여우야+,https://cafe.naver.com/fox5282/4343508,달콤쫀득이,리프테라2랑 쿨페이즈 조합 리프팅이 가격으로보나 효과로보나 저도 너무 만족스러워요~ 받고나서 다운타임이 없어서 리프팅 하고도 바로 일상생활 가능한것도 맘에들구요 ㅎㅎ,,
,1363,2025.08.22,여우야+,https://cafe.naver.com/fox5282/4340759,달콤쫀득이,저도 리프팅 받을거면 리프테라2랑 쿨페이즈 조합 추천해요 얼굴선정리랑 피부결 개선 한번에 가능한데 가격부담이 없어서 꾸준히 받게되더라고요,,
,1364,2025.08.22,여생남정,https://cafe.naver.com/suddes/3948948,별빛담요,저도 탄력이랑 이중턱 고민때문에 리프테라2+쿨페이즈 조합으로 받았는데 효과 확실히 만족중이에요~ 두개 같이 받아도 다른 리프팅보다 가격 괜찮은데 초음파+고주파 같이 효과 볼수 있어서 전 이조합 좋더라고요~,,
,1365,2025.08.22,여생남정,https://cafe.naver.com/suddes/3949078,별빛담요,처지고 푸석한거 느껴지시면... 리프테라2랑 쿨페이즈 같이 받는거 좋아요 저도 이 조합으로 받고나서 처진살 리프팅 되면서 피부결도 매끈해져서 완전 만족중이거든요!,,
,1366,2025.08.22,여생남정,https://cafe.naver.com/suddes/3948988,별빛담요,탄력에 쿨페이즈 효과 좋아요! 저는 리프테라2랑 같이 받았는데 피부 탱탱해지면서 처진살이랑 이중턱도 개선 됐어요! 같이 받아도 가격이 부담 없어서 전 이조합 추천해요~,,
,1367,2025.08.22,성형위키백과,https://cafe.naver.com/juliett00/1492414,초코머핀중독,"저도 쫄보라 통증,부작용 이런거 무서워서 리프팅 못받다가 리프테라2랑 쿨페이즈 알고나서 이 조합으로 받았는데 그동안 고민한거 싹다 보상받은 느낌이에요~ 효과도 좋은데 부작용 걱정 없이 받으니깐 너무 좋더라고요 ㅎㅎ",,
,1368,2025.08.22,재잘재잘,https://cafe.naver.com/knife67/396497,미소위커피,저도 리프테라2 쿨페이즈 조합 받고나서 얼굴선이랑 피부결 동시에 좋아져서 너무 만족중이에요! 가격도 부담 없어서 꾸준히 받을수 있는게 제일 만족스러워요 ㅎㅎ,,
,1369,2025.08.22,재잘재잘,https://cafe.naver.com/knife67/396090,미소위커피,저는 조합해서 받았을때 효과 진짜 좋더라고요 쿨페이즈랑 리프테라2 조합해서 받았는데 시술중에도 통증 거의 없고 받고나서도 붓기랑 멍 없어서 진짜 편하게 받았어요,,
,1370,2025.08.22,여우야,https://cafe.naver.com/feko/9826275,무화가소녀,저도 쿨페이즈도 한번 받아볼까 고민중이에요 쿨소닉이랑 시너지 좋다던데 저는 쿨소닉은 6000샷 받고 효과만족중이거든요~ 둘다 통증이랑 붓기가 없는데 시너지 좋다니까 괜히 욕심나요ㅠ,,
,1371,2025.08.22,여생남정,https://cafe.naver.com/suddes/3948516,새벽노트,저도 쿨소닉만 받아봤는데 쿨페이즈도 받아보고 싶어요 ㅋㅋㅋ 쿨페이즈도 쿨링 있어서 쿨소닉처럼 통증이랑 자극 없다던데 같이 받으면 시너지 좋다고 하더라고요,,
,1372,2025.08.22,성형위키백과,https://cafe.naver.com/juliett00/1492870,느린호수,둘다 받아보세요 저는 쿨소닉만 받아봤는데 쿨페이즈도 똑같이 안아픈데 효과좋다더라고요 시너지도 좋고 그래서 저도 쿨페이즈 받아볼까 생각중이에요~,,
,1373,2025.08.23,여우야+,https://cafe.naver.com/fox5282/4344940,어제도오늘도수박,저도 볼밑 꺼짐도있고 얼굴 늘쳐져 보였는데 사르티네에서 상담받고 맞춤 솔루션으로 쿨소닉 받고 완전 만족했어요~ 쿨소닉으로 라인정리하고 쿨페이즈로 피부결까지 같이 잡아줘서 인상이 확 젊어졌네요 ㅎㅎ,,
,1374,2025.08.23,여우야,https://cafe.naver.com/feko/9827565,꼬마풍선,저도 사르티네 상담이 좋았던게 제 얼굴 구조랑 피부 상태 꼼꼼하게 체크해주시고 볼 아래 처짐 위주로 쿨소닉+쿨페이즈 조합이 좋다라고 딱 집어주신 거에요! 확실히 맞춤 시술이라 그런지 효과가 자연스럽게 나타나더라구요~,,
,1375,2025.08.23,여생남정,https://cafe.naver.com/suddes/3949563,푸딩에말린콩,울쎄라는 아니고 쿨소닉이랑 쿨페이즈 사르티네에서 받았는데 고민해결 한번에 되서 완전 만족중이에요~ 사르티네도 상담 받아보세요! 원장님이 피부 정확히 봐주시면서 맞춤 솔루션으로 플랜 짜주는데 너무 좋더라고요~ 쿨소닉이랑 쿨페이즈 받고 확실히 얼굴환해지고 또렷해졌어요,,
,1376,2025.08.23,여우야,https://cafe.naver.com/feko/9827038,꼬마풍선,사르티네도 상담 받아보세요~ 저도 원래 리프팅하면 아플까봐 겁 많았는데 사르티네 원장님은 이부분도 고려해서 쿨소닉이랑 쿨페이즈로 시술 추천해주셔서 통증없이 잘 받았어요~ 다운타임도 없어서 진짜 편했는데 사르티네에서 상담 받길 잘한거같아요~,,
