기기구분,NO.,작업일,진행카페,작업ULR,닉네임,댓글내용,,카페 댓글
,1246,2025.08.22,여우야+,https://cafe.naver.com/fox5282/4343758,파스타피자,"탄력효과에 좋은 쿨소닉 추천드려요 냉각기능이 있어 피부표면 보호해주고 열감, 통증이 없거든요 수면마취나 크림마취도 필요하지 않아 부담이 없었구요 시술후 멍자국 남는것도 없네요~",,
,1247,2025.08.22,성형위키백과,https://cafe.naver.com/juliett00/1492557,트렌치블랙,레이저 리프팅이 처음이라면 쿨소닉이라고 무통+고출력이라 아프지않은데 탄력개선에는 확실했어요 냉각방식이라 표피 손상 걱정도 없고 피부 컨디션도 굿~!,,
,1248,2025.08.22,성형위키백과,https://cafe.naver.com/juliett00/1492533,트렌치블랙,"쿨소닉 레이저 리프팅이 펜타입이라 지금 고민하고 있는 얼굴선뿐만 아니라 광대밑, 턱선, 이중턱 등등 촘촘하게 시술이 가능해요ㅎㅎ 저는 얼굴윤곽 정리 예쁘게 됐고 무통증답게 아프지않았네요",,
,1249,2025.08.22,여우야,https://cafe.naver.com/feko/9823412,마들렌마음한스푼,이중턱 정리하고 싶어서 알아보다가 쿨소닉 추천 많이 받아서 시술했어요 처음엔 솔직히 큰 기대 안 했는데 며칠 지나고 턱선 살짝 정리된 거 보고 아 이거다 싶었어요 시술 중간에도 아픈 느낌 없고 쿨링감 있어서 편안하게 받을 수 있었어요,,
,1250,2025.08.22,여우야,https://cafe.naver.com/feko/9824050,마들렌마음한스푼,울쎄라 알아보다 통증 얘기 많아서 바로 포기했는데 쿨소닉은 진짜 조용한 시술 느낌이에요 따끔한 것도 없이 마취 없이 끝났고 끝나고도 아무 흔적 없어서 일상 바로 가능했어요 무리 없이 얼굴 라인 정리되고 자연스럽게 탄력 올라오는 느낌이라 만족!!,,
,1251,2025.08.22,여우야,https://cafe.naver.com/feko/9825625,마들렌마음한스푼,볼살 많은 편이라 전체 리프팅은 좀 걱정됐는데 쿨소닉은 부위 지정이 가능해서 좋았어요 심부볼 피해서 턱선 쪽만 받았는데 은근하게 올라오는 느낌? 표정 변화도 자연스럽고 시술 전후 비교해보면 확실히 달라요~~,,
,1252,2025.08.22,여우야,https://cafe.naver.com/feko/9827117,마들렌마음한스푼,실만 보시나요?? 쿨소닉 받았는데 왜 요즘 다들 이거 하는지 알겠더라구요 피부 예민해서 걱정했는데 자극도 없고 시술 내내 안정적인 느낌 끝나고 나니까 피부가 좀 정돈된 느낌이라 은근 기분 좋았어요ㅋㅋㅋㅋ,,
,1253,2025.08.22,여우야+,https://cafe.naver.com/fox5282/4341976,다정한바람줌,쿨소닉 마취 없이 진행 가능하다는 얘기 듣고 반신반의했는데 진짜로 통증 없이 끝났어요 너무 세지 않은 리프팅이라 얼굴이 자연스럽게 잡히는 게 마음에 들었고요~~,,
,1254,2025.08.22,여우야+,https://cafe.naver.com/fox5282/4345486,다정한바람줌,상황에 따라 다른데 후기 평 원장님 경력? 리프팅 시술 처음이었는데 쿨소닉은 시술 자체가 부드러워서 스트레스 없었어요 쿨링 기능 있어서 따뜻한 느낌도 없고 피부 위에서 부드럽게 움직이는 느낌이었어요ㅋㅋ,,
,1255,2025.08.22,여생남정,https://cafe.naver.com/suddes/3949451,그날의길,저눈 쿨소닉 ㅊㅊ요 저는 눈으로 바로 드라마틱하게 바뀌는 건 원하지 않아서 쿨소닉 선택했거든요 시술 받고 며칠 지났을 때 사람들이 얼굴 갸름해졌다고 얘기해줘서 진짜 신기했어요~~,,
,1256,2025.08.22,여생남정,https://cafe.naver.com/suddes/3949521,그날의길,리프팅이면 쿨소닉 하셔요 ㅋㅋㅋ 쿨소닉은 무통이라 해서 받았는데 진짜 시술 중간에 통증 느낀 적 한 번도 없어요 자극감이 없으니까 받는 내내 긴장 안 해도 돼서 마음 편했어요^^,,
,1257,2025.08.22,여생남정,https://cafe.naver.com/suddes/3949481,그날의길,쿨소닉은 어떠셔요? 울쎄라는 통증이 ㄷㄷ 해서요 피부가 예민한 편이라 자극 주는 시술 잘 못하는데 쿨소닉은 오히려 진정된 느낌이었어요 암튼 받고나서 얼굴선이 슬쩍 올라간 게 거울에서 보이니까 괜히 기분 좋았음,,
,1258,2025.08.22,성형위키백과,https://cafe.naver.com/juliett00/1492705,설탕발린안녕,피부 민감한 편이라 조금만 열감 있어도 바로 붉어지거든요그래서 걱정 많았는데 쿨소닉은 시술 내내 피부가 차분해서 되게 안정적인 느낌이었어요 턱 라인이 살짝 정돈되니까 전체적으로 얼굴도 작아 보이더라구요~~,,
,1259,2025.08.22,시크먼트,https://cafe.naver.com/parisienlook/5539706,크림베이지감성,"전 쿨소닉 추천요~~ 마취 없이도 편하게 받았고, 시술 끝나고 거울 보니까 윤곽 라인 살짝 조여진 느낌? 자연스럽게 올라간 느낌이라 다음에도 또 하고 싶어요ㅋㅋㅋㅋ",,
,1260,2025.08.22,강남엄마vs목동엄마,https://cafe.naver.com/gangmok/1979149,쌉이,쿨소닉 하셔요~~~ 예전엔 써마지 받아봤는데 진짜 많이 아파서 다시는 안 하려고 했거든요 쿨소닉은 냉각 되면서 리프팅이 들어가니까 피부가 오히려 편안하더라구요 시술 전후 비교했을 때 이중턱 쪽이 확실히 다듬어졌어요!!ㅋㅋ,,
,1261,2025.08.22,강남엄마vs목동엄마,https://cafe.naver.com/gangmok/1979538,쌉이,쿨소닉 무통이라고 해서 믿지 않았는데 진짜 통증 없었어요 끝나고 얼굴선이 정돈된 게 느껴지니까 아 이래서 다들 한다는 생각 들었어욤 ㅋㅋ 요것도 담에 함 생각 해보셔요,,
,1262,2025.08.23,재잘재잘,https://cafe.naver.com/knife67/397831,꿈쮸,울쎄라 저도 통증 때문에 망설이고 있었는데 쿨소닉 진짜 하나도 안 아파요??,,
,1263,2025.08.23,재잘재잘,https://cafe.naver.com/knife67/397831,예지닝,네 진짜 찌릿한 거 1도 없고 그냥 누워있으니 끝나더라구요! 저 통증 예민해서 걱정했었는데 괜찮았어요~,,
,1264,2025.08.23,재잘재잘,https://cafe.naver.com/knife67/397831,푸른열차,저도 울쎄라후기만 주구장창 봤는데 쿨소닉은 붓기랑 멍도 별로 없나요??,,
,1265,2025.08.23,재잘재잘,https://cafe.naver.com/knife67/397831,예지닝,네 저는 멍도 진짜 안 들고 붓기도 없었어요~ 바로 화장하고 나와도 티 안 나서 너무 편했어요!,,
,1266,2025.08.23,여우야+,https://cafe.naver.com/fox5282/4346339,가오쓰,와 저도 써마지가격 너무 비싸서 고민만 하다가 아직 못했어요ㅠ 효과 오래가나요?,,
,1267,2025.08.23,여우야+,https://cafe.naver.com/fox5282/4346339,미요닝,저는 지금 3주차쯤 됐는데 아직 탱탱하고 라인도 살아있어요~ 써마지랑은 비교도 안 될 정도로 만족중요ㅎㅎ,,
,1268,2025.08.23,여우야+,https://cafe.naver.com/fox5282/4346339,마음속여인집,쿨소닉 쿨페이즈 동시에 하는 건 가격대 어때요? 써마지보다 저렴해요?,,
,1269,2025.08.23,여우야+,https://cafe.naver.com/fox5282/4346339,미요닝,둘 합쳐도 써마지가격보다 훨씬 저렴했어요! 부담 확 줄어서 저는 이게 훨 나은 거 같아요~,,
,1270,2025.08.23,성형위키백과,https://cafe.naver.com/juliett00/1493268,행복날두,울쎄라 그렇게 아팠어요? 저도 고민했는데ㅠ 쿨소닉 효과 오래가나요?,,
,1271,2025.08.23,성형위키백과,https://cafe.naver.com/juliett00/1493268,소미닌,네ㅠ 진짜 아픈 거 못 참는 분이면 비추에요.. 쿨소닉은 저는 지금 한 달 넘게 계속 유지 중이라 좋아요!,,
,1272,2025.08.23,성형위키백과,https://cafe.naver.com/juliett00/1493268,갈리가리,혹시 쿨소닉 시술시간이랑 부작용 궁금해요~ 무섭진 않죠?,,
,1273,2025.08.23,성형위키백과,https://cafe.naver.com/juliett00/1493268,소미닌,시간은 진짜 금방 끝나고 붓기나 멍 거의 없었어요! 통증 걱정 안 하셔도 돼요~,,
,1274,2025.08.23,재잘재잘,https://cafe.naver.com/knife67/397842,꿈쮸,쿨소닉 효과 유지력은 어느 정도 가는 편인가요? 저도 울쎄라 아파서 무서워요ㅠㅠ,,
,1275,2025.08.23,재잘재잘,https://cafe.naver.com/knife67/397842,달리잖아,저 3달째인데 아직 탄력 유지 잘 돼요~ 울쎄라처럼 붓기도 없고 자연스러워서 저도 강추드려요ㅎㅎ,,
,1276,2025.08.23,재잘재잘,https://cafe.naver.com/knife67/397842,푸른열차,울쎄라 처음 받을 때 혹시 멍이나 트러블 났었나요?,,
,1277,2025.08.23,재잘재잘,https://cafe.naver.com/knife67/397842,달리잖아,저는 멍 좀 들었고 약간 화끈거림 있었어요ㅠ 쿨소닉 할 땐 그런 거 하나도 없어서 비교되더라구요~,,
,1278,2025.08.23,여우야+,https://cafe.naver.com/fox5282/4346350,가오쓰,저도 울쎄라 했는데 진짜 아파서 소리 질렀어요ㅠ 쿨소닉은 완전 다른가요?,,
,1279,2025.08.23,여우야+,https://cafe.naver.com/fox5282/4346350,원쑹잉,진짜 울쎄라랑 비교 자체가 안되요 ㅋㅋ 쿨소닉은 거의 안아프고 효과도 더 오래가서 넘좋아요~,,
,1280,2025.08.23,여우야+,https://cafe.naver.com/fox5282/4346350,김연찌아,붓기 멍 없으면 출근 바로 가능한가요? 울쎄라때는 화장도 힘들었거든요..,,
,1281,2025.08.23,여우야+,https://cafe.naver.com/fox5282/4346350,원쑹잉,저는 쿨소닉하고 거의 바로 일상 복귀했어요~ 울쎄라만큼 티 안나서 다음날도 걱정 없었어요!,,
,1282,2025.08.24,재잘재잘,https://cafe.naver.com/knife67/398090,미래지향,혹시 쿨소닉+쿨페이즈 가격대 괜찮은가요?,,
,1283,2025.08.24,재잘재잘,https://cafe.naver.com/knife67/398090,예지닝,네네! 저는 패키지로 해서 써마지보다 저렴했어요~  네고 좀 해달라고 했더니 좀 깎아주시더라구요 ㅎㅎ,,
,1284,2025.08.24,재잘재잘,https://cafe.naver.com/knife67/398090,풀바다용,진짜 효과가 써마지보다 더 오래가나요?,,
,1285,2025.08.24,재잘재잘,https://cafe.naver.com/knife67/398090,예지닝,제 기준으론 더 오래가는 듯해요! 써마지는 초반만 빡인데 쿨소닉은 진짜 유지력 괜찮았어요~,,
,1286,2025.08.24,여우야+,https://cafe.naver.com/fox5282/4346935,연구쟁이,써마지 진짜 그렇게 아픈가요..? 저도 써마지 고민했는데 쿨소닉이 덜 아프다구요??,,
,1287,2025.08.24,여우야+,https://cafe.naver.com/fox5282/4346935,미요닝,아 진짜ㅠ 써마지는 눈물나게 아픈데 쿨소닉 쿨페이즈는 거의 안 아파요! 저 진짜 신기했어요 ㅋㅋ,,
,1288,2025.08.24,여우야+,https://cafe.naver.com/fox5282/4346935,사랑보다깊은나,쿨소닉 쿨페이즈 효과 얼마 정도 갔는지 궁금해요~ 유지력 어때요?,,
,1289,2025.08.24,여우야+,https://cafe.naver.com/fox5282/4346935,미요닝,한 달 넘었는데 탄력 진짜 아직도 괜찮아요~ 써마지효과보다 오래가는 느낌이라 넘 만족이에요!,,
,1290,2025.08.24,성형위키백과,https://cafe.naver.com/juliett00/1493409,몽베스트,저도 인천울써마지 통증 무서워서 고민만 하다가 못했는데 쿨소닉은 진짜 하나도 안 아파요??,,
,1291,2025.08.24,성형위키백과,https://cafe.naver.com/juliett00/1493409,소미닌,네네 진짜임ㅋㅋ 찌릿하거나 따끔한 것도 없이 그냥 시원한 느낌만 남았어요~ 아픈거 극혐인 분들 진심 강추요!,,
,1292,2025.08.24,성형위키백과,https://cafe.naver.com/juliett00/1493409,그날의끝,쿨소닉이랑 쿨페이즈 효과 바로 느껴져요? 붓기는 며칠 갔는지 궁금해요~,,
,1293,2025.08.24,성형위키백과,https://cafe.naver.com/juliett00/1493409,소미닌,효과는 2주 정도부터 얼굴선 완전 달라져보였고요~ 붓기는 진짜 거의 티 안났어요! 주변에서도 티도 못챘대요 ㅎㅎ,,
,1294,2025.08.24,재잘재잘,https://cafe.naver.com/knife67/398110,미래지향,저도 써마지 고민 중이었는데 쿨소닉 쿨페이즈 진짜 그렇게 좋아요? 효과 얼마나 가요?,,
,1295,2025.08.24,재잘재잘,https://cafe.naver.com/knife67/398110,달리잖아,네ㅠ 써마지 진짜 고통이라 포기요.. 쿨소닉 쿨페이즈 하면 붓기 거의 없고 최소 6달 이상은 쫀쫀하게 가는 거 같아요~ 저는 만족해요!,,
,1296,2025.08.24,재잘재잘,https://cafe.naver.com/knife67/398110,꿈쮸,쿨소닉 쿨페이즈는 가격대도 써마지보다 낮나요? 관리주기 궁금해요~,,
,1297,2025.08.24,재잘재잘,https://cafe.naver.com/knife67/398110,달리잖아,가격은 써마지보다 싸진 않긴 한데 아픔이 없으니까 진짜 돈 안아까워요.. 한 6개월에 한 번씩 추천한다네요~,,
,1298,2025.08.24,여우야+,https://cafe.naver.com/fox5282/4346941,연구쟁이,저도 울쎄라 아파서 겁나는데 쿨소닉은 통증 진짜 하나도 없어요??,,
,1299,2025.08.24,여우야+,https://cafe.naver.com/fox5282/4346941,원쑹잉,네네 쿨소닉은 진짜 아플 틈이 없었어요~ 그냥 누워있다 나왔어요ㅋㅋ,,
,1300,2025.08.24,여우야+,https://cafe.naver.com/fox5282/4346941,마음속여인집,부산울쎄라가격이랑 쿨소닉 가격 차이 좀 많이 나요?,,
,1301,2025.08.24,여우야+,https://cafe.naver.com/fox5282/4346941,원쑹잉,저는 울쎄라보다 쿨소닉이 훨씬 착했어요! 그래서 더 맘 편하게 했던 듯요~,,
,1302,2025.08.25,여우야,https://cafe.naver.com/feko/9830727,헤르메,쿨소닉 받아보세요~ 저는 울쎄라랑 쿨소닉 둘다 상담 받고서는 원장님 추천대로 쿨소닉 7천샷 받기로 했어요! 울쎄라랑 효과 똑같은데 하나도 안아픈 레이저라구 해서 ㅎㅎ,,
,1303,2025.08.25,여우야,https://cafe.naver.com/feko/9830687,헤르메,저는 쿨소닉 받기로 했어요! 울쎄라 상담 받아봤는데 수면 추천해주셔서 ㅜㅜ 원장님이 통증 민감하시면 쿨소닉 받으라 하더라구요 울쎄라랑 효과 똑같다구~~,,
,1304,2025.08.25,여우야+,https://cafe.naver.com/fox5282/4347790,그땐다시,비수면으로도 받을만한가요~!? 저도 울쎄라2랑 쿨소닉 둘 다 알아보고 있는데 쿨소닉은 마취 없이도 받을 수 있다고 해서 같이 상담 받아보려고요,,
,1305,2025.08.25,여우야+,https://cafe.naver.com/fox5282/4347772,그땐다시,저도 턱선이랑 이중턱 살리고 싶어가지고 울쎄라2랑 쿨소닉 알아보는 중이에요.. 울쎄라가 넘 아프다고해서 쿨소닉도 같이 알아봐뒀네요,,
,1306,2025.08.25,여우야+,https://cafe.naver.com/fox5282/4347748,그땐다시,저도 울쎄라 알아보는 중엔인데 수면해야된다구 해서 쿨소닉 같이 상담 받아보려고요.. 쿨소닉은 마취 없이도 받을 정도로 편하다 해서요~!,,
,1307,2025.08.25,여생남정,https://cafe.naver.com/suddes/3949901,만나기를,"턱선 갸름하게 할거면 초음파 레이저가 맞구,, 울쎄라랑 쿨소닉이 유명해요~ 특히 쿨소닉은 마취 없이도 받을 수 있을 정도로 통증이 없다 하더라구요",,
,1308,2025.08.25,여생남정,https://cafe.naver.com/suddes/3949777,만나기를,저도 울쎄라 알아보고 있는데 통증이 어떤 느낌일지 넘 궁금하네요 ㅠㅠ 오죽하면 수면을 하나 싶어서요.. 그래서 쿨소닉도 같이 상담 받아보려고 알아보는중입니당 이건 통증 없다 해서요!,,
,1309,2025.08.25,여생남정,https://cafe.naver.com/suddes/3949588,만나기를,쿨소닉 그렇게 좋나요? 안그래도 울쎄라랑 쿨소닉 둘다 알아보고 상담 받아봐야지 싶었는데...,,
,1310,2025.08.25,여우야,https://cafe.naver.com/feko/9831571,흐무릉,"저도 레이저 알아보고 있는데 울쎄라, 써마지, 쿨소닉 등 종류가 진짜 많네요 ㅠㅠ 턱선 좀 살리고 싶은데 이러면 울쎄라, 쿨소닉 같은 초음파가 더 맞는거 같기도..ㅎㅎ",,
,1311,2025.08.25,여우야,https://cafe.naver.com/feko/9831111,흐무릉,"상담 때 원장님이 쿨소닉 추천 많이 하시던가요? 저도 레이저 알아보고 있는데 턱선 살리려면 쿨소닉, 울쎄라가 좋다는데 울쎄라는 넘 아프다고 해서요 ㅠㅠ",,
,1312,2025.08.25,여우야,https://cafe.naver.com/feko/9830584,흐무릉,"쿨소닉 효과 좋은 레이저 맞죠? 저도 처음으로 레이저 받아보려고 알아보는 중인데 아픈 레이저, 안아픈 레이저가 있던데 쿨소닉은 안아프다고 해서 받아볼까 싶어서요~!",,
,1313,2025.08.25,여생남정,https://cafe.naver.com/suddes/3949982,인기팝,저도 울쎄라랑 쿨소닉 생각중인데 울쎄라 받게 되면 수면으로 받아야되나 싶어요 다들 넘 아프다고 해서 ㅠㅠ 쿨소닉은 안아프다고 해서 걱정 없긴한데 상담 받아보고 정하려고요,,
,1314,2025.08.25,여생남정,https://cafe.naver.com/suddes/3949901,인기팝,턱선 살리는데는 울쎄라도 좋고 쿨소닉도 좋대요! 저는 쿨소닉도 같이 알아봐놨는데 이게 무통 수준으로 안아프고 편하게 받을 수 있는데 효과는 또 좋다 하더라구요!,,
,1315,2025.08.25,여생남정,https://cafe.naver.com/suddes/3949895,인기팝,헉 완전 종합으로 제대로 받으셨네요... 부럽..ㅠㅠ 저도 쿨소닉 알아보고 있는데 이거 진짜 통증이 없다시피 할 정도로 편하게 받을 수 있었나요? 젤 궁금한 레이저예요 ㅠㅠ,,
,1316,2025.08.25,성형위키백과,https://cafe.naver.com/juliett00/1493639,노란통닭,저도 아픈거 너무 싫어서 티타늄이랑 쿨소닉 두가지 알아보고 있어요! 입문하는데 아픈거 맞으면 레이저를 앞으로 안맞을거 같은..ㅋㅋㅋㅋ,,
,1317,2025.08.25,성형위키백과,https://cafe.naver.com/juliett00/1493528,노란통닭,울쎄라 알아보다가 너무 아프다고 해서 포기..ㅠㅠ 그래서 쿨소닉이랑 티타늄 알아보고 있어요 이 두가지는 진짜 안아프다 하더라구요!,,
,1318,2025.08.25,성형위키백과,https://cafe.naver.com/juliett00/1493276,노란통닭,쿨소닉은 얼굴 전체 기준 6~7천샷 받으면 된다 하더라구요~ 펜타입이라서 라인 타입이랑은 샷수개념이 좀 다른거로 알고 있어요,,
,1319,2025.08.25,여우야,https://cafe.naver.com/feko/9831592,꼬기량,저도 남자인데 인모드랑 쿨소닉 상담 잡아뒀어요 ㅎㅎ 턱쪽 갸름하게 하고 싶은데 이게 이중턱에도 좋고 턱선 살리기 좋다 해서요~,,
,1320,2025.08.25,여우야,https://cafe.naver.com/feko/9832108,꼬기량,저도 쿨소닉 상담 잡아놨어요! 레이저가 처음이다 보니까 안아픈거로 알아봤는데 쿨소닉이 턱선 살리기 좋은데 안아프기까지 하다고 해서요~,,
,1321,2025.08.25,여우야,https://cafe.naver.com/feko/9831371,꼬기량,쿨소닉 좋대요! 저도 쿨소닉+인모드 같이 상담 잡아뒀는데 둘중 안아프고 효과 좋다는거 원장님께 추천받아보려고요~ 쿨소닉이 턱선 살리기 좋다더라구요,,
,1322,2025.08.25,여우야+,https://cafe.naver.com/fox5282/4347856,해야할지,"맞아요 초음파가 이중턱이랑 턱선에 좋대요! 저두 초음파 쪽으로 알아봤는데 리프테라, 쿨소닉을 많이 받는거 같아서 이 두가지로 알아봐놨어요~!",,
,1323,2025.08.25,여우야+,https://cafe.naver.com/fox5282/4347506,해야할지,저도 쿨소닉 알아본건데 쿨페이즈는 통증 어땠어요? 쿨소닉은 진짜 아예 안아프다 시피할 정도로 다들 편하게 받는다 하더라구요 ㅎㅎ,,
,1324,2025.08.25,여우야+,https://cafe.naver.com/fox5282/4347772,해야할지,저도 울쎄라 알아보다가 쿨소닉으로 상담 가보려고요! 울쎄라 수면으로 받아야될 정도로 아프다는데.. 수면하면서까지 레이저 받기 싫어서 쿨소닉으로 알아봤어요,,
,1325,2025.08.25,여생남정,https://cafe.naver.com/suddes/3950029,듀공장군,저도 아픈거 싫어서 쿨소닉으로 상담 받아보고 왔어요~ 리쥬란도 같이 받으려고 했는데 원장님이 손주사로는 아플테니까 쿨소닉만 받으라구..ㅋㅋㅋㅋ 그정도로 통증 있는거 싫은데 쿨소닉은 추천하시더라구요,,
,1326,2025.08.25,여생남정,https://cafe.naver.com/suddes/3950160,듀공장군,저도 울쎄라 받으려다가 너무 아프다 해서 쿨소닉으로 노선변경했어요.. 이거 상담 받고 왔는데 원장님도 진짜 통증 없게 잘 나왔다 하시더라구요,,
,1327,2025.08.25,여생남정,https://cafe.naver.com/suddes/3949947,듀공장군,저도 쿨소닉이랑 리쥬란 같이 받으려고 상담 다녀왓는데 리쥬란 포기요..ㅋㅋㅋ 원장님이 손주사로 받으면 진짜 아플거라고해서 쿨소닉만 받아보기로 했어요! 쿨소닉만 받아도 턱선 많이 살아난다고 하셔서요~!!,,
,1328,2025.08.26,여우야,https://cafe.naver.com/feko/9838298,씨씨랑,초음파가 탄력보다는 처진거 잡는데 좋다고 보시면 돼요! 부모님이면 쿨소닉도 알아보세요~ 제가 울쎄라 대신 받은건데 하나도 안아파서 넘 편하게 받았네요,,
,1329,2025.08.26,여우야,https://cafe.naver.com/feko/9838274,씨씨랑,쿨소닉 있는곳 가보세요~ 요즘에 쿨소닉 많이 받는다 해서 저도 받아봤는데 울쎄라 효과 나오는데 받을 때 하나도 안아파서 넘 좋았던 레이저예요 ㅎㅎ,,
,1330,2025.08.26,여우야,https://cafe.naver.com/feko/9838247,씨씨랑,거기 쿨소닉 있나요? 쿨소닉 있으면 이거도 물어보세요! 울쎄라 대신 받았는데 효과 똑같고 하나도 안아파서 진짜 편하게 받았거든요,,
,1331,2025.08.26,여우야+,https://cafe.naver.com/fox5282/4348909,말아종,쿨소닉 받아보세요! 제가 쿨소닉 받아봤는데 진짜 안아픈 레이저였고 3주? 그쯤 부터 얼굴 갸름해진거 효봐 보이기 시작하더라구요,,
,1332,2025.08.26,여우야+,https://cafe.naver.com/fox5282/4351442,말아종,다운타임 없고 통증 없는거 찾으시면 쿨소닉이 딱 맞을거 같은데요!? 저도 이거 받아봤는데 마취 크림 없이 받을 정도로 통증 없었는데 얼굴 전체적으로 갸름해지는 효과는 제대로 올라오더라구요,,
,1333,2025.08.26,여우야+,https://cafe.naver.com/fox5282/4351504,말아종,초음파는 얼굴 전체적으로 갸름하게 해주고 써마지 같은 고주파는 탄력 올리는데 좋아요~ 저는 얼굴 갸름하게 하고 싶어서 쿨소닉 받았는데 이건 하나도 안아프고 다운타임도 없어서 만족했던 레이저네요~!!,,
,1334,2025.08.26,여생남정,https://cafe.naver.com/suddes/3950284,구랩,리쥬란 손주사가 그렇게 아프다면서요..?ㅋㅋㅋㅋ 저도 피부과 입문이라 안아픈거 찾는 중인데 쿨소닉 추천이 제일 많더라구요,,
,1335,2025.08.26,여생남정,https://cafe.naver.com/suddes/3950939,구랩,울쎄라 보통 400샷~600샷 받는거 같아요! 저도 울쎄라 알아보고 있는데 비수면으로는 너무 아프다고 해서 쿨소닉 받아야하나 싶은.. 이건 안아프다고 해서요,,
,1336,2025.08.26,여생남정,https://cafe.naver.com/suddes/3950554,구랩,"저도 어떤걸 받아야할지 몰라서 일단 피부과 상담 가보려고요.. 울쎄라, 쿨소닉 등 다양하게 알아봐놨는데 안아픈 레이저로 원장님께 추천 받아보려고요",,
,1337,2025.08.27,여우야,https://cafe.naver.com/feko/9840701,원피,아니면 쿨소닉도 좋아요~ 저도 울쎄라 고민하다가 쿨소닉 받았는데 아예 안아픈 레이저였고 울쎄라처럼 턱선 살리면서 볼쪽 다림질한 효과 나왔거든요,,
,1338,2025.08.27,여우야,https://cafe.naver.com/feko/9840671,원피,통증 걱정 되시면 쿨소닉 알아보세요~ 울쎄라랑 효과 똑같은데 마취크림 없이 받을 수 있을 정도로 통증 없는 레이저였어요~ 덕분에 편하게 받고 왔네요 ㅎㅎ,,
,1339,2025.08.27,여우야,https://cafe.naver.com/feko/9840534,원피,탄력은 괜찮은데 얼굴 쉐잎이 고민이면 쿨소닉도 좋아요! 제가 받아본건데 펜타입이라서 진짜 꼼꼼하게 받을 수 있었고 통증 아예 없었어요,,
,1340,2025.08.27,여우야+,https://cafe.naver.com/fox5282/4352302,밸룬,쥬베룩이랑 쿨소닉 잘 맞나요? 안그래도 저도 쿨소닉 받고서는 사진 찍었을 때 얼굴 쉐잎 또렷해지고 갸름해진거 보고 넘 기분 좋아서 다른거도 해야되나 싶었는뎅ㅋㅋㅋㅋ,,
,1341,2025.08.19,여우야,https://cafe.naver.com/feko/9810834,휘낙낙시에,진짜요 ㅋㅋㅋ효과 차이 있어요! 쿨소닉 저도 받아봤는데 통증없이 탄력올라가니까 만족도 높았어요! 다른거도 많이 받아봤는데 이만한게 없어여,,
,1342,2025.08.19,여우야,https://cafe.naver.com/feko/9808794,휘낙낙시에,쿨소닉 쿨페이즈 쿨쿨조합 좋아요!ㅋㅋ저도 상담하고 받았는데 이중턱이랑 얼굴라인 정리 잘되구 무엇보다 무통으로 가능한점이 너무 좋더라구요,,
,1343,2025.08.19,여우야,https://cafe.naver.com/feko/9811046,휘낙낙시에,쿨소닉 좋아요 저도 공감해요 ㅎㅎ 받았을때 쿨링시스템이라 통증도 거의 못느꼈구요!ㅋㅋ 멍이랑 붓기도 없어서 일상생활에 지장안줘서 만족,,
,1344,2025.08.19,여우야,https://cafe.naver.com/feko/9807822,휘낙낙시에,질문해도 괜찮죠 ㅎㅎ 저도 상담하고 쿨소닉 받고 왔어요~ 쿨링시스템이라서 통증없이 리프팅 받을 수 있는점이 매력적이더라구용ㅎㅎ,,
