기기구분,NO.,작업일,진행카페,작업ULR,닉네임,댓글내용,,카페 댓글
리프테라,1,2025.08.01,여우야+,https://cafe.naver.com/fox5282/4305634,미래의꽃,울쎄라 후에 얼굴 누르면 욱신거리는 통증이 며칠 갔어요ㅠ 열심히 참았지만 그 고생 생각하면 재시술은 좀 꺼려지네요 근데 리프테라2는 통증도 덜하고 시술직후 붓기나 멍이 거의 없어서 회사 다니면서 받기엔 그게 훨씬 현실적인 것 같아요,,
,2,2025.08.01,여우야+,https://cafe.naver.com/fox5282/4305279,미래의꽃,전에도 리프팅 몇 번 받았었는데 턱살 쪽은 효과가 애매했거든요 고민하다 리프테라2 라인타입으로 시술했어요 처진 턱살 집중 케어 가능하다고 해서 도전했는데 팔자랑 입가 밑 라인까지 전체적으로 정리돼서 얼굴이 작아보여요,,
,3,2025.08.01,여우야+,https://cafe.naver.com/fox5282/4305695,미래의꽃,팔자에 보톡스는 잘못 맞으면 웃을 때 어색하거나 표정 굳는 느낌 있어서 저는 좀 불편하더라구요ㅠ 그래서 이번엔 리프테라2 펜타입으로 받아봤는데요 팔자주름 주변 피부가 전체적으로 끌어올라가면서 자연스럽게 펴지는 느낌? 표정도 자연스럽고 만족도 높았어요,,
,4,2025.08.01,여우야,https://cafe.naver.com/feko/9754929,그남자와의이별,"비수술 리프팅 하면 다들 울쎄라 먼저 떠올리는데 요즘엔 리프테라2도 진짜 많이 하더라구요 초음파 방식은 비슷한데, 리프테라는 통증이나 붓기 면에서 훨씬 덜한 느낌이었어요 전 특히 턱살+볼살 정리하는 게 목표였는데 라인타입으로 집중 리프팅되니까 만족도 높았어요!",,
,5,2025.08.01,여우야,https://cafe.naver.com/feko/9754883,그남자와의이별,살 없으면 티타늄 단독은 조금 위험할 수도 있어요 강하게 당기면 꺼져 보이는 분들도 꽤 있거든요 전 그래서 리프테라2 병행했는데 이게 초음파로 볼륨은 유지하면서 리프팅 되는 느낌이라 전체적인 인상은 더 좋아졌어요,,
,6,2025.08.01,여우야,https://cafe.naver.com/feko/9754658,그남자와의이별,나이 들수록 실리프팅은 오히려 부담이 클 수도 있어요 피부가 얇고 처진 정도가 심하면 실이 표면에 티 나거나 뭉칠 수도 있다고 하더라구요 리프테라2는 초음파라 그런 부담 없이 자연스럽게 리프팅 효과 볼 수 있어서 저는 병행 없이 이것만 했어요 볼 처짐이나 팔자 쪽 개선 잘 됐어요!,,
,7,2025.08.01,성형위키백과,https://cafe.naver.com/juliett00/1479923,현쑥이지,저도 실리프팅 진짜 기대하고 받았는데 그냥 돈 버린 느낌 ㅡㅡ 그래서 수술까지 고민했는데 리프테라2 펜타입 추천받아서 해봤어요 중안부 중심으로 촘촘하게 들어가니까 팔자랑 광대 아래 쪽이 자연스럽게 정리돼서 확실히 얼굴 길이 짧아진 인상 들더라구요!,,
,8,2025.08.01,성형위키백과,https://cafe.naver.com/juliett00/1479847,현쑥이지,"전 원래 고민만 하다 상담 갔는데 병원 분위기도 좋고, 시술 자체가 무겁지 않아서 당일에 바로 진행했어요 리프테라2는 회복기간 따로 필요 없어서 당일 시술하는 분들 진짜 많대요 저도 마스크 쓰고 바로 친구 만나러 갔었어요ㅋㅋ",,
,9,2025.08.01,성형위키백과,https://cafe.naver.com/juliett00/1479637,현쑥이지,저도 실리프팅 바로 하려다가 레이저 먼저 받아보라는 말 듣고 리프테라2 펜타입으로 받았어요~ 팔자 주변이랑 볼처짐 부위에 정밀하게 들어가니까 확실히 라인이 정리되는 느낌? 그 후엔 실리프팅까지 굳이 안 해도 되겠다 싶었어요ㅎㅎ,,
,10,2025.08.01,여생남정,https://cafe.naver.com/suddes/3940525,용찌,울쎄라는 효과는 좋은데 시술 당일 얼굴 화끈거리고 붓기 있는 분들 많더라구요 전 애 키우는 중이라 그런 시간 여유가 없어서 리프테라2로 했어요~ 붓기도 없고 마스크 쓰면 티도 거의 안 나서 애기랑 외출도 문제 없었어요!,,
,11,2025.08.01,여생남정,https://cafe.naver.com/suddes/3940280,용찌,저도 턱선이랑 이중턱 진짜 스트레스였는데 라인타입 리프테라2로 300샷 정도 받았거든요? 턱 밑살이랑 라인이 딱 정리되니까 얼굴이 훨씬 갸름해 보이더라구요! 굳이 지흡 안 해도 될 만큼 자연스럽게 올라가서 만족했어요~,,
,12,2025.08.01,여생남정,https://cafe.naver.com/suddes/3939280,용찌,"전 리프테라2 라인타입으로 한쪽만 샷수 조절해서 받았더니 볼살 꺼짐+턱선 무너짐이 확실히 덜해졌어요! 수원 쪽 피부과 중에 리프테라 정식기기 사용하는 병원도 있으니까 상담 잘 받아보시는 게 좋을 것 같아요~
",,
,13,2025.08.01,파우더룸,https://cafe.naver.com/cosmania/38174685,"내게들려주던노래
",전 리프테라2로 턱선 위주로 당겼는데 라인 또렷해지고 친구들이 얼굴 작아졌다고 하더라구요ㅎㅎ,,
,14,2025.08.01,파우더룸,https://cafe.naver.com/cosmania/38174627,내게들려주던노래,덴서티 받고 결은 부드러워졌는데 탄력은 약간 아쉬운 느낌 있어서 리프테라2 병행했더니 중안부랑 턱선까지 싹 정리되면서 리프팅 효과가 눈에 띄게 좋아졌어요!,,
,15,2025.08.01,파우더룸,https://cafe.naver.com/cosmania/38173772,"내게들려주던노래
","저도 팔자주름이랑 입 옆 그림자 때문에 나이 들어 보인다는 말 자주 들어서 스트레스였어요ㅠ
리프테라2 펜타입으로 팔자 중심으로 받았는데 자연스럽게 올라가면서 표정도 딱딱하지 않고 부드럽게 개선돼서 만족해요!",,
,16,2025.08.01,재잘재잘,https://cafe.naver.com/knife67/380735,윤쏘맘이,울쎄라 가격이 생각보다 세고 샷 누락되면 효과도 들쭉날쭉하다는 얘기 들어서 전 리프테라2로 받았어요 펜타입으로 받으니까 팔자랑 턱선 같은 고민 부위에 정확히 들어가서 효과 체감 확실했고요 시술 내내 통증 거의 없어서 놀랐어요!,,
,17,2025.08.01,재잘재잘,https://cafe.naver.com/knife67/380718,"윤쏘맘이
",전 팔자주름이 진짜 심하게 꺾이는 타입이라 필러도 고려했었는데 리프테라2 펜타입으로 2000샷 받고 확실히 주름이 옅어지고 얼굴선이 정돈된 느낌이에요 특히 팔자 주변에 촘촘하게 들어가서 자연스럽게 개선돼요 부담도 적고 만족도 높았어요ㅋ,,
,18,2025.08.01,재잘재잘,https://cafe.naver.com/knife67/380698,윤쏘맘이,저도 심부볼 처짐 때문에 실리프팅 고민했는데 실리프팅은 부작용도 있고 회복 기간도 있어서 좀 망설여지더라구요ㅠ 그래서 리프테라2로 먼저 받았는데 통증 적고 회복 빠른 초음파 리프팅이라 부담 없었어요 라인도 자연스럽게 잡히고 주변에서 훨씬 어려 보인다는 말 많이 들었어요,,
,19,2025.08.01,레몬테라스,https://cafe.naver.com/remonterrace/33908902,나들이연,실리프팅이 생각보다 무거운 시술이고 부작용 얘기도 많아서 저는 초음파 기반인 리프테라2 선택했어요 자극 적고 붓기 거의 없고 시술 직후 바로 마스크 쓰고 다녀도 될 정도로 편해요 심부볼 처짐 잡는 데 효과도 괜찮아서 추천드려요!,,
,20,2025.08.01,레몬테라스,https://cafe.naver.com/remonterrace/33906826,나들이연,저는 인모드FX로 피부결 개선하고 리프테라2로 팔자주름이랑 턱선 리프팅했어요 둘 다 통증 적고 회복 빨라서 육아맘한테 딱이에요~ 나이 들수록 병행 시술 추천합니다!,,
,21,2025.08.02,여우야,https://cafe.naver.com/feko/9758035,날떠나지마세요,저도 불독살이랑 팔자 때문에 고민 많았는데요 상담받으니까 리프테라2랑 인모드FX 같이 받는 분 많더라고요 하나는 초음파로 피부 처짐 당기고 하나는 고주파로 지방 쏙쏙 정리해줘서 딱 제 고민 부위에 맞는 조합이었어요! 지금 턱선이 진짜 또렷해졌어요,,
,22,2025.08.02,여우야,https://cafe.naver.com/feko/9757273,날떠나지마세요,"저는 팔자에 넣은 필러가 하얗게 비쳐 보이길래 녹이고 리프테라2 펜타입이랑 라인타입으로 듀얼로했어요 볼륨 없이 리프팅 효과만 주니까 자연스럽게 정리됐고 펜타입으로 팔자 깊이 들어간 부분 타겟 잡으니까 오히려 필러보다 자연스럽게 채워진 듯한 효과 봤어요~
",,
,23,2025.08.02,여우야,https://cafe.naver.com/feko/9757458,날떠나지마세요,지방흡입 생각하셨다면 리프테라2 라인타입도 한 번 고려해보세요! 저는 500샷 맞았는데 턱 밑이랑 광대 아래 볼살까지 라인 정리되더라구요 흡입처럼 극적인 변화는 아니지만 자연스럽고 티 안 나는 리프팅이라 진짜 괜찮았어요!,,
,24,2025.08.02,여우야+,https://cafe.naver.com/fox5282/4306746,당신을위하여,"저도 화장할 때 모공 부각이 너무 신경 쓰여서 탄력 시술 찾다가 리프테라2 300샷 추천받아서 해봤어요 딱 부담 안 가는 샷수였고, 잔주름 개선 효과도 살짝 보였어요 무엇보다 턱선이 흐릿했던 게 정돈되니까 인상이 훨씬 또렷해졌어요",,
,25,2025.08.02,여우야+,https://cafe.naver.com/fox5282/4306672,당신을위하여,저는 티타늄보다 써마지랑 리프테라2 병행이 더 효과 있었어요 피부는 써마지가 확실히 모공 타이트닝에 좋았고 리프테라2는 턱선이랑 팔자 쪽 리프팅에 딱이더라구요 모공 때문에 고민이시면 이 조합 추천해요! 저는 피부결이 진짜 매끈해졌어요,,
,26,2025.08.02,여우야+,https://cafe.naver.com/fox5282/4306616,당신을위하여,"저도 첫 리프팅으로 리프테라2 받았는데, 진짜 가성비 갑이에요 통증도 적고 회복도 빨라서 일상생활 바로 가능했고 얼굴 전체적으로 탄력 생겨서 너무 좋아요~",,
,27,2025.08.02,재잘재잘,https://cafe.naver.com/knife67/381737,김연지,저는 입문용으로 리프테라2 펜타입 3000샷으로 시술했는데 처음 받는 분들한테도 추천할 만큼 통증이 거의 없어요! 리프테라2 눈가 팔자 집중 시술 받았는데 피부가 점점 탱탱해지고 잔주름도 자연스럽게 개선돼서 완전 만족 중입니다,,
,28,2025.08.02,재잘재잘,https://cafe.naver.com/knife67/381685,김연지,"저는 턱선때문에 리프테라2 라인타입으로 시술했는데 피부 속 깊이 초음파를 쏴서 이중턱 처짐 개선에 좋아요
주사처럼 바로 효과가 확 보이진 않지만 2~3회 정도 꾸준히 받으면 훨씬 탄탄해지는 느낌을 받을 수 있어요!",,
,29,2025.08.02,재잘재잘,https://cafe.naver.com/knife67/381456,김연지,아는 언니가 울쎄라 받았다가 멍이랑 붓기가 너무 심해서 한동안 외출도 못했어요ㅠ 그 이후로 리프팅 시술은 무섭다고 하길래 제가 리프테라2 추천했거든요? 통증도 거의 없고 자연스럽게 라인 정리돼서 지금은 그것만 꾸준히 받더라구요!,,
,30,2025.08.02,성형위키백과,https://cafe.naver.com/juliett00/1480423,뚜지맘이,저는 리프테라2로 꾸준히 리프팅 관리하고 있어요 처음엔 반신반의했는데 2~3주 지나면서 턱선이 슬쩍 살아나는 게 느껴져요 ㅎㅎ,,
,31,2025.08.02,성형위키백과,https://cafe.naver.com/juliett00/1480326,뚜지맘이,"저도 팔자주름이랑 모공이 늘 고민이었는데 리프테라2 펜타입 시술 받고 진짜 만족했어요!
특히 팔자 부위는 깊게 패여 있던 게 부드러워지고 피부결도 매끈해졌어요",,
,32,2025.08.02,성형위키백과,https://cafe.naver.com/juliett00/1480340,뚜지맘이,"저도 울쎄라 알아보다가 가격 보고 바로 뒤로가기 눌렀었어요ㅋㅋ 게다가 주변에서 아프다는 얘기 많아서 겁났는데
리프테라2는 통증도 덜하고 가격도 훨씬 부담 없어서 저는 그걸로 선택했어요! 받고 나서 턱선이 정리돼서 진짜 만족 중입니다~",,
,33,2025.08.02,파우더룸,https://cafe.naver.com/cosmania/38175061,엘리엘리쓰,덴서티 알아보다가 저는 리프테라2 라인타입으로 턱선 집중 시술했어요 처진 살이 정리되니까 턱선이 훨씬 또렷해지고 이중턱도 자연스럽게 줄었어요 통증도 거의 없어서 부담 없이 받았어요,,
,34,2025.08.02,파우더룸,https://cafe.naver.com/cosmania/38175020,엘리엘리쓰,"울쎄라 친구가 받긴 했는데 끝나고 얼굴 완전 빨개지고 하루종일 욱씬거린다고 해서 저는 포기했어요
리프테라2는 그런 붓기나 통증 거의 없고 바로 일상생활 가능해서 진짜 추천합니다!",,
,35,2025.08.02,파우더룸,https://cafe.naver.com/cosmania/38174919,엘리엘리쓰,전 써마지만 받을까 하다가 상담 때 추천받고 리프테라2도 같이 했거든요? 둘이 자극 깊이가 다르다 보니 병행하면 효과가 시너지 나요! 특히 턱선 정리 진짜 잘 돼서 거울 볼 때마다 너무 뿌듯해요ㅎㅎ,,
,36,2025.08.02,여생남정,https://cafe.naver.com/suddes/3940691,"나의그대불빛
","맞아요! 리프팅은 진짜 사람마다 달라요 붓기나 멍도 체질, 피부 두께, 시술 강도에 따라 다르더라고요 저는 리프테라2 받았는데 통증도 거의 없고 붓기도 없어서 바로 출근했어요ㅎㅎ 가볍게 받기 좋은 리프팅이었어요!",,
,37,2025.08.02,여생남정,https://cafe.naver.com/suddes/3940688,"나의그대불빛
",처음 리프팅이라면 통증이나 회복 부담 없는 게 최고죠 저는 리프테라2로 시작했는데 가격도 괜찮고 아프지도 않아서 진짜 만족했어요 시술 받고 거울 볼 때 턱선이 정리되는 게 느껴졌어요ㅎㅎ,,
,38,2025.08.02,여생남정,https://cafe.naver.com/suddes/3940584,"나의그대불빛
","저는 팔자 주름 때문에 도저히 안 되겠어서 회사 반차 내고 리프테라2 펜타입 받았어요 시술 받고 나서 붓기나 멍 전혀 없고 통증도 거의 없어서 오후에 바로 출근해서 회의까지 했네요ㅋㅋ 진짜 부담 없어요!

",,
,39,2025.08.02,레몬테라스,https://cafe.naver.com/remonterrace/33914077,"미연이는예쁘지
",피부 얇아서 무슨 시술만 하면 뒤집어졌는데 리프테라2는 생각보다 자극도 없고 써마지랑 같이 받으면 속탄력+겉결이 동시에 잡혀서 리프팅보다 오히려 피부 좋아보이는 효과가 크더라고요 요즘 제일 만족한 조합이에요!,,
,40,2025.08.02,레몬테라스,https://cafe.naver.com/remonterrace/33911440,"미연이는예쁘지
","요즘 사진 찍을 때마다 턱 밑이 신경 쓰였는데 리프테라2 라인타입 300샷 받고 나서 훨씬 자연스럽게 정리된 느낌이에요!
딱히 멍이나 붓기도 없어서 받고 바로 친구들이랑 약속 나갔어요ㅋㅋ",,
,41,2025.08.03,여우야,https://cafe.naver.com/feko/9758610,"마음이급해요
","소프랑 리프테라2 둘 다 상담받았는데 리프테라2가 샷이 부위별로 정밀하게 들어가서
얼굴형에 맞춰 디자인 시술 가능한 점이 더 끌렸어요 원장님이 직접 해주셔서 더 믿음 갔구요",,
,42,2025.08.03,여우야,https://cafe.naver.com/feko/9759088,"마음이급해요
","리프테라2 라인타입으로 300샷 받고 턱살이 반 이상 사라진 기분이에요 직접 시술하는 원장님이 샷 위치 엄청 정밀하게 잡아주셔서
진짜 턱선각이 생겼어요ㅋㅋ
",,
,43,2025.08.03,여우야,https://cafe.naver.com/feko/9757871,"마음이급해요
",저는 강남역 근처 K뷰티의원에서 리프테라2 라인타입으로 시술 했어요 원장님이 직접 해주셨는데 진짜 잘하세요 리프팅이 필요한 부위만 정밀하게 들어가는 샷으로 맞춰주셔서 불필요한 자극 없이 턱선만 또렷하게 개선됐어요~,,
,44,2025.08.03,파우더룸,https://cafe.naver.com/cosmania/38176409,하나부터열한가지,"저는 리프테라2는 확실히 턱선이랑 볼처짐에 좋고 올리지오랑 병행하니까 피부 탄력 자체가 올라오는 느낌이라 리프팅 유지력도 오래 가는 것 같아요! 둘 다 통증도 거의 없고 일상생활 바로 가능해서 좋았어요~

",,
,45,2025.08.03,파우더룸,https://cafe.naver.com/cosmania/38176407,하나부터열한가지,"저는 예전에 울쎄라 했다가 너무 아파서 시술 중간에 진짜 눈물 났어요 ㅠ 끝나고도 멍 들고 얼굴 당기는 느낌까지 있었는데…
이번엔 리프테라2로 바꿔봤거든요? 통증 거의 없고 얼굴 라인이 훨씬 자연스럽게 리프팅돼서 만족감이 완전 달랐어요!",,
,46,2025.08.03,파우더룸,https://cafe.naver.com/cosmania/38175003,하나부터열한가지,"실리프팅 턱에 하신 분 중에 이물감이 오래 가서 음식을 씹을 때도 불편했다는 얘기 듣고 리프테라2로 방향 틀었어요
초음파 리프팅이라 피부 겉은 건드리지 않고 속부터 조이듯 당겨줘서 자연스럽고 부담 없어요! 효과도 점점 올라오더라구요",,
,47,2025.08.03,여생남정,https://cafe.naver.com/suddes/3940672,브라운셔츠,저는 리프테라2 펜타입 2000샷 받았는데 볼 처짐 심한 분들한테 추천합니다 얼굴선이 확실히 살아나요ㅎ,,
,48,2025.08.01,여우야,https://cafe.naver.com/feko/9755311,낫카,리프테라2 보톡스 같이 받으몀 턱라인이 확실히 또렷해지긴 하죵ㅋㅋㅋㅋ리프테라2 자체로도 라인 정리에 진짜 좋은 것 같아요,,
,49,2025.08.04,여우야,https://cafe.naver.com/feko/9755311,할슈슈슈슈,맞아영 보톡스까지 같이 맞아주니까 턱라인이 훨씬 살더라구여 리프테라2만 받아도 이중턱이나 볼살 정리는 확실히 잘되쥬ㅎㅎ,,
,50,2025.08.04,여우야,https://cafe.naver.com/feko/9758995,할슈슈슈슈,리프테라2 리쥬란 많이 받으세용 피부결이나 모공까지 신경쓰이시면…!! 얼굴라인은 리프테라2로 정리하고 스킨부스터 같이 받으면 시너지가 훨씬 좋긴 해요~~,,
,51,2025.08.04,여우야,https://cafe.naver.com/feko/9758995,설렁탕에후추,그츄..저도 리쥬란힐러 생각중이에요! 리프테라2랑 받으신 분들 보면 후기도 좋고 두개 시술 조합이 좋다구 해서 담에 상담가보려구요ㅎㅎ,,
,52,2025.08.01,여우야,https://cafe.naver.com/feko/9754124,미의요신,홍대 앤봄 원장님 진짜 실력 좋아요 저는 리프테라2 받았는데 통증이나 가격 엄청 만족스러워요! 특히 붓기가 하나도 없어서 꾸준히 받기 좋은거 같아요!,,
,53,2025.08.04,여우야+,https://cafe.naver.com/fox5282/4309387,우리만큰,리프테라2 받아보세요 저도 주변에서 리프팅비싸고 아프다그래서 겁났는데 리프테라2 받고생각 완전 바꼈어요 효과도 좋고 가격도 합리적이에요~,,
,54,2025.08.04,여우야+,https://cafe.naver.com/fox5282/4310035,우리만큰,전 리프팅은 무조건 아프고 붓는다는 고정관념 있었는데 리프테라2 진짜 편하게 받고나서 일상복귀도 바로 가능해서 신세계였어요~ 리프테라2도 한번 받아보시는거 추천해요,,
,55,2025.08.04,여우야,https://cafe.naver.com/feko/9763454,우리의드라마,저도 처음에 리프테라2 받을때 기대 별로 안하고 받았었는데 턱선이랑 볼살 정리된거보고 이걸로 정착해서 꾸준히 받고있어요! 통증도 거의 없는게 제일 만족!,,
,56,2025.08.04,여우야+,https://cafe.naver.com/fox5282/4309917,우리만큰,리프테라2 어때요? 저 이거 받으려고 누워있는 동안 편하게 받았어요 ㅋㅋ 이중턱이랑 턱선도 확실히 정리됬구요,,
,57,2025.08.04,여생남정,https://cafe.naver.com/suddes/3940691,투엑스비,그렇다고는 들었는데 그래도 울쎄라 같은건 받고나면 다운타임 무조건 있어서 저는 리프테라2 받았어요~ 이건 리프팅중에서 가성비도 최고고 통증도 거의없고 다운타임도 없어서 일상생활 방해 안받는게 진짜 제일 큰 장점 같아요,,
,58,2025.08.04,여우야+,https://cafe.naver.com/fox5282/4309678,우리만큰,저도 얼굴형 고민 많은데 피부까지 예민한편이라 고민하다가 리프테라2 받았는데 시술후에 트러블도 없고 자극도 없어서 진짜 편하게 받았어요~ 리프팅 입문이시면 완전 추천해요!,,
,59,2025.08.04,여우야,https://cafe.naver.com/feko/9761916,우리의드라마,전 리프테라2요~ 리프팅 통증이랑 붓기때문에 고민 많이 하다가 리프테라2 받았는데 이건 생각이상으로 편안해서 놀랐어요~ 받고나서 얼굴선 정리된것도 만족스럽구요,,
,60,2025.08.04,여우야,https://cafe.naver.com/feko/9760031,우리의드라마,네네 리프테라2 좋아요 저도 이거받고 회사 바로 출근할정도로 다운타임 없었어요! 화장 무너짐도 없고 붓기 1도 없어서 이래서 사람들이 많이 받는구나 싶었어요~,,
,61,2025.08.04,여생남정,https://cafe.naver.com/suddes/3941445,투엑스비,리프테라2는 어때요? 전 이거 받고 부작용 하나 없이 피부탄력이랑 잔주름까지 좋아졌어요~ 딱히 아프지도 않아서 유지관리용으로 꾸준히 받고 있어요,,
,62,2025.08.04,성형위키백과,https://cafe.naver.com/juliett00/1480993,네일샵주인,전 리프테라2 추천이요~ 이건 진짜 장점이 부담없이 받을수 있는 가격이랑 다운타임 없다는거? 받고나서 바로 외출도 가능해서 전 리프테라2 만족해요,,
,63,2025.08.04,여우야,https://cafe.naver.com/feko/9758995,우리의드라마,리프테라2가 가격대도 괜찮고 효과도 좋아서 리프팅 고민하시는 분들이면 부담없이 받기 진짜 좋은거같아요! 시너지 좋은 시술들도 많아서 강추해요~,,
,64,2025.08.04,여우야,https://cafe.naver.com/feko/9758321,우리의드라마,저는 리프테라2는 고정으로 꾸준히 받으면서 피부 상태에따라서 다른 시술들 조합해서 받는데 쥬베룩 받을때 같이 받으세요~,,
,65,2025.08.04,여생남정,https://cafe.naver.com/suddes/3941427,투엑스비,리프팅효과 제대로 보시려면 초음파 한번 찾아보세요 저는 리프테라2 받았는데 리프테라2 받는 내내 너무 편해서 이래도 되나 싶었어요 ㅋㅋ 다운타임 없고 자연스럽게 리프팅되는게 만족감 높아요,,
,66,2025.08.04,여생남정,https://cafe.naver.com/suddes/3941382,투엑스비,후기 궁금해요 ㅋㅋ 저는 울쎄라 통증이랑 가격때문에 ㅠㅠ 부담심해서 리프팅 못한 1인이었는데 리프테라2 받고 부담없이 리프팅 가능하구나 느꼈었거든요~ 붓기도 멍도 전혀 없었어요,,
,67,2025.08.04,재잘재잘,https://cafe.naver.com/knife67/381737,매일매일조식,리프테라2요! 통증도 얼마 없고 붓기나 멍은 전혀 없어서 다음날 바로 출근가능한 리프팅... 메이크업도 문제 없어서 전 리프테라2 만족해요~,,
,68,2025.08.04,여우야,https://cafe.naver.com/feko/9757588,우리의드라마,"20대 초반이면 리프테라2가 제일 받기 좋을걸요? 저도 리프테라2 받고 얼굴처짐 해결되고 인상 또렷해졌다는 얘기 많이 들었어요 통이랑 붓기, 가격 생각하면 리프테라2 받아보세요",,
,69,2025.08.04,여생남정,https://cafe.naver.com/suddes/3941064,투엑스비,저도 볼처짐이랑 이중턱 고민이었는데 리프테라2 받고나서 셀카찍을때 턱선 깔끔하게 나와서 너무 좋아요~ 가격이나 붓기 부담 없어서 받아보시는거 추천해요,,
,70,2025.08.04,여생남정,https://cafe.naver.com/suddes/3940688,투엑스비,리프팅 입문이시면 리프테라2 받아보세요 저도 리프테라2 받고나서 너무 만족해서 계속 이걸로 관리중이거든요 받고나서 피부 탄탄해진 느낌 너무 좋아요~,,
,71,2025.08.04,성형위키백과,https://cafe.naver.com/juliett00/1481276,네일샵주인,저도 안아픈 레이저 찾다가 리프테라2 받았는데 확실히 얼굴선 정리된 느낌 들고 다운타임도 없어서 초반에 아무도 시술한지 모르더라고요 ㅋㅋ 저혼자만 뿌듯...ㅋㅋ 자연스러운 효과 너무 좋아요~,,
,72,2025.08.04,성형위키백과,https://cafe.naver.com/juliett00/1481230,네일샵주인,리프테라2도 다운타임 없어서 저는 이걸로 관리해요~ 리프팅받고 티 나는거 싫은데 이건 그냥 자연스럽게 효과 올라오고 통증도 약해서 부담 1도 없이 잘 받고 있어요!,,
,73,2025.08.04,파우더룸,https://cafe.naver.com/cosmania/38177735,미꾸라지지,"땅콩형 얼굴에 리프테라2 효과 잘보실거에요 저도 처짐이랑 이중턱,턱살 때문에 리프테라2 받았는데 효과 진짜 잘보고있어요 효과도 효과인데 받고나서 이상생활 영향 없다는거 진짜 좋아요~",,
,74,2025.08.04,성형위키백과,https://cafe.naver.com/juliett00/1481228,네일샵주인,맞아요 진짜 원장님 디자인이랑 손기술 중요함... 저는 리프테라2 맞춤으로 받았는데 리프팅 효과는 확실히 올라오면서 자극이나 통증 거의 없어서 민감성 피부인 저도 진짜 부담없이 효과 잘보고있어요~,,
