기기구분,NO.,작업일,진행카페,작업ULR,닉네임,댓글내용,,카페 댓글
,1473,2025.08.31,성형위키백과,https://cafe.naver.com/juliett00/1497862,방울도깨비,윤곽하고 리프팅 많이 받으시던데... 리프테라2 받아보세요 윤곽 수술하고 붓기랑 회복기간때문에 고생하셨을건데 리프테라2는 붓기랑 멍 하나도 없는데 효과 잘나와서 전 만족하거든요,,
,1474,2025.08.31,재잘재잘,https://cafe.naver.com/knife67/404395,빙수팡,레이저리프팅은 안받고 바로 실받는거에요?ㅠ 저도 수술이나 실리프팅 생각했다가 너무 부담되고 무리인 느낌이라 리프테라2 상담 받고 받아봤는데 쳐진살들 쭉 땡겨줘서 효과 만족하니깐 이걸로 계속 받게 되더라고요,,
,1475,2025.08.31,파우더룸,https://cafe.naver.com/cosmania/38205339,호기심탐험가,리프테라2 받아보세요 이게 가격대비 효과 최고에요 진짜 저도 한번 받고나서 효과만족도 높아서 이후로는 계속 리프테라2로 받고있어요,,
,1476,2025.08.31,재잘재잘,https://cafe.naver.com/knife67/403800,빙수팡,부작용 걱정되서 그런거면 실력 좋은 원장님한테 받으세요~ 공장형 말구요! 저는 붓기랑 멍없이 리프팅 받고 싶어서 리프테라2 받았는데 효과 좋아서 이걸로 꾸준히 받고있어요,,
,1477,2025.08.31,여우야,https://cafe.naver.com/feko/9853922,개코루,900샷 궁금하네요.. 저도 리프테라 여러번 받아봤는데 항상 600샷으로만 받았거든요 ㅎㅎ 그래도 효과 좋았었는데 900샷은 어떨지 진짜 궁금..,,
,1478,2025.08.31,여우야+,https://cafe.naver.com/fox5282/4361044,댓츄,저도 스킨부스터 궁금한데 진짜 아프다고해서..ㅠㅠㅠ 리프테라는 저도 여러번 받을 정도로 만족한 레이전데 몇샷 받으세요? 저는 900샷이요 ㅋㅋ,,
,1479,2025.08.31,여생남정,https://cafe.naver.com/suddes/3953213,코피땅콩,리프테라랑 스킨부스터 같이 받으면 확실히 좋은가요? 저는 리프테라만 4개월마다 받는데 지금 800샷 받고 있거든요! 리프테라만으로도 너무 좋아서 다른거 같이 받을 생각을 못해봤네요 ㅎㅎ,,
,1480,2025.08.31,여우야,https://cafe.naver.com/feko/9854069,츄캐,"쥬베룩 좋죠? 리프테라랑 같이 잘 어울리는 스킨 부스터 맞을거예요! 리프테라로 얼굴 갸름하게 하고 쥬베룩으로 탄력, 피부결 같이 챙길 수 있어서요 ㅎㅎ",,
,1481,2025.08.31,여우야+,https://cafe.naver.com/fox5282/4361084,구캥,리프테라 고샷수 좋다더라구요 원장님도 저한테 고샷수 추천해주심ㅎㅎ 쥬베룩도 같이 받는 중인데 쥬베룩도 좋았어요~!! 리프테라가 다른거랑 잘 어울리는 레이저인듯욤,,
,1482,2025.08.31,여생남정,https://cafe.naver.com/suddes/3953235,웃을일이,맞아요 레이저는 한달차부터 제대로예요 ㅎㅎ 리프테라가 초음파라 턱선 살리고 볼쪽 갸름하게 해주는데 좋은 레이저인데 꾸준히 받는게 젤 중요하죠~,,
,1483,2025.08.31,여우야,https://cafe.naver.com/feko/9853005,캐러멀,저는 쥬베룩 넘 좋았어요~!! 리프테라 받고 계시면 쥬베룩 한번 받아보세요 둘이 시너지가 넘 좋아여 ㅎㅎ,,
,1484,2025.08.31,여우야+,https://cafe.naver.com/fox5282/4360639,구캥,아 리프테라 그렇게 많이 받아봤는데 펜타입을 안받아봤네용!! 펜타입 담에 꼭 받아볼게옄ㅋㅋㅋ 3천샷 정도면 되겟져?,,
,1485,2025.08.31,여생남정,https://cafe.naver.com/suddes/3953121,낭만러,둘다 넘 효과 좋은데 역시 지갑 사정도 중요한거 같아요 ㅋㅋㅋ 저는 부담 없는 리프테라를 꾸준히 받는 쪽을 선택할거 같아요 ㅋㅋ,,
,1486,2025.08.31,여우야,https://cafe.naver.com/feko/9853074,스펠스,네 인모드도 효과 좋았어요! 리프테라가 얼굴 전체적으로 갸름하게 해주는데 인모드가 이중턱 잡아주니까 훨씬 좋더라구요~~,,
,1487,2025.08.31,여우야+,https://cafe.naver.com/fox5282/4360721,웨알유,펜타입 좋아요! 특히 팔자 쪽 꼼꼼하게 해주시니까 팔자가 좀옅어진거 같아서 더 만족 ㅎㅎ 펜타입 얼마 안하니까 추가해보세여,,
,1488,2025.08.31,여생남정,https://cafe.naver.com/suddes/3953129,씨쓰루,저는 600샷~800샷 그때그때 다르게 받고 있어요! 800샷 한번은 받아보세요 진짜 효과 더 많이 올라와서 좋아요,,
,1489,2025.08.31,여우야,https://cafe.naver.com/feko/9853922,장겨울,리프테라 받고 계시면 900샷은 진짜 꼭 한번 받아보셔야됩니당..ㅋㅋㅋ 600샷도 좋지만 뭔가 달라요 목까지 갸녀려진달까요,,
,1490,2025.08.31,여우야+,https://cafe.naver.com/fox5282/4361044,맹징,헉 900샷.. 저는 600샷에다가 펜타입 5천샷 추가해서 받고 있어요! 펜타입도 받아보세요 눈가랑 팔자 쪽은 펜타입이 받기 좋아요,,
,1491,2025.08.31,여생남정,https://cafe.naver.com/suddes/3953213,다시사랑,네 저는 리프테라만 받을 때도 좋았지만 스킨부스터 추가하니까 확실히 더 좋아졌어요! 리프테라가 스킨부스터랑 잘 어울리는 레이저더라고요~!!,,
,1492,2025.08.31,여우야,https://cafe.naver.com/feko/9854069,개코루,쥬베룩 좋죠~~리프테라 받고 쥬베룩 받아서 그런지 효과가 더 좋은듯한 느낌~ 리프테라는 주기적으로 받고 스킨부스터는 그때그때 피부 컨디션에 따라서 받아보려고요,,
,1493,2025.08.31,여우야+,https://cafe.naver.com/fox5282/4361084,댓츄,그쵸? 저는 다른거 안받고 리프테라만 받는데 고샷수로 받으니까 얼굴 전체적으로 엄청 깔끔해지고 이중턱도 많이 드러가더라구요~,,
,1494,2025.08.31,여생남정,https://cafe.naver.com/suddes/3953235,코피땅콩,처음에는 효과 못보나? ㅠㅠ 싶었는데 아니었어요 ㅋㅋㅋ리프테라가 초음파다 보니까 한달쯤부터 효과 올라와서 두달차까지 꾸준히 올라오더라구요~~,,
,1495,2025.08.27,여우야,https://cafe.naver.com/feko/9838434,언제까질까,시술이 진짜 짱이에요.. 홈케어는 절대.. 리프테라2가 중저가레이저들 중에선 제일 좋은 것 같긴 해요 회복기간도 전혀 없구!,,
,1496,2025.08.28,여우야,https://cafe.naver.com/feko/9840608,고기가냠냠,맞아요 너무 자주 받는건 안좋고 텀 잘 두고 꼼꼼하게 받아주는게 중요한 것 같아요 저도 리프테라2로 관리중인데 꾸준히 받으니 훨씬 개선이 잘 된 것 같아요~~,,
,1497,2025.08.28,여우야,https://cafe.naver.com/feko/9840608,넘어갔다,텀 잘 두고 받는게 중요..!! 너무 많이 받으면 안좋대요ㅠㅠ 가끔 신경쓰일때 이제 받을때 됐다 싶을때 리프테라2 받으려구요 ㅋㅋㅋㅋ라인 정리에 넘 좋음..,,
,1498,2025.08.28,여우야,https://cafe.naver.com/feko/9841010,언제까질까,리쥬란 아프긴 한가봐요 ㅠ ㅠ 그래도 리프테라2랑 받으시는 분들 많긴 하던데! 저도 리프테라2로 리프팅레이저 받구.. 다른거 같이 뭐 받을거 없나 고민중이에요ㅠ,,
,1499,2025.08.28,여우야,https://cafe.naver.com/feko/9841010,고기가냠냠,아프긴 아파요ㅠㅠㅠㅋㅋㅋ그래도 같이 받으면 피부결까지 개선이 잘되니까 조아요!! 리프테라2랑 시너지가 좋아서 추천이요,,
,1500,2025.08.28,여우야,https://cafe.naver.com/feko/9845682,유유라개요,피부결이랑 속건조도 개선하고 싶으시면 스킨부스터도 같이 받는게 좋을 것 같아요~리쥬란힐러 같은ㅎㅎ아무래도 리프테라2도 탄력 잔주름 개선에 좋은 레이저라 속건조까지 잘 잡히면 시너지가 더 좋을 수 밖에...ㅎㅎ 혹시 모르니 상담 먼저 받아보세요!,,
,1501,2025.08.28,여우야,https://cafe.naver.com/feko/9845682,설렁탕에후추,네네 상담은 받으려구요 다들 속건조 잡히고 리프테라2까지 받으면 확실히 더 좋다고는 하더라구요!! 리프테라2가 가격대도 적당해서 다른 시술이랑 받아봐도 좋을 것 같아서🫠,,
,1502,2025.08.29,여우야,https://cafe.naver.com/feko/9847536,할슈슈슈슈,마자영 다운타임 적은게 완전 장점.. 받고 나면 리프팅 된게 직후에도 보이지 않나여? 전 리프테라2 라인타입 펜타입 둘다 받는데 처짐 개선엔 라인타입이 짱인 것 같아유,,
,1503,2025.08.29,여우야,https://cafe.naver.com/feko/9847536,누발란,라인타입이 진짜 얼굴살 정리해주기엔 좋아용 저도 거의 볼살이 처져서 더 늙어보이고 그랬는데 리프테라2 받고 개선 많이 됐어요👍 펜타입은 잔주름 효과 좋구!,,
,1504,2025.08.29,여우야,https://cafe.naver.com/feko/9847755,유유라개요,볼살이랑 이중턱 울퉁불퉁한 라인까지 개선이 잘되는 것 같아요 리프테라2가 받고 나면 직후에 효과도 보이고 회복기간이 거의 필요가 없는 레이저라.. 텀만 잘두고 언제든 받아도 괜찮쥬,,
,1505,2025.08.29,여우야,https://cafe.naver.com/feko/9847755,할슈슈슈슈,인정!! 저두 얼굴라인이 울퉁불퉁 했는데ㅠㅠ 리프테라2 받은 이후로 엄청 매끈해졌어요 갸름해보이구 진작에 관리 좀 받을걸 그랬어여😭,,
,1506,2025.08.29,여우야,https://cafe.naver.com/feko/9849758,팟타이참마싯지,미리미리해주는게 진짜 중요한 것 같아요 어렸을때부터 피부 관리하라는 말이 괜히 있는게 아니에요ㅋㅋㅋㅋㅋ리프테라2가 다른 레이저들 보다 가격은 저렴한데 효과는 훨씬 좋은 것 같아용.. 물론 원장님을 잘 만나야겠지만,,
,1507,2025.08.30,여우야,https://cafe.naver.com/feko/9849758,슈트리밍,원장님 진짜 잘만나야해요 시술도 손기술에 따라 달라지는 것 같아요 리프테라2도 중저가지만 잘만 받으몀 효과 최공,,
,1508,2025.08.30,여우야,https://cafe.naver.com/feko/9849977,슈트리밍,다운타임 없는거 진짜 인정이요 저도 리프테라2로 관리중인데 확실히 받고 시간 지날수록 얼굴라인이 정리된게 보여요!,,
,1509,2025.08.30,여우야,https://cafe.naver.com/feko/9849977,팟타이참마싯지,전후차이 많이 나지 않나여? 첨에 효과가 있나 싶었는데 라인타입 받은 직후에도 처져보인 볼살이 올라간게 보이더라구요 시간지날수록 더 잘 느껴져여ㅎ,,
,1510,2025.08.31,여우야,https://cafe.naver.com/feko/9851963,팟타이참마싯지,저두 리프테라2요!! 라인+펜타입 병행해서 받으몀 확실히 얼굴라인 탄력 잔주름까지 개선 잘되는 것 같아요ㅎㅎ 가성비도 좋아서 만족쓰..,,
,1511,2025.08.31,여우야,https://cafe.naver.com/feko/9851963,진짜라니깐용,가성비가 지짜 좋아여.. 신경쓰일때마다 텀두고 받는데 부담이 확실히 덜해요 리프테라2가 전체적으로 개선을 잘 해쥬는 것 같아요,,
,1512,2025.08.31,여우야,https://cafe.naver.com/feko/9853257,고기가냠냠,저두 담주쯤에 리프테라2 리쥬란 같이 받으러 가용 같이 받고나서 효과가 넘 좋아서 몇번 더 받을 예정이에요!! 피부탄력도 더 좋아지는 느낌이라 굳굳,,
,1513,2025.08.31,여우야,https://cafe.naver.com/feko/9853257,쉽쉽,오오 저도용 ㅎㅎ 아직 텀이 남았지만 리프테라2 리쥬란 같이 받으니 탄력이 더 생기는 느낌이라 두세번 더 받으려구요,,
,1514,2025.08.31,여우야,https://cafe.naver.com/feko/9853742,온태기야,저두..!! 리프테라2 받는데 얼굴형 갸름해진거 보이면 만족도 넘 높아요 가성비도 좋고 회복기간이 딱히 없어서 괜찮은 것 같아요 계속 받기에,,
,1515,2025.08.31,여우야,https://cafe.naver.com/feko/9853742,호놀카,가성비 좋은게 최고죠 ㅋㅋㅋㅋ 다른 레이저들은 다 비싸요ㅠㅠㅠ리프테라2 제대로만 잘 받으면 효과 진짜 잘보는데..,,
,1516,2025.08.31,여우야,https://cafe.naver.com/feko/9853769,쉽쉽,넴 너무 자주는 아니구 적당히 텀두고 받아요 리프테라2는 한 세번정도 한두달 텀 두고 받으면 유지가 잘돼서 그 뒤로 3-6개월 마다 받아주면 더 좋더라그여,,
,1517,2025.08.31,여우야,https://cafe.naver.com/feko/9853769,온태기야,저듀 그정도 텀 두고 한번씩 받아주는데 얼굴라인 유지되고 좋아요ㅎ 이중턱이랑 처져보이는 볼살들 정리가 되니 이목구비도 더 또렷해보이네용,,
,1518,2025.08.31,여우야,https://cafe.naver.com/feko/9853885,망쵸쵸,리프테라2랑 스부 같이 많이 받죠 리쥬란 쥬베룩 둘중에 상담 받고 받으시는게 나을듯!! 같이 받으면 탄력이랑 피부결 개선에 도움 더 많이 된대요,,
,1519,2025.08.31,여우야,https://cafe.naver.com/feko/9853885,사고치쟈,리쥬란 쥬베룩 둘이 뭐가 다른진 잘 모르겠지만 ㅠ 리프테라2랑 둘다 조합은 다 좋은 것 같아서 일단 병원 상담 가서 추천 받아봐야겠네욤,,
,1520,2025.08.31,여우야,https://cafe.naver.com/feko/9854137,얼취기,피부결 괜찮고 하면 리프테라2만 받고 와도 괜찮을 것 같은데용 나중에 신경쓰일때 따로 받으시구!! 리프테라2도 콜라겐 형성에 도움주는 레이저라 받아주면 탄력도 생겨서 피부 더 좋아보이실거에여 ㅋㅋㅋㅋ,,
,1521,2025.08.31,여우야,https://cafe.naver.com/feko/9854137,독개비,네에 이번에는 리프테라2만 받고 올까봐요 라인타입만 받으려다가 펜타입 추가해서 같이 받으려구용..! 뭔가 한번 받을때 전체적으로 받아주는게 더 좋을 것 같아서ㅎㅎ,,
,1522,2025.08.31,여우야,https://cafe.naver.com/feko/9854244,얼취기,미리미리ㅠㅠ 왜 이제야 알았을까요 ㅋㅋㅋㅋㅋ피부는 돈을 쓰긴해야하나봐요 ^^ 리프테라2라 그래도 가격이 착해서 부담도 덜하고 주기적으로 받기 좋은 것 같아요 펜타입 라인타입 같이 받아주는게 전체적으로 개선에 도움많이 되는 것 같긴 해욤,,
,1523,2025.08.31,여우야,https://cafe.naver.com/feko/9854244,독개비,어렸을때부터 미리미리 관리는 필수인것 같아욤... 안그럼 탄력도 없고 잔주름도 많이 생김 ㅜㅜ 저도 리프테라2 펜+라인 타입 받으면서 전체적으로 관리 해주는 중인데 전후차이 확실히 다르긴 달라요 피부는 시술을 받을 수 밖에..,,
,1524,2025.08.18,여우야,https://cafe.naver.com/feko/9808542,클래식기타,네 많이들 받아요! 리쥬란이 속건조 잘 잡아줘서 피부결이 매끄럽게 돤다 하더라고요 리프테라2로 얼굴형 관리해주고 피부결까지 좋아지면 더 좋긴 하겠어용 저두 궁금.. 😮,,
,1525,2025.08.19,여우야,https://cafe.naver.com/feko/9808542,망쵸쵸,요즘 좁쌀이랑 피부도 안좋아보이고 해서 뭐라도 받고싶더라고요ㅠ 리프테라2는 꾸준히 받고 있는 레이저라 담번에 받으러 갈때 스킨부스터도 같이 받으면 더 좋지 않을까 싶어서 고민되네요ㅋㅋㅋ,,
,1526,2025.08.22,여우야,https://cafe.naver.com/feko/9823651,망쵸쵸,리프테라2 장점이 가격 착하고 받은 직후에도 일상생활 바로 가능해서 진짜 좋은 것 같아요 전 중요한 일 있거나 여행가기전에 무조건 받고 갑니당 ㅋㅋㅋㅋㅋㅋㅋㅋㅋㅋ 받으면 얼굴이 날렵해진 느낌ㅎㅎ,,
,1527,2025.08.27,여우야,https://cafe.naver.com/feko/9838101,오늘같은날,리프테라2랑 스킨부스터 같이 받아봤는데 좋긴 좋아요 ㅋㅋㅋㅋ 이번에도 같이 받아볼지 고민이에유 리프테라2 단독으로 받아도 좋긴 해용,,
,1528,2025.08.31,여우야,https://cafe.naver.com/feko/9821640,나를봐라바,저도 리프테라 처음 받았을 때 주변에서 얼굴에 뭐했냐는 소리 들었어요 ㅋㅋㅋ 그뒤로 꾸준히 받는 중인데 다른거 생각 안날 정도로 만족도 높아요 ㅠㅠ,,
,1529,2025.09.02,여우야,https://cafe.naver.com/feko/9821640,영광이야,진짜 신기해요 ㅋㅋ 저만 느끼는건 줄 알았는데 주변에서 봤을 때도 그게 보이나봐요.. 이런 얘기 들을수록 리프테라 꾸준히 해야겠다 싶어요!,,
쿨페이즈,1,"2025.08,01",성형위키백과,https://cafe.naver.com/juliett00/1479975,과일맛젤리,레이저리프팅 찾으시면 쿨페이즈도 괜찮아요 통증1도 없어요 쿨링시스템 있어서요 저 얼굴살 많이 처져서 얼굴라인 다 무너졌는데 시술 받고 확실히 리프팅 되면서 정리되더라구요 ㅎㅎ,,
,2,"2025.08,01",성형위키백과,https://cafe.naver.com/juliett00/1479847,과일맛젤리,저는 쿨페이즈 리프팅 시술 받았는데 이거는 멍이나 붓기가 없어서 일상생활 바로 가능해요!! 저는 바로 출근 했어요 ㅋㅋㅋ 그리고 이거는 마취 안해도 돼서 바로 시술 되더라구요 울퉁불퉁했던 얼굴선이랑 정리되고 윤곽도 또렷해졌어요,,
,3,"2025.08,01",성형위키백과,https://cafe.naver.com/juliett00/1479828,과일맛젤리,여러군데 상담 받아 보세요! 레이저리프팅 찾으시는거면 쿨페이즈 하는곳으로 가보세요 ㅎㅎ 이건 쿨링시스템 있어서 통증도 없고 탄력 떨어진거 리프팅 되면서 얼굴윤곽도 살아나서 좋더라구요!,,
,4,"2025.08,01",성형위키백과,https://cafe.naver.com/juliett00/1479791,과일맛젤리,"리프팅은 레이저리프팅부터 받아 보세요! 저 쿨페이즈로 시술 받았는데 이건 냉각기능 있어서 아프지 않아서 마취도 불필요하구요~ 리프팅이랑 모공, 피부결개선에 전체적으로 효과 봤어요",,
,5,"2025.08,01",성형위키백과,https://cafe.naver.com/juliett00/1479784,과일맛젤리,이중턱에는 쿨페이즈도 괜찮아용 ㅋㅋ 저 이중턱 늘어지고 진짜 투턱돼서 보기싫었었는데 시술 받고 갸름해지면서 턱선도 다시 살아나서 요즘 셀카 찍을 맛이 나요 ㅋㅋ,,
,6,"2025.08,01",성형위키백과,https://cafe.naver.com/juliett00/1479651,과일맛젤리,실리프팅 보다는 먼저 레이저로 ㄱㄱ하세요! 그 다음에 실이요~ 저는 쿨페이즈 받았는데 충분히 얼굴살 처진거 리프팅 되면서 윤곽도 살아나고 턱선도 또렷해졌어요 ㅎㅎ 이건 아프지 않아서 마취도 필요 없어요!,,
,7,"2025.08,01",성형위키백과,https://cafe.naver.com/juliett00/1479639,과일맛젤리,저는 레이저리프팅 받아도 충분히 효과 있던데요 ㅠㅠ 써마지 받으려다가 이건 통증이 너무 심하대서 쿨페이즈로 대신 받았는데 아프지 않고 효과 너무 좋았어요 울퉁불퉁했던 얼굴라인 정리되면서 진짜 갸름해지더라구요!,,
,8,"2025.08,01",성형위키백과,https://cafe.naver.com/juliett00/1479637,과일맛젤리,"저요~ 실리프팅 보다는 레이저부터 받으라고 해서 쿨페이즈로 받았는데 진짜 대.만.족이에요 ㅋㅋㅋ 아프지 않으니 마취 안해도 돼서 부담도 없고 멍, 붓기도 없었어요! 볼살처진거 정리 돼서 얼굴도 갸름해보이더라구요 ㅋㅋ",,
,9,"2025.08,01",여우야,https://cafe.naver.com/feko/9755090,오레오가루,저는 레이저만 받아도 효과 있어서 굳이 실은 안받아요 ㅋㅋㅋ 쿨페이즈로 받는데 탄력 탱탱해지는게 확실히 느껴지고 얼굴라인이 울퉁불퉁했는데 정리되면서 매끈해지더라구요 이건 안아파서 마취도 안해요!,,
,10,"2025.08,01",여우야,https://cafe.naver.com/feko/9755088,오레오가루,"통증 무서우신거면 쿨페이즈 ㅊㅊ이요~ 이건 쿨링시스템 있어서 통증 1도 없구요! 멍, 붓기도 없어서 바로 출근도 가능했어요 ㅋㅋㅋ얼굴살 처진거 리프팅 되니깐 윤곽도 또렷해지고 이목구비도 살아난 느낌이에요",,
,11,"2025.08,01",여우야,https://cafe.naver.com/feko/9755061,오레오가루,"써마지 괜찮은데 진짜 아프더라구요 ㅠㅠ 그래서 저는 이번엔 쿨페이즈로 대신 받았어요 요거도 고주파리프팅인데 이건 쿨링시스템 있어서 통증 없구요! 잔주름 모공, 탄력리프팅 모두 효과 봤어요!",,
,12,"2025.08,01",여우야,https://cafe.naver.com/feko/9755131,오레오가루,저는 피부가 얇은 편이라서 고주파로 받는게 좋다고 하더라구요! 써마지 많이들 하시는데 아무래도 통증이 심하다고 알려져 있어서 ㅠㅠㅠ 저는 고민끝에 쿨페이즈로 받은 케이스예요! 통증이나 멍 붓기도 없구요 피부탄력 떨어진거 리프팅 되면서 얼굴라인도 다시 살아났어요!,,
,13,"2025.08,01",여우야,https://cafe.naver.com/feko/9754883,오레오가루,얼굴살 없으면 초음파는 위험하고 고주파로 받으시는게 좋아요! 저도 그래서 쿨페이즈로 받았어요~ 볼패임 같은거 전혀 없었고 쿨링시스템 있어서 통증도 없었어요 ㅎㅎ 피부 쫀쫀해지고 탱탱해져서 요즘 다들 주변에서 뭐했냐고 물어봐요 ㅋㅋ,,
,14,"2025.08,01",여우야,https://cafe.naver.com/feko/9754680,오레오가루,전 실리프팅은 아니고 심부볼 처짐 심해서 팔자주름이 도드라져보이더라구요ㅜㅜ 그래서 쿨페이즈로 시술 받았어요! 통증없는 시술이나 마취 안해도 되고 써마지 가성비 시술이라고 생각하심 돼요 ㅋㅋ 탄력 탱탱해지면서 팔자주름도 자연스럽게 흐려지더라구요!,,
,15,"2025.08,01",여우야+,https://cafe.naver.com/fox5282/4305652,연어장새우,티타늄도 붓기 없나보네요! 저는 쿨페이즈 받았는데 이것도 멍이나 붓기 없더라구요 ㅋㅋ 그리고 냉각기능 자체가 있어서 일단 통증이 없어서 마취 없이도 시술 가능해서 진입장벽이 낮은거 같아요 ㅠㅠ,,
,16,"2025.08,01",여우야+,https://cafe.naver.com/fox5282/4305279,연어장새우,턱살 처짐 심해서 저는 쿨페이즈로 받았어요!일단 탄력이 떨어지면서 이중턱이 늘어지는거라서 ㅠㅠㅠ 쿨페이즈로 탄력 떨어진거 리프팅 해주니깐 턱살도 갸름해지고 턱선자체도 살아나서 또렷해보이더라구요! 안아픈 시술이라 더 좋은거 같아요 ㅋㅋ,,
,17,"2025.08,01",파우더룸,https://cafe.naver.com/cosmania/38174685,마법의봉,전 이번에 쿨페이즈+쿨소닉 조합으로 받았어용 초음파 고주파 같이 받으니깐 볼살이나 턱살 처진거 싹 정리되면서 확실한 효과 있더라구요 ㅋㅋ 얼굴살 전체적으로 빠진 느낌이라서 확실히 갸름해보이는 효과도 있구요!,,
,18,"2025.08,01",시크먼트,https://cafe.naver.com/parisienlook/5516142,원키더맥스,바로 일상생활 가능한거는 쿨페이즈도 괜찮아요 저도 점심시간에 짬내서 받고 왔는데 멍이나 붓기 없어서 다들 모르더라구요 ㅋㅋ 다운타임 없이 효과도 빨라서 리프팅 효과도 빠르게 나왔어요!,,
,19,"2025.08,01",여생남정,https://cafe.naver.com/suddes/3940541,러키럭키비키,"저도 직장인이라 멍, 붓기 없는거 찾는게 힘들었는데 ㅠㅠ 쿨페이즈도 멍 붓기 없고 통증도 없다고해서(쿨링시스템이 있대요) 받고 왔어요~ 반차 내고 받은 다음날 바로 출근했는데 다들 모르더라구요 ㅋㅋ 일주일 안에 턱살 정리되면서 턱선도 살아났구요!!",,
,20,"2025.08,01",여생남정,https://cafe.naver.com/suddes/3940452,러키럭키비키,피부탄력이 떨어지면서 얼굴라인 다 무너졌었는데 저는 쿨페이즈 리프팅 받았어요 ㅋㅋㅋ 턱선정리 되면서 얼굴형 이쁘다는 소리 들어요 요즘!,,
,21,2025.08.01,여우야,https://cafe.naver.com/feko/9757166,녹차샌드위치,"피부에 탄력 진심 중요해요ㅎㅎ.. 지금 처짐에 모공, 주름까지 고민이라면 고주파 리프팅인 쿨페이즈 잘알아봤어요 저 시술 후 탄력이 붙고 콜라겐 재생으로 피부 탱탱하니 턱선도 정리됐네요 마취크림 필요없음",,
,22,2025.08.01,여우야+,https://cafe.naver.com/fox5282/4306746,더우니빙수,저 겁 정말 많거든요? 아직까지 주사도 무서움ㅋㅋ 그런데 쿨페이즈 받을때는 아프지않아서 편하게 원장님이랑 대화 나누면서 했어요 시술후 탄력이 붙고 콜라겐 촉진덕에 주름진 곳이 쫀쫀해졌네요,,
,23,2025.08.01,여우야,https://cafe.naver.com/feko/9757113,녹차샌드위치,"넹 꼭 울쎄라 써마지 할 필요없어요~^^ 저는 쿨페이즈 시술 받았는데 같은 효과, 고주파거든요 그런데 쿨링시스템으로 통증, 다운타임 없고 가격대도 괜찮아서 만족도 더 높았네요 얼마나 안아프면 크림마취 없이 가능해요",,
,24,2025.08.01,여우야,https://cafe.naver.com/feko/9756800,녹차샌드위치,"피부관리 저는 레이저 리프팅인 쿨페이즈로 했어요 고주파 리프팅이라서 탄력만 아니라 잔주름, 피부결까지 좋아졌네요 아픈거 싫어하는데 냉각기능이 좋아 통증이 없었고 시술후 멍자국도 안남아서 편했구요",,
,25,2025.08.01,여우야,https://cafe.naver.com/feko/9756537,녹차샌드위치,울쎄라 아프져ㅠㅠ? 저 통증에 민감해서 안아픈 시술 찾아보다 쿨페이즈 했는데 특허받은 쿨링시스템으로 피부 보호해줘 열감이나 통증이 느껴지지 않았어요 효과는 시술당일에 바로 쫀쫀해진게 느껴졌구요,,
