기기구분,NO.,작업일,진행카페,작업ULR,닉네임,댓글내용,카페 댓글
리프테라,1,2025.10.01,여우야,https://cafe.naver.com/feko/9963207,할슈슈슈슈,아무래도 꿑나고 받으시는게 ㅎㅎ 연휴 즐기구 나중에 리프테라2로 관리해주면 딱일것 같아요 라인타입이면 얼굴형 정리해주기에도 좋구,
리프테라,2,2025.10.01,여우야,https://cafe.naver.com/feko/9960644,쿠에잉,맞아요 ㅋㅋ 피부과 효과는 좋지만 가격이 부담스러울때가 있잖아요 ㅠㅠㅠㅠ 이건 그런게 없으니까 꾸준하게 받을수도있구.. 주름 고민이시면 저러첨 쥬베룩이 좋은데 혹시!! 여드름이나 그런 거 필요하시만 리쥬란이 좋대요!!,
리프테라,3,2025.10.01,여우야,https://cafe.naver.com/feko/9960644,영광이야,저도 리프팅 고민하다가 리프테라2로 입문했어요!! 울쎄라 받을 가격에 이거 2~3번 더 받을 수 있어서 가격도 저렴한데 효과 바로 보여서 쵝오!!! 스킨부스터 조합은 생각 못했는데 건조하니까 담에 쥬베룩이나 리쥬란 더해서 받아봐야겠어요!!,
리프테라,4,2025.10.02,파우더룸,https://cafe.naver.com/cosmania/38237542,인수증,맞아요 저는 리프테라2랑 쿨페이즈로 꾸준히 관리 받으면서 피부가 점점 달라지는거 체감하니까 진짜 뿌듯해요~ 피부결도 좋아지고 톤업된 느낌 최고!,
리프테라,5,2025.10.02,파우더룸,https://cafe.naver.com/cosmania/38237443,인수증,조합해서 받는게 효과 더 좋은거 같아요 저도 리프테라2랑 쿨페이즈 조합해서 받았는데 라인정리되면서 탄력까지 개선돼서 더 완성도 높은 리프팅 효과보고있어요,
리프테라,6,2025.10.02,성형위키백과,https://cafe.naver.com/juliett00/1519228,내마음에저장,리프테라2 목주름도 많이 받는거로 알아요~ 저도 리프테라2랑 쿨페이즈 같이 받으면서 안티에이징 해주는데 통증도 없고 바로 일상생활 가능하니까 꾸준히 받기에 이만한 조합 없는거 같더라고요,
리프테라,7,2025.10.02,성형위키백과,https://cafe.naver.com/juliett00/1519034,내마음에저장,리프테라2+쿨페이즈 이 조합도 안아파요! 이렇게 받고나서 얼굴선 확실히 잡히고 피부 바탕 자체도 좋아지게 되니까 계속받게 되는 조합이에요!,
리프테라,8,2025.10.02,여생남정,https://cafe.naver.com/suddes/3968530,환생시로또,레이저 입문이면 리프테라2+쿨페이즈 강추해요 붓기랑 멍이 없어서 시술 받고나서 일상생활 바로 가능해요~ 효과도 확실히 올라와서 저는 꾸준히 받고있어요,
리프테라,9,2025.10.02,성형위키백과,https://cafe.naver.com/juliett00/1518654,내마음에저장,인정요 ㅋㅋ 이 조합이 진짜 피부결 좋아져서 메컵도 훨씬 잘먹고 리프팅 효과도 좋아서 만족감 최고에요~ 관리받는 기분으로 계속 받고있어요,
리프테라,10,2025.10.02,여우야,https://cafe.naver.com/feko/9963207,기다려왔던날,리프테라2 받을때 쿨페이즈도 같이 고고하세요! 둘다 자극이 없어서 주기적으로 받기에 부담도 없고 저는 관리받는 기분 들어서 꾸준히 받고있어요~,
리프테라,11,2025.10.02,여우야,https://cafe.naver.com/feko/9965134,기다려왔던날,리프테라2가 가격 착해서 저는 쿨페이즈도 같이 받았어요! 처음에 리프팅만 생각했었는데 피부결까지 같이 좋아지니깐 같이받길 잘한거같아요~ 화장할때 모공 부각 안되는거 너무 좋아요 ㅎㅎ,
리프테라,12,2025.10.02,여생남정,https://cafe.naver.com/suddes/3968041,환생시로또,꾸준히 관리해주려면 리프테라2+쿨페이즈도 한번 알아보세요 가격도 착하고 붓기도 없어서 꾸준히 관리하기 좋거든요 저도 시너지효과 만족해서 따로안받고 같이 받고있어요,
리프테라,13,2025.10.02,재잘재잘,https://cafe.naver.com/knife67/437886,장보고또보고,리프테라2+쿨페이즈가 꾸준히 받다보니 피부 탄탄해지고 광이 돌아서 피부 좋아졌다는 얘기 많이 듣고있어요 ㅋㅋ 관리 효과 확실히 느껴져요~,
리프테라,14,2025.10.02,여우야,https://cafe.naver.com/feko/9966594,기다려왔던날,리프테라2가 얼굴 윤곽 확실하게 정리해주고 쿨페이즈가 피부 탱탱해지는거 시간 지날수록 체감될거에요 저도 두개 조합해서 받고있는데 결과 너무 만족중이에요,
리프테라,15,2025.10.02,여생남정,https://cafe.naver.com/suddes/3968187,환생시로또,"저는 리프팅 효과랑 가격,통증 고려해서 리프테라2+쿨페이즈 같이 받았는데 통증없이 효과 만족해서 꾸준히 받게 되더라고요~",
리프테라,16,2025.10.02,여우야+,https://cafe.naver.com/fox5282/4425058,나를좋아해,전 실리프팅은 통증이랑 다운타임 때문에 못받겠어서 리프테라2랑 쿨페이즈로 받았는데 둘다 붓기랑 멍이 없어서 바로 일상생활 가능하니 너무 좋더라고요~ 효과도 확실해서 만족해요,
리프테라,17,2025.10.02,성형위키백과,https://cafe.naver.com/juliett00/1518670,내마음에저장,리프테라2 가성비 최고죠~ 저는 이중턱에는 리프테라2로 정리해주고 피부 탄력은 쿨페이즈로 매끈하게 관리해주니까 전체적으로 인상 산뜻해졌어요~,
리프테라,18,2025.10.02,여우야,https://cafe.naver.com/feko/9967125,기다려왔던날,아픈것도 있고 안아픈것도 있어요 저도 안아픈거 찾다가 리프테라2랑 쿨페이즈로 꾸준히 받고있는데 확실히 나이대비 동안이라는 얘기 자주 들어요~ 얼굴선도 잡히고 피부 바탕을 매끈하게 채워주니까 효과가 배가 되네요,
리프테라,19,2025.10.02,여우야+,https://cafe.naver.com/fox5282/4424671,나를좋아해,저는 리프테라2로 이중턱 정리해주고 쿨페이즈로 피부결 매끈하게 해줬어요~ 이렇게 받고나서 거울볼때마다 만족감 느끼는중이에요 ㅎㅎ 한번 효과보니 정기적으로 관리할수밖에 없더라고요,
리프테라,20,2025.10.02,여생남정,https://cafe.naver.com/suddes/3968497,환생시로또,전 리프테라2+쿨페이즈로 꾸준히 받고있는데 확실히 노화속도 늦춰진 느낌이에요 가격부담도 없고 통증도 없어서 받기 좋은데 확실히 피부가 탄탄해져서 기분 좋아져요~,
리프테라,21,2025.10.02,여우야,https://cafe.naver.com/feko/9967971,멀어지다,넹넹 시간지날수록 효과 더 잘보실거에요 ㅎ리프테라2는 세번 정도 받아주면 유지기간도 더 길고 효과도 굳굳,
리프테라,22,2025.10.02,여우야+,https://cafe.naver.com/fox5282/4425118,나를좋아해,쿨페이즈로 꾸준히 관리해보세요 저는 리프테라2랑 같이 꾸준히 받고있는데 확실히 얼굴선 또렷해졌고 피부결도 부드러워져서 화장할때 밀림도 없어졌어요! 주변에서 피부 좋아졌다고 얘기 들으면 엄청 뿌듯하더라고요~,
리프테라,23,2025.10.02,여우야,https://cafe.naver.com/feko/9967971,사빠달달,저도 리프테라2 받고 왔는데!! 며칠 안됐지만 그래도 만족도가 꽤 높아여 ㅎㅎ 한 세번 정도는 텀 두고 받아쥬는게 좋다해서 담달에도 또 받으러 가려고요!,
리프테라,24,2025.10.02,여우야,https://cafe.naver.com/feko/9967971,기다려왔던날,예전에는 아픈거땜에 생각도 못하다가 리프테라2랑 쿨페이즈 받고나서 피부톤도 정돈되고 모공까지 줄어들어서 이 조합으로 관리중이에요~ 훨씬 어려보이는 효과 있어서 만족도 최고네요 ㅎㅎ,
리프테라,25,2025.10.02,여우야,https://cafe.naver.com/feko/9968183,사빠달달,넴..! 그런 것 같아요 받고 시간지나니까 얼굴라인이 많이 정리된 기분이라 ㅎ 한달 텀 두고 세번은 받아주려구요,
리프테라,26,2025.10.02,여우야+,https://cafe.naver.com/fox5282/4424735,나를좋아해,저는 통증 진짜 걱정됐는데 리프테라2랑 쿨페이즈 받았는데 자극없이 받아서 좋았어요 관리받는 느낌 제대로 나서 주기맞춰서 꾸준히 받고있어요!,
리프테라,27,2025.10.02,여우야,https://cafe.naver.com/feko/9968183,멀어지다,초반에는 한달 텀씩 두고 세번정도 받아주는게 좋아요 효과도 더 잘나오구 그 뒤로 부턴 관리차원으로 받기에도 진짜 좋긴 해여 자극도 덜하고,
리프테라,28,2025.10.02,여우야+,https://cafe.naver.com/fox5282/4423210,나를좋아해,저도 리프테라2로 턱선 정리해주고 쿨페이즈로 모공이랑 피부결까지 개선되니까 확실히 피부 자체가 탄탄해졌어요! 그냥 리프팅만 하는게 아니라 피부결 관리까지 되니까 만족도가 훨씬 높네요,
리프테라,29,2025.10.02,여우야,https://cafe.naver.com/feko/9963207,망쵸쵸,넹넹 끝나구 받으려구요 아무리 생각해도 연휴내내 얼굴이 띵띵 부을 것 같아서ㅋㅌㅌㅋ리프테라2 라인타입이 살 정리해주기엔 최고에여,
리프테라,30,2025.10.02,성형위키백과,https://cafe.naver.com/juliett00/1518670,언뉘,말했듯이 가성비 좋아서 입문용도 괜찮고 통증도 적어서 진짜진짜 추천하고 싶어요!!! 그리고 다운타임도 없어서 받자마자 바로 일상생활도 가능해요ㅎㅎㅎㅎ 단기간 빨리 효과 보고 싶으면 리프테라2 완전 마음에 드실테니까 좋은 경험되시길!!,
리프테라,31,2025.10.02,여우야,https://cafe.naver.com/feko/9964897,나도알았오,그져!! 가격도 진심 괜찮자나여 솔직히 이만한 가격에 리프팅 없움 글고 얼굴라인 뽝 잡히고 내 얼굴형이 이랬다고?!!? 싶은 느낌ㅋㅋㅋㅋㅋ 리쥬란이랑 같이 받으면 좋아요 몬가 광이 더 차오르는?!?,
리프테라,32,2025.10.02,여우야,https://cafe.naver.com/feko/9960644,트위데,리프테라2 저는 라인타입이랑 펜타입 같이 받았는데 효과 잘봐서 만족스러웠어요~ 통증도 거의없구 팔자주름도 자연스럽게 펴지구요!,
리프테라,33,2025.10.02,성형위키백과,https://cafe.naver.com/juliett00/1518670,망고맛나,"헉 안 그래도 받아보고 싶은데 붓기나 멍이 걱정이기도 하구,, 그래서 머가 좋을지 입문용으로 계속 찾아보고 있었거든요ㅜㅜㅜ 힝 감사합니다 리프테라2 찾아봐야겠어요ㅠ",
리프테라,34,2025.10.02,여우야,https://cafe.naver.com/feko/9963207,트위데,저는 다 괜찮을거같기는해요 ㅎㅎ 리프테라2가 다운타임도 없구 가격도 착해서 받기에 좋았어요~ 효과도 잘나타나서 저는만족스러웠어요,
리프테라,35,2025.10.02,여우야,https://cafe.naver.com/juliett00/1518670,원지씌,헐 저도 리프테라2 받았는데 효과 바로 보여서 엄청 놀랐오요! 특히 그 통증 적은데 이렇게까지 올라간다고..? 싶을정도! 안 그래도 곧 다시 받으러 가야하는데 그때는 추천해주신 리쥬란 조합으로 해볼까봐요 꺄아~~,
리프테라,36,2025.10.02,여우야,https://cafe.naver.com/feko/9964897,트위데,리프테라2 진심 괜찮지않나요 ㅎㅋㅎ 저도 반신반의하면서 받았는데 통증도 거의 못느꼈는데 이중턱라인도 정리 잘되니까 신기한 경험 했어요,
리프테라,37,2025.10.02,여우야,https://cafe.naver.com/feko/9965134,트위데,맞아요 ㅎㅎㅎ리프테라2 가격도 착한데 통증도 거의 없구 다운타임 없어서 만족도 높았어요 저도~ 다음번에 주기돌아오면 또 받아주려구요,
리프테라,38,2025.10.02,여우야,https://cafe.naver.com/feko/9966594,트위데,리프테라2 효과 잘봤어요 저는!ㅋㅋ 리프테라2가 통증도 없구 팔자주름도 자연스럽게 펴지니까 좋더라구요! 쿨페이즈는 피부결 향상되서 좋구요,
리프테라,39,2025.10.05,여우야,https://cafe.naver.com/feko/9971376,개코루,앜ㅋㅋㅋ 맞아요 진짜 ㅠㅠ 주기적으로 맞춰드리기에도 정말 부담없으니 리프테라가 딱일듯...! 당장 예약 잡아야겠어용 ㅠㅠ!!!,
리프테라,40,2025.10.05,여우야,https://cafe.naver.com/feko/9971376,장겨울,50대 초반이시면 아직 한창이실떄죠ㅋㅋㅋ 저희 엄마도 리프테라 엄청 좋아하세요!! 가격부담 없으니 분기별로 한번씩 효녀 코스프레하며 해드리기 아주 딱임요 ㅋㅋㅋㅋㅋㅋ,
리프테라,41,2025.10.05,재잘재잘,https://m.cafe.naver.com/knife67/439159,한추,저는 리프테라 쿨페이즈 조합으로 받았어요 리프테라2 단독으로만해도 효과 좋았는데 더 욕심내서 시너지 조합으로 해봣는데 하길잘했다 생각들더라구요 굿굿,
리프테라,42,2025.10.06,재잘재잘,https://cafe.naver.com/knife67/440332,온더웨이,통증 부담되서 저도 리프테라2로 관리중인데 시술후에 화장도 바로 가능하고 붓기도 없어서 만족중이에요 리프팅중에서 가성비도 최고라 꾸준히 받기에도 좋구요,
리프테라,43,2025.10.06,성형위키백과,https://cafe.naver.com/juliett00/1519883,코지라운지,저는 리프테라2 꾸준히 받고 있어요~ 다른 리프팅에 비해서 가격이 착한데 효과 확실해서 꾸준히 하고있는데 진짜 만족스러워요,
리프테라,44,2025.10.06,성형위키백과,https://cafe.naver.com/juliett00/1519904,코지라운지,리프테라2 한번 받아보세요 자극도 거의 없고 부담 없는 가격이라 저는 정기적으로 받고있는데 얼굴선 또렷해진거 너무 만족중이거든요,
리프테라,45,2025.10.06,여생남정,https://cafe.naver.com/suddes/3968903,딥브리즈,통증약한거 찾으시면 리프테라2 추천해요~ 크림마취만해도 통증 1도 안느껴지는데 다운타임도 하도 없어서 진짜 편하게 받고있거든요,
리프테라,46,2025.10.06,성형위키백과,https://cafe.naver.com/juliett00/1519561,코지라운지,상담도 중요해요그래서~ 전 리프테라2 꾸준히 받고 있는데 얼굴 처짐개선 확실한데 가격도 착하고 붓기도 없어서 꾸준히 받기 부담 없이 효율 좋아요!,
리프테라,47,2025.10.06,여생남정,https://cafe.naver.com/suddes/3968936,딥브리즈,리프테라2도 같이 받아보세요 통증도 거의없고 얼굴라인 정돈되는거 바로느껴져서 저는 꾸준히 받고있어요~,
리프테라,48,2025.10.06,재잘재잘,https://cafe.naver.com/knife67/440337,온더웨이,맞아요 ㅋㅋ 리프테라2가 진짜 펜타입도 같이 있어서 예민한 부위까지 받을수있는것도 좋고 가성비까지 챙길수있어서 저도 인생리프팅이에요,
리프테라,49,2025.10.06,여생남정,https://cafe.naver.com/suddes/3968949,딥브리즈,저는 리프테라2 받고나서 팔자라인까지 부드러워져서 리프테라2 추천하게 되더라고요 ㅋㅋ 변화도 자연스럽고 가격도 착해서 너무 만족해요,
리프테라,50,2025.10.06,여생남정,https://cafe.naver.com/suddes/3968497,딥브리즈,리프테라2 라인타입이 얼굴선 확 정리되는데 효과 좋아요 이 가격대에 이런 효과는 처음이라 꾸준히 받고있어요~,
리프테라,51,2025.10.06,여우야,https://cafe.naver.com/feko/9972209,맑은고운날,리프테라2 받아보세요 통증이랑 붓기 없어서 받을때 부담 전혀 없어요~ 가격도 합리적이라 관리용으로 꾸준하기 딱 좋아요,
리프테라,52,2025.10.06,성형위키백과,https://cafe.naver.com/juliett00/1519881,코지라운지,리프테라2는 진짜 꾸준하게 받기에 정답인 리프팅인듯요 부담없는 금액이라 주기적으로 관리해도 큰 무리 없어요!,
리프테라,53,2025.10.06,여우야,https://cafe.naver.com/feko/9970405,맑은고운날,리프테라2 받아보세요 시술 후에도 피부 편안해서 전 좋더라고요 가성비 좋다는 이유도 직접 받아보면 확실히 이해하실거에요,
리프테라,54,2025.10.06,여우야,https://cafe.naver.com/feko/9971376,맑은고운날,리프테라2가 꾸준히 하면 얼굴선 점점 정도돼서 좋아요 저도 꾸준히받고있는데 효과만족도 정말 높아요,
리프테라,55,2025.10.06,여우야+,https://cafe.naver.com/fox5282/4427457,하루살림,저는 울쎄라 가격이 너무 쎄서 부담되더라고요ㅠ 리프테라2가 현실적인 금액이라 꾸준히 받고있는데 효과 너무만족중이에요,
리프테라,56,2025.10.06,여우야,https://cafe.naver.com/feko/9971468,맑은고운날,저도 리프테라2가 자극없이 얼굴 전제적으로 정리되는 느낌이라 너무 만족해요! 가격도 진짜 괜찮고~,
리프테라,57,2025.10.06,여우야+,https://cafe.naver.com/fox5282/4427762,하루살림,질문 괜찮은듯요 저는 리프테라2 받고나서 턱선 엄청 매끈해졌어요 붓기랑 멍도 없고 가성비까지 좋아서 계속 관리해주고있는데 리프테라2도 상담 받아보세요,
리프테라,58,2025.10.06,여생남정,https://cafe.naver.com/suddes/3968748,딥브리즈,저는 얼굴 처짐 신경쓰여서 리프테라2 꾸준히 받고있어요~ 리프테라2 받고나서 윤곽선이 훨씬 또렷해졌는데 가격도 합리적이라 꾸준히 받기 좋더라고요,
리프테라,59,2025.10.06,여우야+,https://cafe.naver.com/fox5282/4426520,하루살림,리프테라2 받아보세요 리프테라2가 확실히 부담도 덜해서 꾸준히 받기 좋아서 그런지 저는 효과 잘보고있어요 아프지도않고요,
리프테라,60,2025.10.06,여우야,https://cafe.naver.com/feko/9971504,맑은고운날,네네 저 꾸준히 받는데 볼패임도 없고 붓기도 하나도 없어서 편하게 받고있어요 가격까지 착해서 안받을 이유가 없어요,
리프테라,61,2025.10.06,여우야+,https://cafe.naver.com/fox5282/4427166,하루살림,저도 처음에 받기전엔 진짜 괜찮을까? 생각했었는데 처짐이 눈에 띄게 정리되서 지금은 꾸준히받고있어요~ 이 가격에 이정도면 완전 만족해요!,
리프테라,62,2025.10.06,여우야+,https://cafe.naver.com/fox5282/4427746,하루살림,저도 리프테라2 꾸준히 받고 있는데 진짜 얼굴선이 또렷해졌어요~ 통증도 거의없고 가격부담도 없어서 정기관리용으로 딱인듯요,
리프테라,63,2025.10.06,여우야,https://cafe.naver.com/feko/9972656,나를봐라바,맞아요 진짱 ㅠㅠ 저도 그렇게 생각해서 리프테라를 끊을수가 없..ㅋㅋㅋㅋㅋ 휴ㅠ 대체제가 없는건가요 ㅠㅠ~~,
리프테라,64,2025.10.06,여우야,https://cafe.naver.com/feko/9971468,원뎅,저랑 같은고민 해결되셨네요 저는 팔자주름까지 깊어서 라인/펜 병행해서 받으니까 훨씬 더 좋더라구요 주름도 펴지고 전체적 피부결개선도되고 만족스러워요 ㅎ,
리프테라,65,2025.10.06,여우야,https://cafe.naver.com/feko/9972656,장겨울,리프팅은 이상하게 고가에만 장비들이 몰려있는거 같아요 ㅠ 고가라고 효과가 몇배씩 좋은게 아닌뎅 ㅠ 근데 가격대도 괜찮고 효과도 짱짱한거면 진짜 리프테라밖엔 없는듯요 아직ㅋㅋㅋ,
리프테라,66,2025.10.06,여우야,https://cafe.naver.com/feko/9971504,원뎅,네 볼패임없이 효과보고있어용 샷수 조절해가며 받아봐보세요 원장님과 상담해보시고!! 저는 리프테라받고 효과만족이라 꾸준히 관리차원으로 하게되더라구요 가성비도 좋구!!,
리프테라,67,2025.10.06,여생남정,https://cafe.naver.com/suddes/3968936,사마,리프테라2 쿨페이즈 조합도 좋더라구요 리프테라2로 효과본뒤로 쿨페이즈랑도 많이들하시길래 해봤는데 시너지에 정말 좋은듯요!!,
리프테라,68,2025.10.06,여생남정,"https://cafe.naver.com/suddes/3968949
",사마,올만에 친척들보니까 다들 얼굴 갸름해진거같다고 살빠졌냐고 하시더라구요 리프테라2로 효과봤어요ㅎㅎ 자기만족도있지만 남이 알아봐주니까 더 기분좋더라구요 ㅎㅎ,
리프테라,69,2025.10.07,여우야,https://cafe.naver.com/feko/9971468,소보루냠냠,리프테라2 좋져..! 확실히 받으면 얼굴라인이 정리되는게 느껴지긴해요ㅎㅎ 저도 리프테라2로 관리중인데 만족도가 높아서 쭉 받아주고 있어요,
리프테라,70,2025.10.07,여우야,https://cafe.naver.com/feko/9973615,장겨울,맞아요 ㅠㅠ 관리는 정말 꾸준히가 답인거 가타여 ㅠ 리프테라가 가격대가 부담이 적어서 언제든 꾸준히 맞을수 있을거 같아서 한건데 진짜 이게 신의한수였던 듯 ㅠㅋㅋㅋㅋ,
리프테라,71,2025.10.07,여우야,https://cafe.naver.com/feko/9973615,스펠스,진짜 맞는말 휴... 한살한살 나이 더 들수록 관리 필수에요!! 저도 그래서 리프테라랑 스킨부스터 조합으로 3~4달에 한번씩 꾸준히 맞고있어요ㅜㅜ,
리프테라,72,2025.10.08,성형위키백과,https://cafe.naver.com/juliett00/1520136,라인예술,다음에는 리프테라2랑 쿨페이즈도 받아보시는거 추천요! 저도 이렇게 받고나서 얼굴톤도 균일해지고 피부 윤기돌아서 피부가 전체적으로 좋아졌어요! 가격도 부담 없어서 강추해요~,
리프테라,73,2025.10.08,재잘재잘,https://cafe.naver.com/knife67/440332,리얼유니,저도 아픈거 싫어서 리프테라2랑 쿨페이즈로 관리중인데 시술후에 일상생활도 바로 가능해서 진짜 편하게 관리중이에요~ 확실한 효과로 꾸준히 관리하려면 전 이조합 추천해요,
리프테라,74,2025.10.08,성형위키백과,https://cafe.naver.com/juliett00/1520159,라인예술,전 써마지 가격 너무 부담되가지고 리프테라2랑 쿨페이즈로 받았는데 가격대비 효과 너무 만족해요~ 시너지효과까지 볼수있어서 꾸준히 관리하기에 제일 적합한 느낌이더라고요 ㅎㅎ,
리프테라,75,2025.10.08,성형위키백과,https://cafe.naver.com/juliett00/1520213,라인예술,리프테라2랑 쿨페이즈 장점이 통증없이 효과 좋다는거! 저도 자연스럽게 피부결도 정리되고 얼굴선도 또렷해져서 만족중이에요,
리프테라,76,2025.10.08,재잘재잘,https://cafe.naver.com/knife67/440337,리얼유니,써마지도 좋지만 리프테라2랑 쿨페이즈 조합 한번 알아보세요~ 가격이나 통증부분에서 차이많이 나는데 시너지효과 볼수있어서 저는 이게더 만족스럽더라고요,
리프테라,77,2025.10.08,여생남정,https://cafe.naver.com/suddes/3968992,쿨하게행,리프테라2가 얼굴선 정리에 좋고 쿨페이즈가 피부결 담당해주니까 이 두개가 찰떡인듯요! 조합해서 받으면 얼굴 전체 밸런스가 좋아져요~,
리프테라,78,2025.10.08,재잘재잘,https://cafe.naver.com/knife67/440813,리얼유니,,
리프테라,79,2025.10.08,여생남정,https://cafe.naver.com/suddes/3969032,쿨하게행,저는 리프테라2랑 쿨페이즈로 관리중인데 이 조합이 다른 리프팅들보다 통증이 훨씬 덜해서 무서움없이 받을수 있었어요ㅠ 그만큼 꾸준히 받게 되는 이유인듯해요~,
리프테라,80,2025.10.08,여생남정,https://cafe.naver.com/suddes/3969057,쿨하게행,"저는 리프테라2로 얼굴선 다듬고 쿨페이즈로 피부결 잡는 조합으로 관리중인데 이게 가격이나 통증,다운타임 부담 없이 자연스럽게 효과 좋더라고요",
리프테라,81,2025.10.08,여우야,https://cafe.naver.com/feko/9973580,예뻐가자,상담때 피부진단도 같이 받으시는게 좋죠 저는 리프테라2랑 쿨페이즈 꾸준히 받으니까 얼굴선이 무너질 틈이 없어서 좋은듯요 ㅋㅋ 특히 하관쪽 정리돼서 얼굴형도 또렷해진게 너무 맘에들어요,
리프테라,82,2025.10.08,여우야,https://cafe.naver.com/feko/9971889,예뻐가자,턱선정리에는 리프테라2 같이 받으면 효과 확실할거에요 저도 리프테라2랑 쿨페이즈 조합해서 관리하니까 훨씬 효율적이고 효과 좋아서 만족중이거든요,
리프테라,83,2025.10.08,성형위키백과,https://cafe.naver.com/juliett00/1520176,라인예술,저는 리프테라2로 받았는데 이중턱이랑 턱선 정리 효과 확실했어요~ 쿨페이즈까지 같이 받았는데 피부가 정돈된 느낌이라 관리받은 티가 나더라고요 ㅎㅎ,
리프테라,84,2025.10.08,여우야,https://cafe.naver.com/feko/9971504,예뻐가자,전 리프테라2랑 쿨페이즈 같이 받았는데 둘다 통증이랑 붓기 없어서 부담 없었어요 리프팅이랑 피부결 관리 한번에 되서 꾸준히 유지중이에요,
리프테라,85,2025.10.08,성형위키백과,https://cafe.naver.com/juliett00/1520185,라인예술,리프테라2가 펜타입도 있어서 세밀하게 리프팅도 가능하고 쿨페이즈랑 병행하면 얼굴 전체가 맑아지고 정리되는 느낌이라 저도 만족하고있어요~,
리프테라,86,2025.10.08,여우야+,https://cafe.naver.com/fox5282/4428528,리프정,어디서 받으셨길래..ㅠㅠ 저는 울쎄라 비싸고 통증심해서 리프테라2랑 쿨페이즈 조합해서 받았는데 리프팅이랑 피부결 동시에 정돈해주는 느낌이라 만족중이거든요 자연스럽게 얼굴 정리돼서 인위적이지도 않고 만족해요~,
