기기구분,NO.,작업일,진행카페,작업ULR,닉네임,댓글내용,카페 댓글
쿨소닉,1240,2025.10.16,파우더룸,https://cafe.naver.com/cosmania/38246349,오늘도봄바람,전 레이저 리프팅으로 얼굴형이랑 피부결 동시에 개선했어요! 쿨소닉이랑 쿨페이즈 조합으로 받았는데 둘다 시 원한 느낌 덕분에 편하게 시술 받았는데 얼굴선 정리되니까 인상이 확 살아났어요~ 피부도 매끄러워져서 전 이 조합으로 꾸준히 받아보려고요 ㅎㅎ,
쿨소닉,1241,2025.10.16,성형위키백과,https://cafe.naver.com/juliett00/1524687,그린눈빛,저도 쿨소닉 편하게 받았는데 효과가 좋아서 다음에는 샷을 올려서 받아볼까도 생각중이에요 효과가 좋으니깐 또 받을 생각들더라고요,
쿨소닉,1242,2025.10.16,성형위키백과,https://cafe.naver.com/juliett00/1524687,그린눈빛,맞아요 저도 멍드는줄알았는데 쿨소닉은 이런게 하나도 없으니깐 그냥 누워있다가 끝났거든요 근데 효과 올라오는거 보이니 깐 다음에도 받아야겠다 생각들었어요,
쿨소닉,1243,2025.10.16,여우야+,https://cafe.naver.com/fox5282/4441413,익명인간,맞아요 ㅋㅋ 주변에서 알아보면 그게 진짜인듯 ㅋㅋ 효과는 확실한데 통증이 없다? 다음에도 쿨소닉 예약이요 ㅋㅋ,
쿨소닉,1244,2025.10.16,재잘재잘,https://cafe.naver.com/knife67/448043,커피한잔해요,쿨소닉 효과 좋아서 저도 만족중이에요~ 쿨소닉 받고 느낀게 통증없이도 원하는 효과 얻을수 있다는거? 편한게 시술 받고 효과까지 좋으니까 다음에도 쿨소닉 이어서 받아볼 생각이에요!,
쿨소닉,1245,2025.10.16,여우야+,https://cafe.naver.com/fox5282/4441413,익명인간,쿨소닉 초음파 리프팅이에요! 이중턱에 효과 좋아서 만족하고있어요~얼굴선 정리된 느낌 드는데 시술 내내 편하게 받았거든요 이게 진짜 좋았어요!,
쿨소닉,1246,2025.10.16,여생남정,https://cafe.naver.com/suddes/3972170,열린미소,맞아요 ㅋㅋ 저도 그동안 남들 다 리프팅 받을떄 못받고 있었는데 이번에 통증없이 효과 좋은거 체감하니 앞으로 꾸준히 관리해줘야겠어요!,
쿨소닉,1247,2025.10.16,여우야+,https://cafe.naver.com/fox5282/4441548,안벽수복,저도요~ 쿨페이즈는 전체적으로 피부결 살려줘서 좋았는데 쿨소닉이 펜타입이라 세세하게 리프팅 가능한게 너무 좋았어요!,
쿨소닉,1248,2025.10.16,여생남정,https://cafe.naver.com/suddes/3972170,열린미소,저도 다음에 받을때는 필요한 부분만 받아도 괜찮을거같아요 효과 좋은거 알았으니 필요한 부분만 받는게 더 합리적일수도 ㅋㅋ,
쿨소닉,1249,2025.10.16,여우야,https://cafe.naver.com/feko/9998625,뽀송씨,쿨소닉받고나서 얼굴형 개선되니깐 자신감도 많이 생겨서 피부결도 사실 욕심나긴 했어요 ㅋㅋ 한번 알아볼게요~,
쿨소닉,1250,2025.10.16,여우야,https://cafe.naver.com/feko/9998625,뽀송씨,진짜 안아픈게 너무 신기했어요 게다가 다음날엔 좀 붓기있겠지? 했는데 멍이랑 붓기도 하나도 없고 쿨소닉으로 리프팅 많이 받는 이유가 있더라고요!,
쿨소닉,1251,2025.10.16,여생남정,https://cafe.naver.com/suddes/3972170,열린미소,쿨소닉이 통증 없어서 다른거 받을때도 통증 없는거로 받아야 될거같은데 추천 감사해요~ 다음에 리프팅 받을때 같이 알아봐야겠어요,
쿨소닉,1252,2025.10.16,성형위키백과,https://cafe.naver.com/juliett00/1524772,오리발킥,리프팅이 통증 없다는게 안믿겼는데 쿨소닉 직접 받아보니 알겠더라고요 ㅋㅋㅋ 효과도 확실히 체감되니 많이 받는 이유 확실히 알겠어요,
쿨소닉,1253,2025.10.16,여우야+,https://cafe.naver.com/fox5282/4441846,봄날의기억,인정요 ㅎㅎㅎ 시술 후 며칠 지나면서부터 라인 확실히 잡히는게 보이고 볼살도 올라오면서 엄청 매끈해졌어요~ 한번 병행해서 받으면 왜 다들 이 조합 추천하는지 알듯해요 ㅎㅎㅎ,
쿨소닉,1254,2025.10.16,재잘재잘,https://cafe.naver.com/knife67/448043,초코가든,쿨소닉이랑 쿨페이즈 조합이 자극도 없어서 저처럼 피부 예민한 사람도 받을수 있는게 진짜 장점 같아요 쿨소닉으로 리프팅했으면 쿨페이즈로 피부결까지 정리 해보시는거 추천해요~ 전체적인 인상이 또렷해져서 전 만족중이거든요~,
쿨소닉,1255,2025.10.16,여우야+,https://cafe.naver.com/fox5282/4439778,크랑크슈탄,쿨소닉+쿨페이즈 쿨쿨조합도 좋아요 울써마지 고민이시면요 ㅋㅋㅋ 초음파랑 고주파 조합이라서 탄력이나 리프팅 효과 같이 볼 수 있고 유지력도 좋아요!! 무엇보다 쿨링기능 있어서 아프지도 않았어요,
쿨소닉,1256,2025.10.16,여생남정,https://cafe.naver.com/suddes/3971633,러키럭키비키,쿨소닉이랑 쿨페이즈 조합도 좋아여 쿨링기능 있어서 아프지도 않고 이것도 초음파 고주파 시술이라서 리프팅 되면서 탄력도 같이 올라오더라구요 ㅋㅋ,
쿨소닉,1257,2025.10.16,여우야,https://cafe.naver.com/feko/9968017,한재이닝,"저는 쿨페이즈에 관심이 많은데 피부결이나 잔주름, 탄력 이렇게 개선 가능하다 하더라구요 쿨소닉도 냉각기능으로 통증 없다 들었는데 같이 받기 좋을 것 같아요",
쿨소닉,1258,2025.10.16,여우야,https://cafe.naver.com/feko/9998901,허니치즈케익,"울퉁불퉁한 라인이랑 이중턱 관리 원한다면 쿨페이즈랑 쿨소닉 조합도 있어요 탄력, 처짐, 피부결, 주름에 효과 좋은 리프팅인데 쿨링기능이 있어 아프지않고 시술후에 멍, 붓기도 안남아 일상생활 무리 없구요",
쿨소닉,1259,2025.10.16,여우야,https://cafe.naver.com/feko/9998517,허니치즈케익,아ㅜㅜ 살처짐은 레이저 리프팅이요 탄력부족으로 살들 계속 처지고 피부상태 안좋아져서 리프팅으로 했는데 타이트닝 효과덕에 얼굴선도 예뻐졌고 피부결도 정리됐어요 쿨페이즈랑 쿨소닉도 알아보세요,
쿨소닉,1260,2025.10.16,여우야,https://cafe.naver.com/feko/9998119,허니치즈케익,쿨페이즈랑 쿨소닉이요 특허받은 쿨링시스템으로 통증이 없는데 또 고출력이라 효과는 확실해서 좋았어요 수면마취 필요하지 않고 시술직후에 멍도 안남아요,
쿨소닉,1261,2025.10.17,여우야,https://cafe.naver.com/feko/10001154,웃기는내일,"쿨소닉 받고 나서 볼처짐, 하관라인 개선 확실하게 해서 정착한 레이저 리프팅이네요ㅎㅎ! 쿨링기능으로 피부 접촉면을 차갑게 만들어주다보니 통증이 없어서 굳이 마취크림 안바르고 시술 가능해요",
쿨소닉,1262,2025.10.17,여생남정,https://cafe.naver.com/suddes/3972706,만나기를,저 쿨소닉 받았는데 팔자주름에도 효과 많이 봤어요! 덕분에 노안처럼 보이던거 많이 개선되서 대만족중 ㅠㅠ 아프지도 않으니 한번알아보세요,
쿨소닉,1263,2025.10.17,여생남정,https://cafe.naver.com/suddes/3972348,만나기를,쿨페이즈 좋대요!! 전 쿨소닉 받았는데 완전 만족중요 ㅋㅋ 이건 통증 그냥 아예 없어가지고 완전 졸면서 받았다는 ㅠㅠㅠㅋㅋㅋ,
쿨소닉,1264,2025.10.17,여우야,https://cafe.naver.com/feko/10004934,헤르메,쿨소닉이요ㅋㅋㅋ 저 풀페이스 7천샷 맞았는데 완전 만족요~~ 펜이라 진짜 세밀한 부위까지 조사되서 그런가? 전 거의 당일부터 효과 마니봄ㅋㅋ,
쿨소닉,1265,2025.10.17,여우야,https://cafe.naver.com/feko/10004915,헤르메,울쎄라피프라임 좋긴 한데ㅠㅠ 통증은 있긴 하대요 그냥 울쎄라보다 줄어든건 맞지만.. 만약 안아프신거 원하시면 쿨소닉도 알아보세요,
쿨소닉,1266,2025.10.17,여우야,https://cafe.naver.com/feko/10004863,헤르메,앗 저도 쿨소닉 받고 쿨페이즈도 궁금하던 참인데 이렇게 후기 남겨주셔서 감사ㅎㅎ 쿨소닉 안아프고 효과 좋아서 넘 맘에들었는데 이거보니 쿨페이즈도 받아보고 싶네요,
쿨소닉,1267,2025.10.17,여우야,https://cafe.naver.com/feko/10004657,헤르메,맞아요 정말~ 전 쿨소닉이랑 잘맞는거 같아서 그냥 이걸로 쭉 갈까 고민중이에요ㅎㅎ 나한테 맞는거 찾고 꾸준히 하는게 정말 중요한듯,
쿨소닉,1268,2025.10.17,여우야,https://cafe.naver.com/feko/10004426,헤르메,저는 쿨소닉 ㅎㅎㅎ 울쎄라만큼 효과 좋은데 이건 안아파서 너무너무 좋더라구요ㅠㅠ 통증 예민하면 무조건 쿨소닉..,
쿨소닉,1269,2025.10.17,여우야,https://cafe.naver.com/feko/10004868,꼬기량,30대에 거상은.. 너무 빠른거 같네요 나이들어 후회하실수도.. 쿨소닉같은 고출력 리프팅 먼저 받아보시는건...?,
쿨소닉,1270,2025.10.17,여우야,https://cafe.naver.com/feko/10004771,꼬기량,완전 다르죠 노화 시작되는 30대부터 꾸준히 관리 시작하면 진짜 40대까지는 30대소리 듣는거도 쌉가능이라고 봐요 전. 저도 그래서 쿨소닉 꾸준히 맞는중~,
쿨소닉,1271,2025.10.17,여우야,https://cafe.naver.com/feko/10004754,꼬기량,쿨소닉+쥬베룩볼륨 조합 추천이요 쿨소닉이 고출력이라 효과 엄청 짱짱해서 나이 있으신 분들도 많이 맞아요.ㅎㅎㅎ,
쿨소닉,1272,2025.10.17,성형위키백과,https://cafe.naver.com/juliett00/1526029,이시가기,고통 없는거 찾으시는거면 쿨소닉...? 저도 받을까 말까 고민중이긴 한데 이게 울쎄라랑 비슷한 효관데 하나도 안아프대요,
쿨소닉,1273,2025.10.17,성형위키백과,https://cafe.naver.com/juliett00/1526029,소리츄,아무래도 쿨소닉이 제일 덜 아프긴 한거같아요(?)ㅋㅋㅋ 다른건 막 마취까지 하고서 받던데 이건 고통 없다고 하니ㅠㅠ,
쿨소닉,1274,2025.10.17,여생남정,https://cafe.naver.com/suddes/3973092,듀공장군,쿨소닉 좋죠ㅋ 저도 풀페이스 7천샷 맞고 완전 반쪽 얼굴되서 주변에 완전 전도하고 다니고 있어요ㅋㅋㅋㅋ 진짜 리프팅중에는 갑인듯,
쿨소닉,1275,2025.10.17,여생남정,https://cafe.naver.com/suddes/3973092,만나기를,맞아요 효과도 거의 바로 보이고ㅠㅠ 솔직히 쿨소닉 후기가 좋길래 기대 꽤 했었는데 진짜 기대보다 전 효과 더 많이봐서 돈이 안아깝네요ㅋㅋㅋ,
쿨소닉,1276,2025.10.17,여우야,https://cafe.naver.com/feko/10004945,꼬기량,"요즘 진짜 부쩍 건조해지긴 했어요 훔,, 리쥬란이나 쥬베룩이랑 쿨소닉 조합 좋다고 들었는데 그건 어떠세요??",
쿨소닉,1277,2025.10.17,여우야,https://cafe.naver.com/feko/10004945,헤르메,ㅠㅠ건조해서 갈라지고 각질 난리나요 하.. 리쥬란이랑 쿨소닉 가야하는건가요ㅠㅠ 쿨소닉은 안아픈데 리쥬란은 지옥의 고통이라그래섴ㅋㅋㅋ,
쿨소닉,1278,2025.10.17,여우야,https://cafe.naver.com/feko/10005055,뜨당,쿨소닉 진짜ㅠㅠ 저도 이번에 맞았는데 효과 거의 즉각적으로 올라와서 대만족중 따흑.. 남자들한테도 효과 좋다니 남친 시켜주고파용ㅎㅎㅎ,
쿨소닉,1279,2025.10.17,여우야,https://cafe.naver.com/feko/10005055,꼬기량,물론 사람 바이 사람이겠지만 저한텐 꽤 잘맞아서 저도 만족하고 있습니다 ㅋ 살 두꺼운 편인데도 효과 잘 나와서 쿨소닉에 인모드 남자분들께 강추요,
쿨소닉,1280,2025.10.17,여우야,https://cafe.naver.com/feko/10005272,꼬기량,저도 당일부터 얼굴 약간 얼얼하면서 쫀쫀해지는 느낌 난거 같아요ㅋㅋ 고출력이라 그런지 확실히 효과 체감이 빠르더군여,
쿨소닉,1281,2025.10.17,여우야,https://cafe.naver.com/feko/10005272,뜨당,"아 그쵸,...? 역시 제가 잘못느낀게 아니었...ㅠㅠㅋㅋㅋㅋ 저렴이랑 고민하다 쿨소닉 간건데 확실히 고출력이라 다르긴 한가봐용!",
쿨소닉,1282,2025.10.17,여우야,https://cafe.naver.com/feko/10000454,웃기는내일,지금 고민에 쿨소닉이 딱 맞을거 같아요 쿨링기능이 있어 피부 표면 열감을 보호해줘 통증이 없고 펜타입이라 굴곡심한 부분까지 꼼꼼하게 레이저 리프팅 받을 수 있었어요,
쿨소닉,1283,2025.10.17,여우야,https://cafe.naver.com/feko/10000228,웃기는내일,"레이저 리프팅 쿨소닉 받았는데 쿨링방식이 있어 통증 없이 편하게 시술할 수 있었어요^^ 울쎄라 효과와 마찬가지로 처짐, 턱선 정리, 이중턱에 효과 좋았구요",
쿨소닉,1284,2025.10.17,여우야,https://cafe.naver.com/feko/9999822,웃기는내일,"레이저 리프팅이 나이 상관은 없지만 울쎄라 저는 통증 문제로 쿨소닉 시술 했거든요 효과는 같은데 쿨링기능이 있어 통증, 다운타임 없어 편했어요 마취 안해도 괜찮음",
쿨소닉,1285,2025.10.17,여우야+,https://cafe.naver.com/fox5282/4443057,파스타피자,얼굴살 자꾸만 늘어져서 저는 타이트닝 효과 좋은 쿨소닉 초음파 리프팅 받았어요 울쎄라 펜타입이라고도 하는데 그만큼 더 촘촘하게 시술 가능했고 쿨링기능이 있어 통증이 거의 없었네요ㅎㅎ,
쿨소닉,1286,2025.10.17,여우야+,https://cafe.naver.com/fox5282/4442615,파스타피자,"레이저 리프팅도 생각중이라면 저는 쿨소닉도 추천해요 울쎄라 통증 때문에 못 받았는데 쿨소닉은 냉각기능으로 고출력이지만 통증이 없어 편하게 관리할 수 있었네요 탄력, 처짐, 턱라인, 이중턱 효과 봤어요",
쿨소닉,1287,2025.10.17,여우야+,https://cafe.naver.com/fox5282/4442222,파스타피자,얼굴 많이 보이는 직업이라면 쿨소닉 리프팅도 같이 알아보세요 효과는 울쎄라와 같은데 쿨링기능덕에 아프지않아 수면마취 필요하지 않았고 다운타임이 없네요 시술직후 멍이나 자국 안남아요,
쿨소닉,1288,2025.10.17,여생남정,https://cafe.naver.com/suddes/3972544,사과해요나한테,"20~30대라면 레이저 리프팅 먼저 받아보세용 저는 거상은 60대,, 넘어서 하려구욧!! 초음파인 쿨소닉 시술 받았는데 타이트닝 효과가 넘 좋다보니 처졌던 살들이 얼굴선에 맞춰 올라붙었고 얼굴형 자체가 달라졌어요",
쿨소닉,1289,2025.10.17,성형위키백과,https://cafe.naver.com/juliett00/1524952,트렌치블랙,나이먹으니 진심 탄력 계속 떨어지더라고요ㅠ 저는 쿨소닉이라는 초음파 리프팅 받았는데 탄력 차오르면서 턱선 정리뿐만 아니라 피부결까지도 정리됐네요 관리하고 안하고 차이 확실히 커요,
쿨소닉,1290,2025.10.17,성형위키백과,https://cafe.naver.com/juliett00/1524855,트렌치블랙,레이저리프팅 쿨소닉 받았는데 고출력이지만 쿨링기능으로 피부 접촉면을 차갑게 만들어 통증이 거의 없었어요^^ 시술 후 탄력이 붙으니 턱라인 싹 깔끔해졌고 저도 모르게 자신감이 생겼네요,
쿨소닉,1291,2025.10.17,성형위키백과,https://cafe.naver.com/juliett00/1524763,트렌치블랙,탄력부족으로 없던 이중턱까지 생겼는데 쿨소닉 레이저 리프팅 받고 나서 타이트닝 효과덕에 늘어진 턱라인이랑 처짐 개선할 수 있었어용 쿨링기능이 있는 시술이라 통증 거의 느껴지지 않았네요 넘 만족^___^,
쿨소닉,1292,2025.10.17,여우야,https://cafe.naver.com/feko/10001445,페퍼민치,쿨소닉+쿨페이즈 쿨쿨조합도 괜찮아요 일단 무통시술이라 부담없이 받기 괜찮구요 이중턱 심부볼 리프팅으로 싹 정리해주면서 피부결까지 동시에 좋아졌어요~,
쿨소닉,1293,2025.10.17,여우야,https://cafe.naver.com/feko/9975761,이지추,쿨페이즈가 냉각기능이 있어서 통증이 없고 따뜻한 느낌 정도만 난다고 하네요!? 쿨소닉도 통증 1도 없나봐요,
쿨소닉,1294,2025.10.17,여우야,https://cafe.naver.com/feko/9975761,이지추,쿨페이즈랑 쿨소닉 같이 병행해서 받기도 하나봐요 둘다 아무래도 무통리프팅이라서 더 그런가봐요 효과도 즉각적으로 나온다니!!,
쿨소닉,1295,2025.10.17,여우야,https://cafe.naver.com/feko/10003488,오늘도헬스,3개월 정도 남았다면 쿨페이즈랑 쿨소닉 시술이 냉각기능으로 통증이 없어 수면마취 안해도 괜찮은데 시술직후 피부에 멍이 남거나 붓기가 있지 않아 일상생활 바로 가능해요 그리고 효과 당일부터 보여서 예신들이 많이 받네요,
쿨소닉,1296,2025.10.17,여우야,https://cafe.naver.com/feko/10002464,오늘도헬스,올해 끝나기전에 시술 하나 찾아서 받아보세요 피부는 관리하고 안하고 차이는 확실하더라구요 저는 통증에 대해 민감해서 울쎄라나 써마지는 꿈도 못꾸고 냉각기능 있는 쿨페이즈 했는데 아프지않아 편했어요 턱라인이랑 주름 둘다 개선 원한다면 쿨소닉 조합도 괜찮아요,
쿨소닉,1297,2025.10.17,여우야+,https://cafe.naver.com/fox5282/4443057,망고프레즐,"얼굴살 늘어지는건 레이저 리프팅 받는게 좋아요 쿨페이즈랑 쿨소닉 시술이 쿨링기능이 있는 시술이라 고출력이지만 통증이 없거든요 멍, 붓기도 없고 수면마취 없이도 받을 수 있어요",
쿨소닉,1298,2025.10.17,여우야,https://cafe.naver.com/feko/10004863,눈과의늪,후기 잘보고가요!! 저도 쿨페이즈에다 쿨소닉 했거든요 쿨소닉이 속을 꽉 채워주고 쿨페이즈가 라인을 정리해줘서 피곤한 얼굴이 한순간에 달라졌어요 얼굴에 생기가 돌아요,
쿨소닉,1299,2025.10.17,여우야,https://cafe.naver.com/feko/10001531,눈과의늪,안아픈거 하실거면 쿨페이즈에다 쿨소닉 추천요 피부결이 매끈해지고 윤곽이 부드럽게 잡혀서 셀카 찍을 때 진짜 자신감 생겼어요 그리고 마취도 안해요,
쿨소닉,1300,2025.10.17,여우야,https://cafe.naver.com/feko/10003488,눈과의늪,쿨소닉+쿨페이즈 어때요?? 처음이라 긴장했는데 시술 중에 너무 시원해서 오히려 편하게 있었어요 쿨소닉으로 속탄력 올라오고 쿨페이즈로 겉이 매끄러워져서 자연스럽게 어려 보이는 느낌이에요,
쿨소닉,1301,2025.10.17,여우야+,https://cafe.naver.com/fox5282/4444837,내꿈길,사르티네 리프팅 평 좋죠 전 쿨페이즈에다 쿨소닉 했구 2차 문제 없이 효과 잘 유지 중이에요 그리고 무통이다 보니 부담감 제로요,
쿨소닉,1302,2025.10.17,여생남정,https://cafe.naver.com/suddes/3973091,부룬디,여러군데 비교해보세요 전 쿨페이즈에다 쿨소닉 같이 했거든요 병행하니까 피부가 환해지고 탄력 생겨서 다시 예전 얼굴로 돌아간 기분이에요 시너지 효과 제대로네요,
쿨소닉,1303,2025.10.17,여생남정,https://cafe.naver.com/suddes/3972985,부룬디,쿨쿨 조합 하세요 쿨소닉이 속부터 탄탄하게 채워주고 쿨페이즈가 매끈하게 잡아줘서 얼굴이 정돈됐어요 글구 둘다 무통이어서 진짜 편하게 받을 수 있어요,
쿨소닉,1304,2025.10.17,성형위키백과,https://cafe.naver.com/juliett00/1526030,힐브로우,저는 통증 무서워서 반신반의했는데 하나도 안 아프고 오히려 시원했어요 쿨페이즈랑 쿨소닉 끝나고 나니 얼굴선이 자연스럽게 또렷해지고 피부에 광이 돌아요,
쿨소닉,1305,2025.10.17,여생남정,https://cafe.naver.com/suddes/3976317,클로뱌,윤곽은 리프팅이랑 윤곽주사 같이 하는게 효과 보더라구요 쿨소닉으로 얼굴살 정리하면서 윤곽 잡아주고 윤곽주사로 고정시키면 유지력도 오래가요,
쿨소닉,1306,2025.10.17,여생남정,https://cafe.naver.com/suddes/3976763,클로뱌,통증 예민하시면 쿨소닉도 추천드려요 쿨링기능 있어서 무통으로 시술 가능하거든요 열감 하나도 안느껴져서 받을때 편해요 자극적이지 않은데 출력은 쎄서 효과도 잘나오구요 ㅎㅎ,
쿨소닉,1307,2025.10.17,여생남정,https://cafe.naver.com/suddes/3976931,클로뱌,원장님 중요하더라구요 진료보고 피부에 맞게 리프팅 디자인 받았는데 쿨페이즈랑 쿨소닉 해주셨는데 부위별로 리프팅 다 다르게 들어가서 효과 더 극대화 되서 나오더라구요 ㅎㅎ 원장님이 직접 봐주는게 중요한거 같아요,
쿨소닉,1308,2025.10.17,여생남정,https://cafe.naver.com/suddes/3976942,클로뱌,원장님이 직접 봐주시는게 중요하더라구요 제 피부에 맞게 리프팅 디자인 해주셨는데 쿨페이즈랑 쿨소닉 부위별로 시술받으니까 피부탄력이랑 윤곽라인 효과 잘봤어요 ㅎㅎ,
쿨소닉,1309,2025.10.17,성형위키백과,https://cafe.naver.com/juliett00/1530916,해루,초음파하면 확실히 윤곽 효과 잘보더라구요 ㅋㅋ 나중에 쿨페이즈랑 같이 해보세요 저 쿨소닉이랑 같이 받았는데 피부탄력이랑 윤곽 동시에 효과봐서 좋았어요,
쿨소닉,1310,2025.10.17,성형위키백과,https://cafe.naver.com/juliett00/1531030,해루,리프팅하고 탄력 많이 좋아지더라구요 ㅋㅋ 통증때문에 쿨쿨조합 했는데 피부 컨디션 지금 최상이에요 탄력 좋아지고 피부결도 정돈되서 좋아요,
쿨소닉,1311,2025.10.17,성형위키백과,https://cafe.naver.com/juliett00/1531243,해루,통증 걱정이시면 쿨페이즈랑 쿨소닉도 알아보세용 쿨링기능이라서 무통으로 시술가능하거든요 ㅋㅋ 열감도 안느껴져서 편하게 받을 수 있어요 탄력회복에도 좋고 피부결 정돈도 되서 추천이에요,
쿨소닉,1312,2025.10.17,성형위키백과,https://cafe.naver.com/juliett00/1531277,해루,상담 받아보세요 ㅎㅎ 리프팅으로 관리해주면 이중턱에도 효과 잘보거든요 전 쿨쿨조합 했는데 무통이라 좋았고 얼굴살 정리해주면서 턱선이 갸름해져서 만족도 높아요,
쿨소닉,1313,2025.10.17,성형위키백과,https://cafe.naver.com/juliett00/1531321,해루,리프팅 받을만 하더라구요 ㅋㅋ 저도 진료보고나서 쿨페이즈랑 쿨소닉 같이 했는데 피부탄력에도 효과보고 전체적인 윤곽도 좋아져서 만족스러워요,
쿨소닉,1314,2025.10.17,A+여우야,https://cafe.naver.com/fox5282/4459786,쿠마베어,그래서 상담이 중요한거 같아요 ㅜ 전 절개나 삽입은 좀 부담이라 레이저 조합으로 했는데 충분히 효과 잘봤어요 탄력 올려주고 처짐도 개선되서 전체적으로 만족스러워요,
쿨소닉,1315,2025.10.17,A+여우야,https://cafe.naver.com/fox5282/4460282,쿠마베어,레이저도 효과 봐서 일단 상담부터 받아보세요 ㅜㅜ 전 쿨쿨조합 했는데 쿨소닉이 펜타입이라서 패인부위에 리프팅 하기 좋더라구요 늘어짐도 잘잡아줘서 좋았어요,
쿨소닉,1316,2025.10.17,A+여우야,https://cafe.naver.com/fox5282/4460695,쿠마베어,상담 잘 받고 오세요 ㅎㅎ 저도 진료보고 조합으로 받았는데 효과 좋았어요 쿨페이즈랑 쿨소닉 했는데 아프지도 않고 윤곽이 전체적으로 갸름해져서 만족스럽더라구요 아마 시술 하시면 효과 잘보실거에요,
쿨소닉,1317,2025.10.17,A+여우야,https://cafe.naver.com/fox5282/4460742,쿠마베어,피부상태랑 리프팅 종류에 따라서도 주기는 다 달라지더라구요 ㅜ 아니면 조합으로 받아보세요 전 쿨쿨조합 했는데 효과도 즉각적이면서 유지력도 더 오래가서 좋았거든요,
쿨소닉,1318,2025.10.17,A+여우야,https://cafe.naver.com/fox5282/4460773,쿠마베어,저 이거랑 쿨소닉 같이 병행해서 받았는데 좋았어요 쿨링기능이 진짜 좋더라구요 ㅋㅋ 하나도 안아파서 받을때 너무 편했어요 탄력 올려주면서 얼굴선도 정리되고 다운타임도 없어서 좋아요,
쿨소닉,1319,2025.10.17,여우야,https://cafe.naver.com/feko/10030218,매실소보로,쿨페이즈요 ㅋㅋ 고주파인데 쿨링기능 있어서 통증부담이 없어요 저 쿨소닉이랑 조합으로 받았는데 탄력올려주면서 라인정리도 되서 좋더라구요,
쿨소닉,1320,2025.10.18,여생남정,https://cafe.naver.com/suddes/3973195,오늘난,쿨소닉도 펜타입 있어요! 풀페이스로 하면 7천샷? 까지도 엄청 고샷수로 맞으시더라고요ㅎㅎㅎ 통증도 없으니 같이 보셔도 좋을듯?,
쿨소닉,1321,2025.10.18,여생남정,https://cafe.naver.com/suddes/3972706,오늘난,쿨소닉 추천이요! 안아픈데 팔자주름같은 세밀한 부위에도 효과 좋다고 유명하잖아요ㅎㅎㅎ 펜타입도 있어서 세밀한 부위에 딱일듯,
쿨소닉,1322,2025.10.18,여우야+,https://cafe.naver.com/fox5282/4445122,에센시,지흡도 지흡 나름인데.. 울퉁불퉁하게 빠질수 있어서 비추요ㅠㅠㅠ 일단 쿨소닉같은 고출력 리프팅 한번 해보세용,
쿨소닉,1323,2025.10.18,여우야+,https://cafe.naver.com/fox5282/4444933,에센시,세달이면 괜춘한거 같아요ㅋㅋ 통증 예민하시면 쿨소닉도 한번 알아보세요~ 저도 안아픈 레이저라 그래서 받았는데 진짜 안아품!,
