기기구분,NO.,작업일,진행카페,작업ULR,닉네임,댓글내용,카페 댓글
리프테라,1294,2025.10.31,재잘재잘,https://cafe.naver.com/knife67/463113,"뿌린맘이
","저는 결혼식 준비하면서 리프테라2로 얼굴선 정리했어요 턱 밑이랑 볼살이 부드럽게 올라와서 인상도 훨씬 밝아졌고  
리프테라2는 초음파라 자극 없고 다운타임 없어서 바쁜 예신들한테 진짜 현실적으로 좋아요ㅋㅋ
",
리프테라,1295,2025.10.31,재잘재잘,https://cafe.naver.com/knife67/462924,"뿌린맘이
","저는 리프테라2 꾸준히 받고 있어요 실리프팅처럼 라인 또렷하게 잡아주면서도 붓기나 멍이 없어서 직후 일정에도 전혀 문제 없어요 피부 속 탄력 잡히니까 얼굴선이 진짜 달라져요 레이저리프팅보다 유지기간도 길어서 가성비 최고예요ㅋㅋㅋㅋ
",
리프테라,1296,2025.10.31,여우야,https://cafe.naver.com/feko/10050124,"날떠나지마세요
",얼지흡은 붓기랑 멍이 좀 있고 회복기간이 긴거같아요 힝ㅜ 저는 그게 부담돼서 리프테라2로 했는데 턱선이 부드럽게 정리되고 얼굴라인이 또렷해졌어요,
리프테라,1297,2025.10.31,여우야,https://cafe.naver.com/feko/10049960,"날떠나지마세요
","저도 이중턱 때문에 이것저것 알아봤는데 결국 리프테라2가 제일 낫더라구요 초음파 리프팅이라 자극 없이 깊은 층부터 조여줘서  
턱선이 진짜 매끈해져요^^*",
리프테라,1298,2025.10.31,여우야,https://cafe.naver.com/feko/10049646,"날떠나지마세요
","써마지나 울쎄라는 효과 좋지만 통증이랑 비용이 부담되더라구요 저는 리프테라2로 시작했는데 확실히 만족했어요  
피부가 속부터 조여지는 느낌이라ㅋㅋ  ",
리프테라,1299,2025.10.31,여우야+,https://cafe.naver.com/fox5282/4470745,"당신을위하여
",최근에 얼굴 탄력 완전 난리나서 급 힐링하고 싶었는데 리프테라2 상담 받았는데 원장님도 차분하시고 장비 설명도 꼼꼼해서 신뢰감 가더라구요 시술 당일에도 직원분들 친절해서 마치 스파 온 기분ㅋㅋ,
리프테라,1300,2025.10.31,여우야+,https://cafe.naver.com/fox5282/4471558,"당신을위하여
","덴서티 상담 받아봤는데 가격이 생각보다 다양하더라구요 병원마다 샷수랑 부위 포함된 범위가 달라서 그런 거 같아요  
저는 100만원 초반대에 받았는데 효과 괜찮았어요 피부결이랑 잔주름이 부드러워지고 탄력도 확실히 올라왔어요  
다만 통증이 살짝 있어서 예민하신 분들은 리프테라2 쪽도 같이 비교해보시면 좋을 것 같아요 리프테라2는 초음파라 자극 덜하고 회복도 빠르더라구요ㅎㅎㅎㅎ
",
리프테라,1301,2025.10.31,여우야+,https://cafe.naver.com/fox5282/4470757,"당신을위하여
",친구한거보니까 붓기랑 멍이 생각보다 오래 가는거같아보이더라구요ㅡㅡ;; 그래서 저는 리프테라2로 정리했는데 진짜 자연스럽게 올라갔어요 초음파로 탄력층부터 당겨줘서 이중턱이랑 턱선이 부드럽게 정리돼요,
리프테라,1302,2025.10.31,성형위키백과,https://cafe.naver.com/juliett00/1533838,"뚜지맘이
",주사는 일시적으로 조이는 느낌만 있고 시간 지나면 다시 원래대로 돌아오더라구요 리프테라2는 초음파로 스마스층까지 자극해줘서 볼 처짐이 부드럽게 정리되고 인상도 환해져요 붓기도 거의 없고 회복도 빨라서 꾸준히 관리하기 좋아요,
리프테라,1303,2025.10.31,여생남정,https://cafe.naver.com/suddes/3979210,"나의그대불빛
","피부 예민하시면 울쎄라는 조금 자극이 될 수 있어요~ 저도 비슷한 타입인데 울쎄라 대신 리프테라2 했거든요  
피부 겉은 건드리지 않고 속 탄력층만 조여줘서 붓기도 거의 없고 시술 후 열감도 없었어요  
턱선이 부드럽게 올라가서 자연스럽게 정리돼요 예민피부엔 리프테라2가 훨씬 안전해요
",
리프테라,1304,2025.10.31,여생남정,https://cafe.naver.com/suddes/3979219,"나의그대불빛
","직장인이라 연차도 길게 못빼고해서 다운타임 없는 시술 알아봤는데 부분지흡은 붓기나 멍이 좀 부담되더라구요 ㅜㅡ 
리프테라2는 초음파로 피부 속만 자극해서 붓기 거의 없이 이중턱이랑 턱선이 같이 정리돼요  ",
리프테라,1305,2025.10.31,레몬테라스,https://cafe.naver.com/remonterrace/34191834,미연이는예쁘지,수술은 부담돼서 리프테라2 먼저 해봤는데 진짜 효과 있었어요 초음파로 스마스층까지 당겨줘서 처진 볼살이 부드럽게 올라가요 효과도 빠르고 회복기간 따로 필요없이 시술직후 바로 근무도 시작했어요ㅋㅋ,
리프테라,1306,2025.10.31,여우야+,https://cafe.naver.com/fox5282/4471647,계란치즈말이,,
리프테라,,울쎄라나 써마지는 효과는 좋지만 통증이 세고 붓기도 좀 있었어요 리프테라2는 초음파라 자극 거의 없고 시술 바로 다음날부터 얼굴이 쫀쫀해졌어요 청담 리원 장비 좋아서 상담 가보시는 거 좋고 피부 민감하시면 리프테라2 같이 부드러운 리프팅도 꼭 비교해보세요~,,,,,
리프테라,1307,2025.10.31,여우야,https://cafe.naver.com/feko/10050868,"휴링니
",보통 실리프팅은 붓기랑 멍이 3일에서 일주일 정도는 간다고 하더라구요 통증도 며칠은 욱신거릴 수 있어서 주말만으론 살짝 빠듯할 수도 있어요 저는 그래서 리프테라2로 바꿨는데 초음파라 다운타임이 거의 없어요,
리프테라,1308,2025.10.31,여우야,https://cafe.naver.com/feko/10050720,"휴링니
",저는 울쎄라는 너무 아파서 못하고 대신 리프테라2로 탄력 잡고 BBL로 톤 개선했는데 효과 확실했어요 리프테라2는 초음파라 자극 없고 바로 얼굴이 조여지는 느낌이에요 피부결도 정리되고 턱선도 또렷해져서 전체적으로 어려보여요 이 조합이 진짜 탄력이랑 톤 둘 다 개선돼서 추천드려요,
리프테라,1309,2025.10.31,성형위키백과,https://cafe.naver.com/juliett00/1534617,밀크타로차,,
리프테라,,"온다는 시원하고 편하긴 한데 확실한 리프팅보단 탄력 보조 느낌이에요ㅜ 팔자 처짐이 깊으면 리프테라2가 더 효과적이에요!  
초음파로 스마스층까지 자극해줘서 얼굴선이 바로 조여지는 느낌이에요 시술 후 붓기도 없고 자연스럽게 올라가서 만족했어요ㅎㅎ
",,,,,
리프테라,1310,2025.10.31,여생남정,https://cafe.naver.com/suddes/3977731,"프루츠텔라
","피부 예민도나 에너지 강도에 따라 살짝 달라질 수 있어요 저는 소프웨이브보다 리프테라2로 받았는데 초음파라 더 자극 없고  
붓기나 열감 전혀 없이 바로 메이크업 가능했어요ㅎㅎ ",
리프테라,1311,2025.10.02,재잘재잘,https://cafe.naver.com/knife67/437886,규료,오 리프테라랑 쿨페이즈 아픈가요? 저는 목주름거상술 통증때매 겁나던데ㅠ,
리프테라,1312,2025.10.02,재잘재잘,https://cafe.naver.com/knife67/437886,송송브리또,리프테라 좀 따끔하긴 한데 목주름거상술보단 훨씬 참을만해요! 쿨페이즈는 거의 안 아팠어요!,
리프테라,1313,2025.10.02,재잘재잘,https://cafe.naver.com/knife67/437886,풀바다용,회복 진짜 빨라요? 저는 시술 받아본 적 없어서 궁금해요,
리프테라,1314,2025.10.02,재잘재잘,https://cafe.naver.com/knife67/437886,송송브리또,맞아요 쿨페이즈는 바로 화장 가능하고 리프테라도 붓기 거의 없어서 편했어요!,
리프테라,1315,2025.10.02,여우야+,https://cafe.naver.com/fox5282/4423210,나의빛그림,혹시 리프테라랑 쿨페이즈 가격 많이 부담되진 않았어요? 효과 궁금해요 ㅎㅎ,
리프테라,1316,2025.10.02,여우야+,https://cafe.naver.com/fox5282/4423210,김여쭈,가격은 울써마지보다 훨 싸요..! 근데 효과가 더 만족이라 본전 뽑은 느낌? 부담없었어요!,
리프테라,1317,2025.10.02,여우야+,https://cafe.naver.com/fox5282/4423210,사랑보다깊은나,인디언주름리프팅 붓기나 멍 없었나요? 바로 화장 돼요?,
리프테라,1318,2025.10.02,여우야+,https://cafe.naver.com/fox5282/4423210,김여쭈,저 붓기 거의 없었고 멍도 진짜 안 생김..! 시술 바로 다음날 화장했어요 ㅎㅎ,
리프테라,1319,2025.10.02,성형위키백과,https://cafe.naver.com/juliett00/1518654,그날의끝,리프테라이랑 쿨페이즈 조합 진짜 효과 있음?? 울써마지도 궁금했는데 별로에요?,
리프테라,1320,2025.10.02,성형위키백과,https://cafe.naver.com/juliett00/1518654,뽀미뽀미언냐,저 울써마지는 통증 때문에 진짜 포기요 ㅠ 리프테라 쿨페이즈는 편하게 받고 효과도 좋아요!!,
리프테라,1321,2025.10.02,성형위키백과,https://cafe.naver.com/juliett00/1518654,행복날두,심부볼리프팅 하고나서 화장 바로 가능해요?? 멍이나 그런 건 없었어요?,
리프테라,1322,2025.10.02,성형위키백과,https://cafe.naver.com/juliett00/1518654,뽀미뽀미언냐,멍 거의 없고 화장 바로 했어요 ㅋㅋ 그냥 살짝 열감만 있었던 정도였어요!,
리프테라,1323,2025.10.03,재잘재잘,https://cafe.naver.com/knife67/439241,풀바다용,혹시 남자보톡스랑 리프팅 가격대 궁금한데 많이 비싸요? ㅠㅠ,
리프테라,1324,2025.10.03,재잘재잘,https://cafe.naver.com/knife67/439241,달리잖아,남자보톡스는 부위별로 다른데 저는 리프팅까지 해서 60초반대로 맞췄어요! 단독은 더 저렴해요~,
리프테라,1325,2025.10.03,재잘재잘,https://cafe.naver.com/knife67/439241,규료,시술 다음날 붓기나 멍 심하게 있었어요? 회사 출근 걱정돼서요..,
리프테라,1326,2025.10.03,재잘재잘,https://cafe.naver.com/knife67/439241,달리잖아,저 진짜 멍 거의 없었고 붓기도 살짝만 났어요ㅎㅎ 다음날 화장 안해도 바로 출근했어요!,
리프테라,1327,2025.10.03,여우야+,https://cafe.naver.com/fox5282/4426284,사랑보다깊은나,저도 턱보톡스잘하는곳 고민중인데 붓기 많이 갔나요? 바로 화장 가능했나요?,
리프테라,1328,2025.10.03,여우야+,https://cafe.naver.com/fox5282/4426284,원쑹잉,붓기는 거의 없고 바로 화장도 가능했어요! 시술 끝나고 친구 바로 만남ㅎㅎ,
리프테라,1329,2025.10.03,여우야+,https://cafe.naver.com/fox5282/4426284,김연찌아,리프테라랑 쿨페이즈 효과 진짜 잘 봐요? 몇살부터 해도 무난할지 궁금해요!,
리프테라,1330,2025.10.03,여우야+,https://cafe.naver.com/fox5282/4426284,원쑹잉,20대 후반부터 충분히 할만하다고 하네요! 리프팅 효과는 진짜 잘 느껴졌어요ㅠㅠ,
리프테라,1331,2025.10.05,재잘재잘,https://cafe.naver.com/knife67/439904,규료,혹시 팔자리프팅 할 때 따끔한 느낌 진짜 하나도 없어요?? 효과 오래가나요?,
리프테라,1332,2025.10.05,재잘재잘,https://cafe.naver.com/knife67/439904,송송브리또,진심 따끔도 거의 없어요ㅋㅋ 효과도 저 한달째인데 아직 유지중이에요!,
리프테라,1333,2025.10.05,재잘재잘,https://cafe.naver.com/knife67/439904,푸른열차,울써마지 너무 아프다던데 팔자리프팅이 확실히 괜찮아요? 가격 차이도 있음?,
리프테라,1334,2025.10.05,재잘재잘,https://cafe.naver.com/knife67/439904,송송브리또,"울써마지랑 차원이 달라요.. 통증도, 가격도 훨씬 낫고 효과도 빨라요!",
리프테라,1335,2025.10.05,여우야+,https://cafe.naver.com/fox5282/4427166,김연찌아,실리프팅 생각중이었는데 효과 오래가요? 멍이나 붓기 없었나요?,
리프테라,1336,2025.10.05,여우야+,https://cafe.naver.com/fox5282/4427166,김여쭈,멍이랑 붓기 거의 없었어요! 효과도 한달지나니까 훨씬 자연스럽고 짱짱해졌어요 ㅎㅎ,
리프테라,1337,2025.10.05,여우야+,https://cafe.naver.com/fox5282/4427166,마음속여인집,리프테라랑 쿨페이즈 같이하면 가격 괜찮나요? 부작용 없었는지도 궁금해요!,
리프테라,1338,2025.10.05,여우야+,https://cafe.naver.com/fox5282/4427166,김여쭈,실리프팅보단 훨 저렴했구요 부작용도 거의 없었어요! 담엔 얼굴 전체 해볼까해요 ㅋㅋ,
리프테라,1339,2025.10.05,성형위키백과,https://cafe.naver.com/juliett00/1519881,그날의끝,진짜 리프테라이랑 쿨페이즈 같이 하면 입가주름 확실히 없어져요?? 자연스러워요?,
리프테라,1340,2025.10.05,성형위키백과,https://cafe.naver.com/juliett00/1519881,뽀미뽀미언냐,"네네 너무 부자연스럽지도 않고, 볼도 안꺼지고 입가주름 진짜 덜해진 느낌이에요!! 완전 만족중ㅎㅎ",
리프테라,1341,2025.10.05,성형위키백과,https://cafe.naver.com/juliett00/1519881,행복날두,울써마지 저도 아프다고해서 고민중인데 얼굴전체적으로 다하신건가요?,
리프테라,1342,2025.10.05,성형위키백과,https://cafe.naver.com/juliett00/1519881,뽀미뽀미언냐,완전 비교불가에요!! 입가가 가장고민이었는데 얼굴전체로 다한거고 전체적으로도 탄력이 많이 좋아졌어요!,
리프테라,1343,2025.10.06,재잘재잘,https://cafe.naver.com/knife67/440337,푸른열차,헉 혹시 턱지방분해주사 붓기 오래가진 않아요? 일상생활 바로 가능할까 궁금해서요ㅠ,
리프테라,1344,2025.10.06,재잘재잘,https://cafe.naver.com/knife67/440337,날따라오시오,나 진짜로 거의 안 부었어요! 바로 다음날부터 출근도 했구요! 화장으로 충분히 커버돼요ㅎㅎ,
리프테라,1345,2025.10.06,재잘재잘,https://cafe.naver.com/knife67/440337,쪙이야믿어,리프테라 쿨페이즈 효과 어느 정도 오래가는지 알려주심 감사ㅠㅠ!,
리프테라,1346,2025.10.06,재잘재잘,https://cafe.naver.com/knife67/440337,날따라오시오,병원서 6개월 정도 리프팅감 유지된다고 했어요! 근데 피부 탄력 느낌은 한두달째가 진짜 짱짱하게 좋아요!,
리프테라,1347,2025.10.06,여우야+,https://cafe.naver.com/fox5282/4427746,연구쟁이,오 리프테라이랑 쿨페이즈로 브이라인리프팅 하면 얼마정도 들어요? 지속력은 괜찮아요?,
리프테라,1348,2025.10.06,여우야+,https://cafe.naver.com/fox5282/4427746,마음의꿈질,가격은 울써마지보다 몇배는 착해서 부담 덜해요! 유지도 지금 두 달 째인데 아직 짱짱해요ㅎㅎ,
리프테라,1349,2025.10.06,여우야+,https://cafe.naver.com/fox5282/4427746,김연찌아,울써마지랑 비교하면 얼굴라인 진짜 많이 달라보여요? 주변에서 알아봐줬나요?,
리프테라,1350,2025.10.06,여우야+,https://cafe.naver.com/fox5282/4427746,마음의꿈질,은근 턱선 살아났다 얘기 많았어요! 친구들은 사진찍을때 얼굴 작아보인다구 하더라구요~,
리프테라,1351,2025.10.07,재잘재잘,https://cafe.naver.com/knife67/440813,꿈쮸,혹시 쿨페이즈랑 리프테라 효과 얼마나 가요? 유지력 궁금해서요!,
리프테라,1352,2025.10.07,재잘재잘,https://cafe.naver.com/knife67/440813,송송브리또,저는 한 3개월 정도는 확실히 유지되는 거 같아요! 그 뒤로도 잘 남아있어요!,
리프테라,1353,2025.10.07,재잘재잘,https://cafe.naver.com/knife67/440813,미래지향,울써마지 많이 안 아픈줄 알았는데 통증 진짜 심했나봐요ㅠ 시술 중간에 멈출 정도였나요?,
리프테라,1354,2025.10.07,재잘재잘,https://cafe.naver.com/knife67/440813,송송브리또,네 저 거의 오열할 뻔했어요ㅋㅋ 너무 따갑고 열감 쎄서 중간에 멈출까 진짜 고민함..,
리프테라,1355,2025.10.07,여우야+,https://cafe.naver.com/fox5282/4428661,연구쟁이,저도 울써마지 아파서 중간에 포기한 적 있는데ㅠ 리프테라 쿨페이즈 하면 멍이나 붓기 없었나요?,
리프테라,1356,2025.10.07,여우야+,https://cafe.naver.com/fox5282/4428661,김여쭈,멍 하나도 안들었어요! 붓기도 거의 모르겠고 화장 바로 하고 나옴 완전 편해요ㅎㅎ,
리프테라,1357,2025.10.07,여우야+,https://cafe.naver.com/fox5282/4428661,마음속여인집,효과 언제부터 느껴졌어요? 바로 티나나요 아니면 좀 지나야돼요?,
리프테라,1358,2025.10.07,여우야+,https://cafe.naver.com/fox5282/4428661,김여쭈,저는 한 일주일쯤 지나니까 미간이랑 볼 쪽 라인 확실히 달라졌더라구요!,
리프테라,1359,2025.10.07,성형위키백과,https://cafe.naver.com/juliett00/1520185,그날의끝,리프테라랑 쿨페이즈 두 개 같이 하면 비용 많이 들어요?? 효과는 얼마나 가나요?,
리프테라,1360,2025.10.07,성형위키백과,https://cafe.naver.com/juliett00/1520185,뽀미뽀미언냐,생각보다 가격 크게 부담 아니었어요! 유지도 6개월 이상 간다고 하더라구요ㅎㅎ,
리프테라,1361,2025.10.07,성형위키백과,https://cafe.naver.com/juliett00/1520185,고루쟝이,시술후 멍 들거나 붓기는 없었나요? 일상 바로 가능해요??,
리프테라,1362,2025.10.07,성형위키백과,https://cafe.naver.com/juliett00/1520185,뽀미뽀미언냐,멍이나 붓기 없었어요! 시술 끝나고 바로 카페 갔어요ㅎㅎ 완전 일상가능!,
리프테라,1363,2025.10.08,성형위키백과,https://cafe.naver.com/juliett00/1520214,고루쟝이,리프테라 쿨페이즈 효과 얼마나 오래 가요? 유지기간 궁금해서요!,
리프테라,1364,2025.10.08,성형위키백과,https://cafe.naver.com/juliett00/1520214,돌이킬수없는,3~6개월 정도는 쫀쫀함 유지된대요! 저도 지금 두달째인데 여전히 좋아요ㅎㅎ,
리프테라,1365,2025.10.08,성형위키백과,https://cafe.naver.com/juliett00/1520214,행복날두,피부탄력시술 하면 바로 티 나나요? 일상생활 바로 복귀 가능할까요?,
리프테라,1366,2025.10.08,성형위키백과,https://cafe.naver.com/juliett00/1520214,돌이킬수없는,거의 티 안나요! 붓기도 없고 당일 바로 화장했어요. 회사도 그냥 갔어요ㅎㅎ,
리프테라,1367,2025.10.09,재잘재잘,https://cafe.naver.com/knife67/441129,풀바다용,실리프팅 대신 리프테라 쿨페이즈 하면 멍이나 붓기 어땠는지 궁금해요!,
리프테라,1368,2025.10.09,재잘재잘,https://cafe.naver.com/knife67/441129,송송브리또,멍 거의 없었구 붓기도 당일에만 살짝~ 다음날 바로 화장하고 외출했어요! 넘 편함ㅎㅎ,
리프테라,1369,2025.10.09,재잘재잘,https://cafe.naver.com/knife67/441129,푸른열차,실리프팅 고민중인데 가격대 진짜 많이 차이나요? 효과 지속도 어떤지 알려주세요!,
리프테라,1370,2025.10.09,재잘재잘,https://cafe.naver.com/knife67/441129,송송브리또,가격 확실히 저렴했어요! 효과도 지금 3주 지났는데 확실히 처진거 개선된 느낌이요!,
리프테라,1371,2025.10.09,여우야+,https://cafe.naver.com/fox5282/4429274,김연찌아,혹시 팔자주름개선 하고 바로 화장 가능했어요? 멍은 안 들었나요?,
리프테라,1372,2025.10.09,여우야+,https://cafe.naver.com/fox5282/4429274,김여쭈,바로 화장했어요! 붉은기 좀만 있다가 금방 가라앉아서 다음날은 완전 멀쩡했어요ㅎㅎ,
리프테라,1373,2025.10.09,여우야+,https://cafe.naver.com/fox5282/4429274,가오쓰,리프테라랑 쿨페이즈 동시에 하면 가격대는 어떤가요? 부담되진 않으셨어요?,
리프테라,1374,2025.10.09,여우야+,https://cafe.naver.com/fox5282/4429274,김여쭈,두 개 합쳐서 울써마지 반에반 값도 안 나왔어요.. 가격 덜 부담되고 효과 더 좋아서 만족이요!,
리프테라,1375,2025.10.09,성형위키백과,https://cafe.naver.com/juliett00/1520325,행복날두,리프테라랑 쿨페이즈 효과 유지 얼마나 가는지 궁금해요! 붓기나 멍도 있었나요?,
리프테라,1376,2025.10.09,성형위키백과,https://cafe.naver.com/juliett00/1520325,뽀미뽀미언냐,"저는 멍이나 붓기는 거의 없었고요, 효과는 지금 2~3개월 지나도 여전히 탄탄해요!",
리프테라,1377,2025.10.09,성형위키백과,https://cafe.naver.com/juliett00/1520325,윤찌마미,울써마지 진짜 그렇게 아팠어요? 저도 리프팅하는거 고민인데 참고만 해야겠어요ㅠㅠ,
리프테라,1378,2025.10.09,성형위키백과,https://cafe.naver.com/juliett00/1520325,뽀미뽀미언냐,네 진심 울써마지 통증은 다시 생각만 해도 싫음.. 저라면 리프테라 쿨페이즈 추천해요!,
리프테라,1379,2025.10.10,재잘재잘,https://cafe.naver.com/knife67/441320,규료,저도 실리프팅 알아보다가 포기했는데 리프테라 효과 몇 번 받아야 보이나요??,
리프테라,1380,2025.10.10,재잘재잘,https://cafe.naver.com/knife67/441320,날따라오시오,저 한 번만 해도 변화 느낌 확실히 왔어요! 유지력은 사람마다 조금씩 다르대요~,
리프테라,1381,2025.10.10,재잘재잘,https://cafe.naver.com/knife67/441320,풀바다용,부작용 걱정 진짜 많이 했는데 쿨페이즈는 피부 예민한 사람도 괜찮을까요?,
리프테라,1382,2025.10.10,재잘재잘,https://cafe.naver.com/knife67/441320,날따라오시오,네네! 저도 예민한 편인데 쿨페이즈는 트러블 없이 잘 지나갔어요!,
리프테라,1383,2025.10.10,여우야+,https://cafe.naver.com/fox5282/4429491,사랑보다깊은나,혹시 시술 후에 멍이나 붓기 심하게 남진 않았나요? 일상생활 바로 가능할까 궁금해요!,
리프테라,1384,2025.10.10,여우야+,https://cafe.naver.com/fox5282/4429491,마음의꿈질,전 거의 멍붓기 없었어요! 시술 끝나고 바로 마트갔다왔는데 티도 안나더라구요ㅎㅎ,
리프테라,1385,2025.10.10,여우야+,https://cafe.naver.com/fox5282/4429491,가오쓰,리프테라 쿨페이즈 조합은 가격대 어느정도였는지 혹시 알 수 있을까요??,
리프테라,1386,2025.10.10,여우야+,https://cafe.naver.com/fox5282/4429491,마음의꿈질,가격은 울써마지보단 3~4배는 저렴해요! 병원마다 차이 있지만 둘이 해도 부담 확실히 덜했어요!,
리프테라,1387,2025.10.10,재잘재잘,https://cafe.naver.com/knife67/441473,쪙이야믿어,저도 팔자실리프팅 고려중인데 피부 울퉁불퉁해진다구 들었어요.. 리프테라랑 쿨페이즈는 그건 없나요?,
리프테라,1388,2025.10.10,재잘재잘,https://cafe.naver.com/knife67/441473,송송브리또,"네네 그런 거 하나도 없었어요! 피부 표면 진짜 매끈, 자극감도 거의 안 남더라구요ㅎㅎ",
리프테라,1389,2025.10.10,재잘재잘,https://cafe.naver.com/knife67/441473,규료,리프테라 효과 언제부터 바로 티났어요? 팔자실리프팅이랑은 느낌 달라요?,
리프테라,1390,2025.10.10,재잘재잘,https://cafe.naver.com/knife67/441473,송송브리또,저는 한 3~4일 뒤부터 슬슬 라인 땡겨보여서 친구가 먼저 물어봤어요! 팔자실리프팅이랑은 느낌 확실히 달라요!,
리프테라,1391,2025.10.10,여우야+,https://cafe.naver.com/fox5282/4429871,마음속여인집,와 저도 보톡스가격 때문에 고민중인데 리프테라 쿨페이즈 궁금했거든요! 시술 후 멍이나 붓기는 어땠나요?,
리프테라,1392,2025.10.10,여우야+,https://cafe.naver.com/fox5282/4429871,김여쭈,멍 진짜 거의 없고 붓기도 이틀 정도? 화장하면 티 안나서 바로 일상생활 가능했어요!,
리프테라,1393,2025.10.10,여우야+,https://cafe.naver.com/fox5282/4429871,가오쓰,보톡스가격이 병원마다 차이 심하던데 혹시 견적 얼마정도 받으셨어요?,
리프테라,1394,2025.10.10,여우야+,https://cafe.naver.com/fox5282/4429871,김여쭈,저 턱 보톡스만 따지면 4~6만원대였고 리프팅 패키지는 60만원 조금 넘었어요! 패키지라서 할인 좀 들어감!,
리프테라,1395,2025.10.10,성형위키백과,https://cafe.naver.com/juliett00/1520464,갈리가리,리프테라 효과 바로 티나요? 붓기나 멍도 있었는지 궁금해요!,
리프테라,1396,2025.10.10,성형위키백과,https://cafe.naver.com/juliett00/1520464,뽀미뽀미언냐,효과는 진짜 금방 살짝 보이구요~ 붓기 살짝 있었는데 하루 이틀이면 거의 빠져서 멍은 없었어요,
리프테라,1397,2025.10.10,성형위키백과,https://cafe.naver.com/juliett00/1520464,윤찌마미,쿨페이즈랑 리프테라 하면 화장 바로 가능해요? 출근해야 해서ㅠㅠ,
리프테라,1398,2025.10.10,성형위키백과,https://cafe.naver.com/juliett00/1520464,뽀미뽀미언냐,저 바로 다음날 화장했어요ㅎㅎ 당일엔 좀 민감한 느낌이라 다음날부터 하면 무난했어요~,
리프테라,1399,2025.10.11,재잘재잘,https://cafe.naver.com/knife67/443013,꿈쮸,저도 리프테라랑 쿨페이즈 하려고 생각중인데 통증은 어떠셨나요? 안아프다그래서,
리프테라,1400,2025.10.11,재잘재잘,https://cafe.naver.com/knife67/443013,송송브리또,통증 진짜 거의 없어요! 리프테라 펜으로하는건 별루 안아프고 라인은 조금 아프긴했는데 못참을정도는 아니었고 쿨페이즈는 거의 통증이 없었어요 ㅎㅎ,
