기기구분,NO.,작업일,진행카페,작업ULR,닉네임,댓글내용,카페 댓글
쿨페이즈,1257,2025.10.27,재잘재잘,https://cafe.naver.com/knife67/459273,딸기퐁당,리프팅 찾아보시는거면 쿨소닉이랑 쿨페이즈도 한번 알아보세요~쿨소닉이 펜타입이라 세밀하게 받을수 있고 쿨페이즈로 피부결 까지 매끈하게 해주니까 효과 너무좋더라고요,
쿨페이즈,1258,2025.10.28,여생남정,https://cafe.naver.com/suddes/3977238,러키럭키비키,30대시면 쿨페이즈 ㅊㅊ이용 전체적으로 얼굴탄력 붙으면서 팔자주름이나 볼처짐도 정리되고 피부결도 좋아지더라구요 ㅎㅎ 중요한건 이건 쿨링기능 있어서 통증도 없어요,
쿨페이즈,1259,2025.10.28,여생남정,https://cafe.naver.com/suddes/3977199,러키럭키비키,아구 ㅠㅠ 런닝하면 탄력 떨어진다는 말 있더라구요 ㅋㅋㅋ 저는 탄력때문에 쿨페이즈 받았어요 피부 얇으시면 무조건 고주파로 받으시는게 좋아요 이건 통증도 없고 멍이나 붓기 없이 자극 안가서 주기적으로 받기 좋은거 같아요 탄력이랑 잔주름 모공 동시에 효과 봤어요,
쿨페이즈,1260,2025.10.28,여생남정,https://cafe.naver.com/suddes/3977054,러키럭키비키,"잘 알아보시는게 좋죠 ㅎㅎ 써마지 생각하시는거면 나중에 쿨페이즈도 받아 보세요 효과는 비슷한데 쿨링기능 있어서 통증 전혀 없고 멍, 붓기도 안들어서 일상생활도 바로 가능해요~",
쿨페이즈,1261,2025.10.28,여생남정,https://cafe.naver.com/suddes/3976845,러키럭키비키,탄력이랑 잔주름개선에는 쿨페이즈 효과 좋아요 ㅎㅎ 탄력 쫀쫀하게 붙으면서 잔주름이나 모공 정리돼서 피부결도 좋아지더라구요 화장이 확실히 잘먹어요 효과도 오래가구요,
쿨페이즈,1262,2025.10.28,여생남정,https://cafe.naver.com/suddes/3977040,러키럭키비키,피부결 푸석할때는 쿨페이즈도 괜찮아용 탄력 쫀쫀하게 채워지면서 피부결도 같이 정리되더라구요~ 저는 진짜 찐 만족이에요 받고나니 화장도 잘먹고 아프지도 않은 시술이라 부담없이 받기 좋아요,
쿨페이즈,1263,2025.10.28,성형위키백과,https://cafe.naver.com/juliett00/1531760,과일맛젤리,탄력 고민이신거면 쿨페이즈도 괜찮아용 쿨링기능 있어서 통증도 없고 탄력도 자연스럽게 채워지더라구요 멍이랑 붓기도 없기 때문에 바로 일상생활도 가능해서 넘 좋았어요,
쿨페이즈,1264,2025.10.28,성형위키백과,https://cafe.naver.com/juliett00/1531527,과일맛젤리,"피부 얇으시면 쿨페이즈로 받아 보세요 고주파 받으시는게 좋거든요 이건 자극이 없어용 통증이나 멍, 붓기 안들어서 부담없이 받기 좋아요 탄력이랑 모공, 잔주름 정리하는데 효과 있더라구요",
쿨페이즈,1265,2025.10.28,성형위키백과,https://cafe.naver.com/juliett00/1531497,과일맛젤리,탄력에는 쿨페이즈쥬 ㅎㅎ 쿨링기능 있어서 통증 전혀 없구요 다운타임도 없기 때문에 효과도 바로 나와요 전 진짜 탄력도 붙었지만 피부결이 엄청 좋아졌어요,
쿨페이즈,1266,2025.10.28,성형위키백과,https://cafe.naver.com/juliett00/1531543,과일맛젤리,써마지 좋죠! 탄력 때문이시면 쿨페이즈도 좋아요~ 같은 고주파 라인인데 이거는 쿨링시스템 있어서 통증이 전혀 없어요 ㅎㅎ 저 이거 받고 탄력 탱탱하게 올라오면서 잔주름이나 모공도 같이 정리됐어요,
쿨페이즈,1267,2025.10.28,성형위키백과,https://cafe.naver.com/juliett00/1531534,과일맛젤리,저도 요즘 얼굴 전체적으로 탄력이 많이 떨어져서 쿨페이즈 받았어용 탄력 쫙 올라오면서 얼굴라인도 이쁘게 정리됐어용 냉각기능 있어서 아프지 않은 시술이라 진짜 부담없이 받기 좋더라구용,
쿨페이즈,1268,2025.10.28,여우야,https://cafe.naver.com/feko/10036563,오레오가루,실은 나중에 하세용 백프로 안녹기도 해서; 전 쿨페이즈 시술 받았어요 레이저루용 탄력 쫀쫀하게 올라오더라구요 잔주름이나 모공도 같이 정리되구요 ㅎㅎㅎ 중요한건 통증이 전혀 없었어요,
쿨페이즈,1269,2025.10.28,여우야,https://cafe.naver.com/feko/10036474,오레오가루,"팔자주름은 쿨페이즈도 효과 좋아여 ㅋㅋㅋ 탄력 떨어진거 올라오면서 자연스럽게 팔자도 정리됐어요 쿨링시스템 있어서 통증도 없고 멍, 붓기도 안들어요",
쿨페이즈,1270,2025.10.28,여우야,https://cafe.naver.com/feko/10035989,오레오가루,오~ 저는 쿨페이즈 이거 받았는데 전혀 안아프고 다운타임이 없어서 효과 바로 직빵으로 나오더라구요 ㅋㅋㅋ 저는 직장동료들이 요즘에 피부에 뭐했냐고 물어봐서 부담이 될 지경이랍니다 ㅠㅠ,
쿨페이즈,1271,2025.10.28,여우야,https://cafe.naver.com/feko/10035754,오레오가루,팔자주름은 쿨페이즈로 정리했어용 탄력 떨어지면서 주름 진해지는거라서 탄력시술 받으니 확실히 팔자도 정리되던데용 피부텐션도 너무 좋아져서 요즘 그냥 선크림만 바르고 다녀요,
쿨페이즈,1272,2025.10.28,여우야,https://cafe.naver.com/feko/10034522,오레오가루,"써마지 그정도 간다고 하더라구요 ㅎㅎ 근데 저는 쿨페이즈 받았는데도 1년정도 가더라구요 효과도 써마지랑 비슷해요 탄력, 잔주름 피부결까지 동시에 좋아지는데 이건 쿨링기능 있어서 통증도 없어요!",
쿨페이즈,1273,2025.10.28,여우야+,https://cafe.naver.com/fox5282/4463019,연어장새우,얇은 피부시면 고주파로 받으시는게 좋아용 저도 피부가 얇아서 쿨페이즈로 받았어요 탄력 붙으면서 잔주름 정리되고 피부결도 동시에 매끈해지더라구요 통증 없는 시술이니깐 부담없이 받았어요,
쿨페이즈,1274,2025.10.28,여우야+,https://cafe.naver.com/fox5282/4462825,연어장새우,쿨소닉+쿨페이즈 쿨쿨 조합도 괜찮아용 얼굴살 쳐진거 리프팅 되면서 턱선도 갸름해지고 탄력도 쫀쫀하게 붙더라구요 ㅎㅎ 그리고 쿨링시스템이 있어서 통증도 없어요,
쿨페이즈,1275,2025.10.28,여우야+,https://cafe.naver.com/fox5282/4462381,연어장새우,저는 잔주름은 쿨페이즈 효과 좋았어요 ㅎㅎ 탄력 붙으면서 잔주름 정리 되더라구요 그러니깐 자연스럽게 피부결도 좋아져서 요즘 화장이 진짜 안뜨고 잘먹네용,
쿨페이즈,1276,2025.10.28,여우야+,https://cafe.naver.com/fox5282/4462264,연어장새우,"저는 쿨페이즈 인생 리프팅이에요ㅠ_ㅠ 진짜 아프지도 않고 멍, 붓기 없어서 일상생활도 바로 했구요 일주일 안돼서 피부탄력 쫀쫀해지면서 모공이나 잔주름도 정리되더라구요",
쿨페이즈,1277,2025.10.28,여우야+,https://cafe.naver.com/fox5282/4462209,연어장새우,저는 개인적으로 쿨페이즈 효과 너무 좋았어용 쿨링기능 있어서 통증도 없구요 얼굴탄력 탱탱하게 붙었어요 ㅎㅎㅎㅎ 멍들거나 붓거나 하지도 않아서 그냥 바로 카페 가서 커피도 마셨어요,
쿨페이즈,1278,2025.10.28,시크먼트,https://cafe.naver.com/parisienlook/5612072,원키더맥스,안아프고 효과 좋은거는 쿨페이즈용 쿨링시스템 있어서 전혀 아프지 않고 그냥 따뜻한 느낌만 들더라구요 ㅎㅎ 피부탄력 쫀쫀하게 붙었고 피부결도 좋아졌어요,
쿨페이즈,1279,2025.10.28,시크먼트,https://cafe.naver.com/parisienlook/5611412,원키더맥스,"쿨소닉+쿨페이즈 쿨쿨 조합은 어떠세용? 리프팅이랑 탄력 동시에 효과 볼 수 있어요~ 냉각기능 있어서 통증도 없고 멍, 붓기 안들어서 부담없이 받기 좋아요!",
쿨페이즈,1280,2025.10.28,파우더룸,https://cafe.naver.com/cosmania/38253769,마법의봉,저는 쿨페이즈 받았어요! 탄력 너무 떨어지고 피부결도 거칠어져서 받은건데 피부탄력 붙으면서 잔주름이나 모공 정리되고 피부결도 좋아졌어요 ㅎㅎㅎ 식 받기 한달 전쯤 받았어요 멍이나 붓기도 안들어서요,
쿨페이즈,1281,2025.10.28,파우더룸,https://cafe.naver.com/cosmania/38253309,마법의봉,"쿨페이즈여 이건 멍이나 붓기 전혀 없어서 저도 다음날 바로 출근했어요 탄력이랑 잔주름, 모공 동시에 정리되면서 효과 봤어요",
쿨페이즈,1282,2025.10.28,파우더룸,https://cafe.naver.com/cosmania/38253400,마법의봉,저도 요즘 얼굴라인도 울퉁불퉁하고 엉망이라서 쿨페이즈 받았어용~ 탄력 올라오면서 전체적으로 얼굴라인 정리돼서 갸름해지더라구요 ㅎㅎ 역시 시술이 좋긴 좋다 싶어요,
쿨페이즈,1283,2025.10.28,여우야,https://cafe.naver.com/feko/10019544,미래향기,쿨페이즈 진짜 ㅋㅋㅋ 담번에는 쿨소닉 같이해서 무통 리프팅 시너지 경험하려고요 글구 아프지 않다 보니 부담감 제로라는게 무슨 말인지 알거 같아요,
쿨페이즈,1284,2025.10.28,여생남정,https://cafe.naver.com/suddes/3974945,연꽃노래,ㅋㅋㅋ 저 진짜 쿨쿨 제대로 경험 중 2차 문제도 없고요 암튼 쭉 하면서 효과 잘 유지 해볼 생각이에요 쿨페이즈 쿨소닉 둘 다 인정!,
쿨페이즈,1285,2025.10.28,여우야,https://cafe.naver.com/feko/10038829,불평의신,저는 쿨페이즈랑 쿨소닉 같이 받고 거울 보자마자 진짜 놀랐어요 얼굴이 환해지고 피부결이 매끄러워져서 요즘 자꾸 셀카 찍게 돼요ㅋㅋㅋ 진짜 무통인것도 좋지만 효과도 좋으니 하길 잘한듯,
쿨페이즈,1286,2025.10.28,여우야,https://cafe.naver.com/feko/10038832,불평의신,쿨페이즈랑 쿨소닉 했는데 시술 중에 시원해서 하나도 안 아팠어요 끝나고 나니까 피부가 탄탄해진 게 느껴졌어요 두 개 조합이 딱이네요~,
쿨페이즈,1287,2025.10.28,여우야,https://cafe.naver.com/feko/10038845,불평의신,쿨소닉으로 속탄력 채워주고 쿨페이즈로 라인 다듬으니까 얼굴 전체가 정리된 느낌이에요!! 굳이 다른 조합으로 안해도 충분하네요,
쿨페이즈,1288,2025.10.28,여우야,https://cafe.naver.com/feko/10038908,불평의신,리프팅 생각하고 계신거면 쿨소닉에다 쿨페이즈 조합 하셔요! 두개 다 병행했는데 다들 얼굴 좋아졌다고 하더라구요 붓기 없고 피부에 생기 돌고 진짜 관리받은 티 나요ㅋㅋㅋ,
쿨페이즈,1289,2025.10.28,여우야+,https://cafe.naver.com/fox5282/4464576,봄날의기억,저도 쿨소닉으로 얼굴선 정리해줬는데 통증 없어서 너무 좋더라고요! 쿨페이즈까지 같이 받았더니 피부결도 정돈되서 얼굴 전체가 훨씬 깨끗하고 또렷해짐 ㅎㅎ 두 시술 조합이 진짜 찐조합같아요~,
쿨페이즈,1290,2025.10.28,여우야+,https://cafe.naver.com/fox5282/4462535,봄날의기억,전 쿨소닉에 쿨페이즈까지 같이 받았는데 턱 밑 볼살 정리 싹 됐는데 피부결까지 좋아져서 확실히 피부가 매끈해졌어요!,
쿨페이즈,1291,2025.10.28,여우야,https://cafe.naver.com/feko/10039292,다정한고래,쿨소닉이 통증없고 붓기도 없어서 좋죠 ㅎㅎ 저는 쿨페이즈도 같이 받았는데 피부가 엄청 탄탄해져서 앞으로 이 조합으로 꾸준히 받으려고요,
쿨페이즈,1292,2025.10.28,여우야,https://cafe.naver.com/feko/10038284,다정한고래,저는 얼굴선은 쿨소닉으로 정리해주고 피부결은 쿨페이즈로 매끈하게 정리해줬더니 피부 완성됐어요! 통증없이 효과좋아서 이 조합도 한번 생각해보세요!,
쿨페이즈,1293,2025.10.28,여우야+,https://cafe.naver.com/fox5282/4462264,봄날의기억,저는 쿨소닉이랑 쿨페이즈요~ 이렇게 받고나서 윤곽도 또렷해지고 피부가 정돈되니 전체적으로 인상이 부드러워졌어요,
쿨페이즈,1294,2025.10.28,여우야,https://cafe.naver.com/feko/10038829,다정한고래,쿨소닉이 리프팅 효과 눈에띄게 나오고 쿨페이즈는 톤업이랑 피부결 개선 확실해서 같이 받으시면 서로 보완되서 효과 완벽해요~,
쿨페이즈,1295,2025.10.28,여우야+,https://cafe.naver.com/fox5282/4462517,봄날의기억,유지력도 좋지만 쿨소닉이랑 쿨페이즈 같이 받으면 리프팅이랑 피부결 동시에 개선되니까 같이 받았을때 균형잡힌 리프팅 효과가 너무 좋아요 ㅎㅎ,
쿨페이즈,1296,2025.10.28,여우야+,https://cafe.naver.com/fox5282/4462504,봄날의기억,저도 쿨소닉 받고나서 이중턱 깔끔해졌어요! 전 쿨페이즈도 같이 받았는데 피부까지 매끈하게 정리되니까 셀카 각도가 달라졌어요 ㅋㅋ,
쿨페이즈,1297,2025.10.28,여우야,https://cafe.naver.com/feko/10037841,다정한고래,저는 쿨페이즈랑 쿨소닉 같이 받았는데 둘다 시술 받을때 열감 거의 없고 끝나고나서 피부 정돈된 느낌 확 들어서 꾸준히 받으면서 피부 관리해주려고요~,
쿨페이즈,1298,2025.10.28,여우야,https://cafe.naver.com/feko/10036197,다정한고래,쿨소닉이 처진살 리프팅 제대로 되서 저도 만족해요! 나중에 쿨페이즈도 한번 받아보세요~ 피부 표면 매끈해져서 조명없이도 광나서 전 이조합 추천해요! ㅎㅎ,
쿨페이즈,1299,2025.10.29,여우야+,https://cafe.naver.com/fox5282/4465001,크랑크슈탄,탄력에는 쿨페이즈가 좋아요 ㅎㅎ 탄력 붙으면서 팔자주름도 흐려지고 모공도 쫀쫀해지더라구요~ 쿨링기능 있어서 통증도 전혀 없었어요,
쿨페이즈,1300,2025.10.29,여우야+,https://cafe.naver.com/fox5282/4464949,크랑크슈탄,전 나비존 모공 진짜 고민이였는데 쿨페이즈 시술 받고 탄력 올라오면서 모공타이트닝 효과도 같이 봤어요 그래서 그런지 피부결도 같이 좋아져서 요즘 화장이 진자 잘먹어요~,
쿨페이즈,1301,2025.10.29,여우야+,https://cafe.naver.com/fox5282/4465186,크랑크슈탄,아예 없어지진 않았지만 저는 쿨페이즈 받고 팔자주름 진짜 많이 흐려졌어요 이제 거의 안보이는 정두?탄력 쫀쫀하게 붙으면서 주름도 정리되고 얼굴선도 갸름해졌어요ㅎㅎ,
쿨페이즈,1302,2025.10.29,여우야+,https://cafe.naver.com/fox5282/4464735,크랑크슈탄,"잔주름에 효과 좋대여 근데 쿨페이즈도 괜찮아용 이것도 피부탄력, 잔주름, 피부결 동시에 효과 볼 수 있더라구요 쿨링시스템 있어서 통증도 전혀 없고 멍이나 붓기도 안들었어요",
쿨페이즈,1303,2025.10.29,여우야+,https://cafe.naver.com/fox5282/4464143,크랑크슈탄,전 탄력때문에 쿨페이즈 받았는데 찐만족이에여 ㅋㅋㅋ 탄력 쫀쫀하게 붙음서 잔주름이나 모공도 같이 정리됐어용 통증이나 멍 붓기 없어서 바로 일상생활 가능하구요!!,
쿨페이즈,1304,2025.10.29,여우야,https://cafe.naver.com/feko/10040968,오딘파워덕후,저는 탄력 떨어져서 쿨페이즈로 받았는데 이거만 받아도 효과 있었어요!! 얼굴탄력 탱탱하게 올라오면서 피부결까지 같이 좋아져서 요즘 화장도 잘먹구요 ㅎㅎㅎㅎ 멍이나 붓기 안들어서 바로 출근도 했었어요,
쿨페이즈,1305,2025.10.29,여우야,https://cafe.naver.com/feko/10040530,오딘파워덕후,"관리 개념으로 가볍게 하시려면 실 보다는 레이저로 받아보세용 저 쿨페이즈 받는데 탄력이랑 잔주름 피부결 관리 잘되고 통증이랑 멍, 붓기 없어서 그냥 가볍게 관리차원으로 받기 좋더라구요",
쿨페이즈,1306,2025.10.29,여우야,https://cafe.naver.com/feko/10040522,오딘파워덕후,심한편은 아니니깐 가볍게 쿨페이즈 받아 보세용 탄력 붙으면서 저런 팔자주름도 연해지더라구요 ㅎㅎ 저는 일년에 한번씩만 받아도 충분히 효과 있어서 그렇게 하고 있어요,
쿨페이즈,1307,2025.10.29,여우야,https://cafe.naver.com/feko/10040453,오딘파워덕후,저는 쿨페이즈 ㅊㅊ이요 처음 받으시면 더더욱이요 ㅋㅋㅋ 쿨링기능 있어서 아프지도 않고 다운타임도 없어요 탄력 붙으면서 자연스럽게 얼굴선이랑 정리됐어요!,
쿨페이즈,1308,2025.10.29,여우야,https://cafe.naver.com/feko/10040445,오딘파워덕후,그렇죵 저는 쿨페이즈만 받아도 효과 있어요 전 1년정도 가더라구요 그래서 1년에 한번 받아요 그럼 피부탄력 올라오면서 잔주름이나 피부결 정리되더라구요,
쿨페이즈,1309,2025.10.29,성형위키백과,https://cafe.naver.com/juliett00/1532683,나의꿈이야기,저도 탄력 떨어짐 때문에 얼굴선이랑 엉망이였는데 이번에 쿨페이즈 받고 싹 정리했어용 탄력 쫀쫀하게 올라오면서 심부볼이랑 얼굴라인 정리되더라구요 쿨링기능 있어서 통증 없어가지고 너무 좋았어요 ㅜㅜ,
쿨페이즈,1310,2025.10.29,성형위키백과,https://cafe.naver.com/juliett00/1532568,나의꿈이야기,"쿨페이즈요!! 이건 쿨링시스템 있어서 통증도 없고 멍, 붓기 전혀 없어요 그래서 저 바로 다음날 출근했습니다요 ㅋㅋ일주일도 안돼서 효과도 바로 올라오더라구요",
쿨페이즈,1311,2025.10.29,성형위키백과,https://cafe.naver.com/juliett00/1532540,나의꿈이야기,얼굴살 없으면 고주파로 하는게 좋아서 저도 쿨페이즈 받아요! 탄력 자연스럽게 올라오면서 얼굴라인이나 턱선 정리되더라구용 쿨링시스템 있어서 통증도 전혀 없어요,
쿨페이즈,1312,2025.10.29,성형위키백과,https://cafe.naver.com/juliett00/1532455,나의꿈이야기,"얼굴 전체적으로 탄력 한번 끌어올려줘보세용 저 쿨페이즈 받고 나니 탄력 올라오면서 자연스럽게 주름이나 얼굴선 정리됐어요 통증 멍, 붓기 없어서 바로 일상생활도 가능해서 부담없이 받기 좋아요",
쿨페이즈,1313,2025.10.29,성형위키백과,https://cafe.naver.com/juliett00/1532426,나의꿈이야기,"입문용으면 쿨페이즈도 괜찮아용! 쿨링기능 있어서 전혀 아프지도 않고 멍, 붓기 안들기 때문에 전 바로 일상생활도 했어요 ㅎㅎㅎ 피부탄력이랑 잔주름, 피부결 같이 정리돼서 좋더라구요",
쿨페이즈,1314,2025.10.29,여생남정,https://cafe.naver.com/suddes/3977827,감쮸,쿨페이즈도 안아프더라구용 이것도 쿨링기능이 있어서요 ㅎㅎㅎ 무엇보다 멍이랑 붓기가 안들어서 바로 다음날 출근도 가능해서 저 같은 직장인들이 받기 좋은거 같아요,
쿨페이즈,1315,2025.10.29,여생남정,https://cafe.naver.com/suddes/3977696,감쮸,통증 없는거는 쿨페이즈 유명하쥬  ㅎㅎ 쿨링기능 덕분에 시술시 따뜻한 느낌만 있어요 다운타임도 없어서 바로 효과 올라와서 좋더라구요,
쿨페이즈,1316,2025.10.29,여생남정,https://cafe.naver.com/suddes/3977689,감쮸,전 탄력 때문에 쿨페이즈 받았는데 이거 1도 안아파용~ 멍이랑 붓기도 안들어요 ㅎㅎ 일주일도 안돼서 피부탄력 쫀쫀하게 올라오면서 잔주름이나 피부결 정리 됐어요,
쿨페이즈,1317,2025.10.29,여생남정,https://cafe.naver.com/suddes/3977731,감쮸,전 쿨페이즈 받았는데 이건 다운타임 없어용 시술받고 바로 친구들 만났어요 다음날 출근도 하구요 ㅋㅋㅋ 쿨링기능 있어서 피부자극도 안가고 통증도 없어서 부담없이 꾸준히 받기 좋은거 같아요,
쿨페이즈,1318,2025.10.29,여생남정,https://cafe.naver.com/suddes/3977785,감쮸,맞아요 ㅜㅜ저도 어느순간 거울보면 너무 스트레스 받더라구요 그래서 결국 쿨페이즈 받았어요 ㅜㅜ 진작 받을걸 후회중이에요 시술받고 탄력 붙으면서 피부 텐션이 확실히 좋아졌어요 피부결도 매끈해지구요,
쿨페이즈,1319,2025.10.29,시크먼트,https://cafe.naver.com/parisienlook/5612880,하늘아래두빛,"ㅇㅈ이요 시술이 낫죠 저는 쿨페이즈 받아용 이거 받음 탄력 올라오면서 잔주름, 피부결 동시에 좋아져서요 ㅎㅎㅎ 그리고 얼굴라인 울퉁불퉁 했던것도 정리되구요",
쿨페이즈,1320,2025.10.29,시크먼트,https://cafe.naver.com/parisienlook/5612587,하늘아래두빛,팔자주름은 쿨페이즈 시술 받고 자연스럽게 얼굴탄력 붙으면서 정리되더라구요 아예 없어지진 않아도 이제 거의 안보이는 수준이에요 ㅎㅎㅎ 쿨링기능 있어서 아프지 않고 다운타임 없어서 바로 일상생활 가능해서 좋아요,
쿨페이즈,1321,2025.10.29,파우더룸,https://cafe.naver.com/cosmania/38254152,내꿈과이상,얼굴라인 정리해주는 리프팅 찾으시면 쿨페이즈로 받아 보세용 얼굴라인도 정리되고 피부결도 좋아지더라구요 ㅎㅎ 쿨링기능 있어서 통증은 전혀 없구요,
쿨페이즈,1322,2025.10.29,파우더룸,https://cafe.naver.com/cosmania/38254137,내꿈과이상,저는 써마지 받으려다가 쿨페이즈 받았어용 통증없다고 해서요 ㅎㅎ 피부탄력 붙으면서 잔주름이나 모공도 같이 정리돼서 피부결도 같이 좋아졌어요,
쿨페이즈,1323,2025.10.29,재잘재잘,https://cafe.naver.com/knife67/460683,나의꿈이야기,"입문하시는거면 쿨페이즈도 괜찮아용 통증, 멍, 붓기 전혀 없고 탄력이랑 잔주름 피부결까지 동시에 효과 볼 수 있어요 진짜 부담없이 꾸준히 받기 좋은 시술인거 같아요",
쿨페이즈,1324,2025.10.29,여우야,https://cafe.naver.com/feko/10027433,여행캐리어,쿨페이즈 ㅋㅋ 진짜 인정 아프지 않구 전후 차이도 잘 나오고 있어서 주변 지인들한테 저는 강추 중이에요 ㅋㅋㅋ !!,
쿨페이즈,1325,2025.10.29,여우야,https://cafe.naver.com/feko/10041929,내맘을아시나요,전 무통 리프팅 처음엔 반신반의했는데 시술 받고 나니까 이유 알겠어요 쿨소닉이 탄력 채워주고 쿨페이즈가 얼굴선을 자연스럽게 정리해줬어요ㅋㅋ,
쿨페이즈,1326,2025.10.29,여우야+,https://cafe.naver.com/fox5282/4457303,헤이즐넛아몬드,ㅋㅋㅋㅋㅋ 확실히 리프팅 잘하는 곳은 다 이유가 있더라고요 암튼 쿨페이즈 진짜 인정 마취도 없구 무통쓰 ~~,
쿨페이즈,1327,2025.10.29,여우야,https://cafe.naver.com/feko/10041952,내맘을아시나요,ㅠㅠ 저는 피부가 예민한 편인데 자극 하나 없이 오히려 촉촉해졌어요 쿨소닉+쿨페이즈 조합이 진짜 안정적이에요 이 것도 함 생각 해보셔요,
쿨페이즈,1328,2025.10.29,여우야,https://cafe.naver.com/feko/10041883,내맘을아시나요,레이저도 괜찮으시면 쿨페이즈랑 쿨소닉 조합 하셔요!! 마취 안 하고 바로 진행했는데도 전혀 아프지 않았어요 쿨소닉이 속탄력 쿨페이즈가 윤곽을 잡아줘서 얼굴이 부드럽게 변함,
쿨페이즈,1329,2025.10.29,여우야,https://cafe.naver.com/feko/10041801,내맘을아시나요,제가 시술 받은 쿨쿨 조합은요?? 쿨페이즈+쿨소닉인데 시술 받고 나서 피부가 맑아지고 얼굴선이 생김 글구 쿨페이즈랑 쿨소닉 시너지 덕분에 얼굴이 훨씬 정돈된 느낌이에요ㅋㅋㅋㅋ,
쿨페이즈,1330,2025.10.29,여우야,https://cafe.naver.com/feko/10041799,내맘을아시나요,쿨페이즈+쿨소닉 추천요 무통이면서 마취 진행 없어요 그리고 두 개 같이 하니까 얼굴 전체가 정리되면서 자연스러운 탄력감이 느껴졌어요 화장할 때도 훨씬 잘 먹더라구요,
쿨페이즈,1331,2025.10.29,여우야,https://cafe.naver.com/feko/10018687,한재이닝,상담가서 피부검사 받고 저는 쿨페이즈로 탄력이랑 잔주름들 위주로 레이저 리프팅 받았네요 윤곽주사나 다른 보톡스는 필요없다고 했어요,
쿨페이즈,1332,2025.10.29,여우야,https://cafe.naver.com/feko/10043767,나의별이야,"쿨페이즈가 고주파 리프팅이고 특허받은 쿨링시스템으로 예민한 피부에도 큰 부담 없이 탄력, 피부결, 주름 관리할 수 있죠 시간지나면 콜라겐 촉진덕에 피부 팽팽하니 모공도 좁아지는게 느껴져요",
쿨페이즈,1333,2025.10.29,여생남정,https://cafe.naver.com/1msanbu/3236991,무화과,"상담가면 피부 진단받고 맞는 시술방법 등등 설명해줘요~ㅎㅎ 쿨페이즈는 냉각기능이 있어 통증, 다운타임이 없는데 고주파라 시간지날수록 콜라겐이 차오르면서 피부가 탱글탱글해졌네요",
쿨페이즈,1334,2025.10.29,여우야,https://cafe.naver.com/feko/10043534,나의별이야,"웨딩전에 관리 싹 하는거죠ㅎㅎ!! 피부관리로 쿨페이즈도 많이들 하는데 쿨링기능으로 피부 열감 조절해주거든요 그래서 통증도 없고 다운타임도 없어서 중요한 행사전에 관리하기 딱 좋아요 탄력, 잔주름, 피부결, 모공 효과 봤어요",
쿨페이즈,1335,2025.10.29,여우야,https://cafe.naver.com/feko/10043234,나의별이야,공장형에서 받는거 비추입니당ㅠㅠ 저는 탄력관리로 쿨페이즈 했는데 원장님이 고민 부위별로 샷수 디자인 꼼꼼하게 해줘서 얼굴라인 정리만 아니라 주름진 부분까지 팽팽해질 수 있었어요,
